nom,pays,favorite,date,titre,bons_points,mauvais_points,note,type_etablissement,lieu,note_etablissement
Marina,France,1,2018-06-25,Regroupement entre copines,"Les lieux sont très très proches, tout est pensé au détail prêt.
Le parking du nouveau siècle a 1 minute pour seulement 12€ les 24h.
La flexibilité des horaires est très pratique pour un séjour. 
Tout était parfait jusqu’a La literie, la crème pour les mains, le café bref je reviendrai",Rirn,10,Appart'hôtel,Lille," 8,7 "
Jean,France,0,2020-02-07,Appartement avec 2 chambres en étage super bien situé,"L'emplacement, la disposition en 2 étages",Un pommeau de douche bloqué,"8,0",Appart'hôtel,Lille," 8,7 "
Sandrine,France,0,2019-11-03,Fabuleux ,L’emplacement au cœur du centre de Lille.,Insonorisation des logements. Quelques prises électriques défectueuses à revoir.,"9,2",Appart'hôtel,Lille," 8,7 "
Lucie,France,0,2019-10-20,Exceptionnel,Lit très confortable,"Manque de thé, sol très froid lorsqu’on marche pieds nus",10,Appart'hôtel,Lille," 8,7 "
Paul,Chine,0,2019-07-11,The quality in city center !,"Très bien équipé 
Belle localisation
Très propre et moderne",Un petit peu cher,"9,2",Appart'hôtel,Lille," 8,7 "
Marvin,France,0,2019-07-04,Exceptionnel,La qualité de la chambre la déco l’hygiene,None,10,Appart'hôtel,Lille," 8,7 "
Mary77700,France,0,2019-07-01,Sublime !!,"La gentillesse du personnel, l'emplacement (au cœur du vieux Lille), l'appartement.. Waouuu quelle surprise !!! Nous avons adoré !! La déco est top !!! ( surtout la salle de bain au rez de chaussée).. Les chambres sont spacieuses et confortables (mention spéciale pour les lampes), le logement est entièrement climatisé, et pour couronner le tout : il y a une terrasse !! Le pied!! Nous avons trouvé une super adresse que nous ne sommes pas prêtes d'oublier... Nous reviendrons !!",Rien.. Tout était parfait !!,"9,6",Appart'hôtel,Lille," 8,7 "
David,France,0,2019-06-15,Excellent rapport qualité prix,Tout le reste,Horaire d arrive un peu tard,10,Appart'hôtel,Lille," 8,7 "
Antoine,France,0,2019-05-22,Très bonne nuit dans cet hôtel ou la qualité est au rendez-vous.,"L'ensemble de la prestation est de très bonne qualité. Lit, salle de bain, équipement, luminosité, calme. On s'y sent bien.",R.A.S.,"9,2",Appart'hôtel,Lille," 8,7 "
Alexis,France,0,2019-05-19,Fabuleux ,Situation géographique,None,"9,2",Appart'hôtel,Lille," 8,7 "
Carine,France,0,2019-04-22,Très bien,"Bel appart hôtel , design , fonctionnel 
Belle superficie
Bon emplacement
Très bien pour un court séjour , notamment pro",None,"8,3",Appart'hôtel,Lille," 8,7 "
Herve,France,0,2019-04-21,Exceptionnel,Magnifique appartement. Très bien agencé et avec de beaux espaces. Belle vue sur la ville. Belle situation.,Il faut dormir la fenêtre fermée car il y a un peu de bruit dehors (pas mal de restaurants aux alentours),"9,6",Appart'hôtel,Lille," 8,7 "
24nior,France,0,2019-04-14,Bien ,"L'appartement est très pratique, bien équipé, confortable surtout bien situé !",L'accès à la réception depuis l'appartement n'est pas accessible et si besoin de quelque chose il faut ressortir et faire le tour du quartier et passer par l'autre porte. Car pas de téléphone et in joignable par téléphone,"7,9",Appart'hôtel,Lille," 8,7 "
Claire,France,0,2019-03-28,Bien ,propreté et caractère fonctionnel,"pas du tout de service (je n'avais pas compris ça dans la formule présentée sur Booking), pas de petit déjeuner, lavabo bouché.","7,5",Appart'hôtel,Lille," 8,7 "
Frederig,France,0,2019-02-23,Exceptionnel,"Emplacement 
Grandeur de l’appartement 
Le design","Le bruit à l’extérieur ( mais bon, un vendredi soir en centre ville ...)","9,6",Appart'hôtel,Lille," 8,7 "
Alice,France,0,2019-01-21,Appart design en plein centre (mais manque de professionnalisme),"L'appartement était conforme au photo: design, très propre et pratique ! Coke est surtout très bien situé: à 10 min de la gare de Lille Flandres et en plein centre du vieux lille","L'accueil a été fait par un employé qui travaillait au restaurant et qui ne nous a pas expliqué comment se déroulait le check out. Nous avons donc eu toutes les peines à récupérer nos affaires que nous avions laissé le dernier jour pour nous ballader. Renseignez vous avant de laisser vos affaires à la ""bagagerie""","8,8",Appart'hôtel,Lille," 8,7 "
Antoine,France,0,2019-01-13,"L'ensemble de la prestation est à la hauteur et on se sent bien dans cet environnement sobre, épuré","L'ensemble de la prestation est à la hauteur et on se sent bien dans cet environnement sobre, épuré et chaleureux.",None,"9,6",Appart'hôtel,Lille," 8,7 "
Isabelle,France,0,2019-01-07,Exceptionnel,Très bien placé au cœur de Lille. Appartement fonctionnel idéal pour 4 personnes.,None,10,Appart'hôtel,Lille," 8,7 "
Philippe,France,0,2018-12-31,Fabuleux ,"La situation en plein centre-ville de Lille
L'appartement tres confortable et bien agencé.",Espace repas un peu petit.,"9,2",Appart'hôtel,Lille," 8,7 "
Pascal,France,0,2018-12-28,Exceptionnel,Bon emplacement au cœur de Lille . Confort. Tranquillité.,None,"9,6",Appart'hôtel,Lille," 8,7 "
Cannoletta,Belgique,0,2018-12-25,Superbe,"La proximité du centre ville et du parking 
La grandeur des chambres 
La propreté 
L’équipement de la cuisine .",None,"8,8",Appart'hôtel,Lille," 8,7 "
Katy,France,0,2018-12-09,Séjour agréable,"Appartement spacieux et agréable.
Localisation de l'hôtel très pratique",Propreté à revoir. Des réparations techniques par endroit sont à prévoir,"7,9",Appart'hôtel,Lille," 8,7 "
Catherine,France,0,2018-12-08,Exceptionnel,"très bon accueil à la reception 
appart hotel super bien équipé, literie parfaite et localisation idéale
nous avions besoin de 2 chambres et pour le même prix, nous avons eu 70m² avec cuisine, salon et 2 salles de bain",None,"9,6",Appart'hôtel,Lille," 8,7 "
Amandine,France,0,2018-12-06,Fabuleux ,"Emplacement parfait ! 
Decoration de gout et fonctionnel",None,"9,2",Appart'hôtel,Lille," 8,7 "
Isabelle,France,0,2018-11-27,un séjour trés agréable en famille a renouveller,"la décoration,la literie et situation géografique le calme un endroit pour ce detendre",None,10,Appart'hôtel,Lille," 8,7 "
Ludovic,France,0,2018-11-09,Appartement neuf au coeur de Lille !,"L'accueil était vraiment sympa ; on nous a présenté les lieux, le fonctionnement général de l'appartement : c'est top ! L'appartement est spacieux sur 3 étages (rdc : grand salon avec moulures, magnifique salle de bain / 1er étage : cuisine équipée dont machine à café avec dosettes, salle à manger, terrasse / 2ème étage : deux chambres et une belle salle de douche).
L'appartement est vraiment bien ; de plus vous pouvez déjeuner ou diner dans le même bâtiment (bar, brasserie ou restaurant ++). Franchement, ce lieu est top et très bien décoré.",Tout était au top ! Rien à dire. L'accès à l'appartement se fait par carte donc pas de problème. Il n'y a vraiment rien à dire de négatif. Il y a même du linge dans les salles de bain. Parfait ! Je recommande à 100%,10,Appart'hôtel,Lille," 8,7 "
Jean-luc,France,0,2018-11-05,trés bien à refaire,"situation par rapport au centre ville, possibilité de prendre un petit déjeuner à 1 minutes à pied et cela permet de changer d'endroit","que booking puisse faire l'envoi de la facture sur ma boite mail sans que je la demande
car aujourd'hui je suis en attente de la recevoir","9,2",Appart'hôtel,Lille," 8,7 "
Antoine,France,0,2018-09-23,Exceptionnel,"confort, déco, charme, accueil, situation géographique",sachets de thé dans les chambres,"9,6",Appart'hôtel,Lille," 8,7 "
Antoine,France,0,2018-09-18,Exceptionnel,"charme, confort, déco, accueil, calme, et excellente situation géographique",il manque juste des sachets de thé et tisane dans les chambresalme,"9,6",Appart'hôtel,Lille," 8,7 "
Sophie,France,0,2018-09-06,Fabuleux ,La propreté des toilettes et du sol,La propreté des toilettes et du sol,"9,0",Appart'hôtel,Lille," 8,7 "
Cyrille,France,0,2018-08-05,Génial !!!,"Confort, Qualité prix, propreté et localisation !",None,"9,6",Appart'hôtel,Lille," 8,7 "
Anonyme,France,0,2018-06-24,Un bon emplacement et un appartement confortable,L'emplacement et les équipement ainsi que le lit,None,"7,9",Appart'hôtel,Lille," 8,7 "
Aymeric,France,0,2019-12-27,Bien ,Emplacement et décoration fonctionnelle / design,Équipements de cuisine pas propres ( four entre autres). Lave vaisselle qui ne lave pas.,"7,1",Appart'hôtel,Lille," 8,7 "
Marie,France,0,2019-10-12,Il s'en faut de peu pour que ce soit parfait,"Literie parfaite 
Grandes salle de bain
Situation idéale 
Grand appartement","Manque bols ou mugs
Doubles rideaux à revoir 
Cuvette WC à détartrer 
Table et 1 chaise un peu bancales
Prévoir une petite table + lampe de chevet dans le salon","7,1",Appart'hôtel,Lille," 8,7 "
Marie,France,0,2019-07-21,Bien ,Emplacement centre ville… génial…,"manque de ménage, la propreté laissait à désirer","7,0",Appart'hôtel,Lille," 8,7 "
Arnaud,France,0,2019-03-09,Agréable,Style et décoration contemporaine simple et épurée. Très bon emplacement,"déçus par la tenue : poussières sans les lampes, rideaux décrochés, tableau électrique en cours de montage avec fils électriques appartements, lampes de chevets de la chambre ne fonctionnent pas .... dommage pour ce standing.","6,2",Appart'hôtel,Lille," 8,7 "
Sofia,France,0,2019-02-18,Nous avons été toutes les 3 déçues mais avons apprécie sa localisation,"L'emplacement et le style décoratif de l'appartement. 
Le personnel est très accueillant et souriant.
Flexibilité des horaires de check in et check out.","Propreté : miettes de pain dans la cuisine, poussière, vaisselle laissant à désirer, petite tâche brunâtre sur le drap du canapé-lit, 
Frigo très bruyant sachant que 2 personnes sont censés dormir dans le salon, 
Pas assez de papier toilettes : 2 rouleaux pour deux jours et une réservation prévue pour 4 personnes, 
Certaines lumières nécessaires ont été impossible à allumer notamment les lampes de chevets et la lumière principale de la salle de bain qui a donc manqué de luminosité. La lumière des pièces de vie est gérée par un boitier de 7 ou 8 boutons qui restent une énigme même pour le personnel. 
Manque d'eau chaude : la 3ème personne a dû se laver à l'eau froide. Nous étions censé être 4....","5,8",Appart'hôtel,Lille," 8,7 "
Virginia,France,0,2018-10-06,"bien placé, appartements propre et spacieux","une petite chose à améliorer, il faut plus de lumière dans la salle de bains,",la luminosite de la salle de bain,"3,3",Appart'hôtel,Lille," 8,7 "
Hervé,France,0,2018-09-17,Bien ,"L'emplacement remarquable. La surface et le confort des chambres, dont les lits.","Accueil très moyen. Beaucoup de petits problèmes dans la chambre (lampes et éclairage défaillant, propreté SdB insuffisante). Laissés à nous même le dimanche.","7,1",Appart'hôtel,Lille," 8,7 "
Brice,France,0,2018-09-12,Passable,"Clim en panne. pas de changements de serviette. obligé de demandé du papier toilette......
Badge désactivé de soir de suite","Clim en panne. pas de changements de serviette. obligé de demandé du papier toilette......
Badge désactivé de soir de suite","5,0",Appart'hôtel,Lille," 8,7 "
Anonyme,France,0,2020-01-02,Très bon séjour,"Logement spacieux et moderne 
Rapport qualité/prix
Emplacement
Gentillesse du personnel",Logement un peu sombre,"8,8",Appart'hôtel,Lille," 8,7 "
Anonyme,France,0,2019-04-29,Fabuleux ,Confort,Stationnement difficile,"9,2",Appart'hôtel,Lille," 8,7 "
Luc,France,0,2020-02-23,Bien ,Ce client n'a pas laissé de commentaire.,None,"7,9",Appart'hôtel,Lille," 8,7 "
Yannick,France,0,2020-02-14,Exceptionnel,Ce client n'a pas laissé de commentaire.,None,10,Appart'hôtel,Lille," 8,7 "
Jean-yves,France,0,2020-01-30,Exceptionnel,Ce client n'a pas laissé de commentaire.,None,10,Appart'hôtel,Lille," 8,7 "
Celine,France,0,2019-12-16,Fabuleux ,Ce client n'a pas laissé de commentaire.,None,"9,0",Appart'hôtel,Lille," 8,7 "
Marine,France,0,2019-11-10,Fabuleux ,Ce client n'a pas laissé de commentaire.,None,"9,2",Appart'hôtel,Lille," 8,7 "
Brigitte,France,0,2019-11-01,Fabuleux ,Ce client n'a pas laissé de commentaire.,None,"9,0",Appart'hôtel,Lille," 8,7 "
Lucie,Belgique,0,2019-10-27,Exceptionnel,Ce client n'a pas laissé de commentaire.,None,10,Appart'hôtel,Lille," 8,7 "
Sophie,Luxembourg,0,2019-10-14,Exceptionnel,Ce client n'a pas laissé de commentaire.,None,"9,6",Appart'hôtel,Lille," 8,7 "
Anto,France,0,2018-07-11,"Appart sympa dans immeuble glauque, mais tres bien situé","Situation en plein coeur de la ville et l'appartement en lui même : cuisine neuve, bel espace","L'immeuble en lui même intérieurement est horrible, avec une odeur !!!! L'ascenseur fait peur.","7,1",Appartement,Lille," 8,3 "
Virginie,France,0,2018-12-16,Exceptionnel,Ce client n'a pas laissé de commentaire.,None,10,Appartement,Lille," 8,3 "
Helene,France,0,2019-02-19,Agréable séjour,L'emplacement Top et appartement avec du charme,"Le confort des lits bof.
1 couverture manquante.","7,5",Appartement,Lille," 8,3 "
Eric,France,1,2019-07-12,Exceptionnel,Proximité du vieux Lille. Propreté. Équipement.,None,10,Appartement,Lille," 9,4 "
Frederic,France,0,2019-08-14,Exceptionnel,"Très bon accueil 
Excellent emplacement, très bien équipé et agréable. Splendide terrasse !",None,10,Appartement,Lille," 9,4 "
Catherine,France,0,2019-07-31,Excellent,"Appartement très bien situé,calme et avec une grande terrasse très bien aménagée avec plantes canapé table chaise longue donc super agréable. L’appartement est aménagé de façon très fonctionnelle et il y a tous les basiques dont on a besoin: sel produit vaisselle café... une fois arrivé il suffit donc de poser ses valises et partir à la découverte de Lille. Le propriétaire est vraiment sympathique et soucieux de ses hôtes. Il répond immédiatement au téléphone et est très réactif. Je recommande vivement cet appartement.",Le canapé lit manque de confort.,"9,6",Appartement,Lille," 9,4 "
Anais,France,0,2019-07-15,Superbe,La terrasse et l’équipement moderne.,La chambre est petite,"8,8",Appartement,Lille," 9,4 "
Bertrand,France,0,2019-07-07,"Sinon, agréable séjour",Situation géographique,"Odeurs de canalisation, toilettes et lavabo salle de bain (faudrait mettre un produit adapté), rien à voir avec la propreté ( cette dernière était irréprochable). Prix plutôt élevé pour le parking.","9,5",Appartement,Lille," 9,4 "
Orlando,France,0,2019-07-28,Agréable,La terrasse même si durant notre séjour la pluie n'a eu de cesse.,L'attente pour nous ouvrir sous la pluie.,"6,7",Appartement,Lille," 9,4 "
Cyril,France,0,2019-09-02,Exceptionnel,Ce client n'a pas laissé de commentaire.,None,10,Appartement,Lille," 9,4 "
Anonyme,France,0,2019-09-02,Exceptionnel,Ce client n'a pas laissé de commentaire.,None,"9,6",Appartement,Lille," 9,4 "
Sandra,Pays-Bas,1,2018-07-17,agreable et calme,"les canapes et lits sont confortables, l'appartement est agreable et tres pres du centre ville, du parc, et de restaurants sympas.
Et surtout pour le petit dej., il y a une tres bonne boulangerie a cote, avec jus d'oranges pressees!",None,10,Appart'hôtel,Lille," 8,8 "
Amélie,France,0,2020-03-12,Très bien,Le manque de volets et l’accès par escalier abrupt,Le manque de volets et l’accès par escalier abrupt,"8,0",Appart'hôtel,Lille," 8,8 "
Raphael,Belgique,0,2020-02-29,Exceptionnel,J'y vais régulièrement et je suis toujours satisfait.,J'y vais régulièrement et je suis toujours satisfait.,10,Appart'hôtel,Lille," 8,8 "
Ali,France,0,2020-02-06,Exceptionnel,Possibilité d'arriver à tout heure confort de la literie,L'absence de métro à proximité et gel douche,10,Appart'hôtel,Lille," 8,8 "
Antoine,France,0,2020-02-02,Exceptionnel,"L’aménagement, la situation et la propreté",Néant,10,Appart'hôtel,Lille," 8,8 "
Hervé,France,0,2020-01-24,Très bien,le calme et la situation géographique,L’utilisation du boitier pour récupérer les clés qui pourrait être de type digicode plutôt que mécanique,"8,0",Appart'hôtel,Lille," 8,8 "
Joelle,France,0,2020-01-14,Super sejour,"L'emplacement dans une rue calme, l'amenagement intérieur de la chambre avec une douche avec de l'eau bien chaude et bcp de pression. Logement propre et très lumineux. Belle vue sur la rue. 
Chauffage mis lors de notre arrivée.",L'insonnorisation. Mais les personnes du dessus ne faisaient pas attention en se déplacement: pas très lourds.,"9,0",Appart'hôtel,Lille," 8,8 "
Marie,France,0,2020-01-05,Fabuleux ,"Excellent emplacement pour visiter le vieux Lille à pied. L'appartement est propre, joliment décoré et bien équipé.",None,"9,0",Appart'hôtel,Lille," 8,8 "
Promhealth,France,0,2019-12-11,"Très bel appartement, très agréable, au calme : à refaire avec plaisir","Très bel appartement, bien situé. Confort OK
Facile d'y accéder, places de stationnement devant l'immeuble
WIFI OK","L'escalier extérieur est inquiétant la nuit avec la pluie : pas facile de descendre car ça glisse beaucoup
Manque un peu de lumière dans la petite cour quand on arrive de nuit","8,0",Appart'hôtel,Lille," 8,8 "
Karina,France,0,2019-12-08,Fabuleux ,Ce client n'a pas laissé de commentaire.,None,"9,0",Appart'hôtel,Lille," 8,8 "
Pershon,France,0,2019-12-05,Très satisfaite! je pense revenir en Janvier pour d'autre journée de formation !!,"Pratique Propre Bien situé 
Pas de vue particulière mais normal c'est dans une rue piétonne
sympa!!",Peut être indiqué que des escaliers a colimaçon étroit sont a monté pas facile pour tout le monde c est peut être la chose a préciser :),"9,0",Appart'hôtel,Lille," 8,8 "
Marion,France,0,2019-11-24,Exceptionnel,"La présence de café et de thé,le chauffage allumé avant notre arrivé. La déco simple et moderne. On se sent comme chez soi. Les bonnes adresses données avant notre arrivé par mail par l'hôte.",None,"9,6",Appart'hôtel,Lille," 8,8 "
Emeline,France,0,2019-11-14,Idéal pour une virée entre copines,"Hyper fonctionnel ! le design était très sympa et en plus bien placé tout en étant calme. 
Les indications pour récupéer les clefs ressemblent à un jeu de piste mais c'était simple finalement :-)",rien tout était parfait !,"9,0",Appart'hôtel,Lille," 8,8 "
Véronique,France,0,2019-11-11,Superbe,"L’emplacement dans le vieux Lille, le calme mais à proximité de tout ainsi que la deco simple et efficace.",RAS,"8,8",Appart'hôtel,Lille," 8,8 "
Agnes,France,0,2019-11-10,Exceptionnel,L'aménagement et la déco de l'appartement,"Il n'y a pas de porte séparant la partie salle de bain et la cuisine, cela pose un problème d'intimité et des odeurs..",10,Appart'hôtel,Lille," 8,8 "
Jean-michel,France,0,2019-11-03,Calme et situation idéale proche du centre,"La situation exceptionnelle tout près du centre sans rien sacrifier au calme ! L'appartement est très calme, aucun bruit provenant de la rue. Pour autant, on trouve pléthore de bars et restaurants à proximité. Pour le reste, l'appartement est propre et confortable.",Quelques détails pourraient être améliorés. Par exemple l'absence d’accessoires à la cuisine comme une bête éponge. La cafetière perdait de l'eau en fonctionnement et nous n'avions rien à disposition pour éponger. L'insonorisation entre la chambre à l'étage et le salon où dormaient les enfants est proche de zéro.,"8,0",Appart'hôtel,Lille," 8,8 "
Laurence,France,0,2019-10-30,Superbe,"Logement très bien placé, propre, calme, bien rénové avec suffisamment d'équipements et de vaisselle.",None,"8,8",Appart'hôtel,Lille," 8,8 "
Jeremy,France,0,2019-10-24,Superbe,Se faire réveillé par un artisan qui c acharné sur la porte,Se faire réveillé par un artisan qui c acharné sur la porte,"8,8",Appart'hôtel,Lille," 8,8 "
Bertrand,France,0,2019-10-24,Bien à part douche 🙂,Revoir la douche dur de pas en mettre partout,Douche,"8,3",Appart'hôtel,Lille," 8,8 "
Laurent,France,0,2019-10-16,Très bien,"La déco, la surface, l’aménagement",Wifi peu performant,"8,3",Appart'hôtel,Lille," 8,8 "
Thierry,France,0,2019-10-16,Exceptionnel,Literie impecable et charme de l'endroit,La boîte à clef pas pratique,"9,6",Appart'hôtel,Lille," 8,8 "
Isabelle,France,0,2019-10-04,Exceptionnel,"Bel emplacement, au calme, proche du vieux Lille. Immeuble bien réhabilité et agréable avec des chambres/studios agréables et savamment décorées.",None,10,Appart'hôtel,Lille," 8,8 "
Quentin,Belgique,0,2019-09-02,tout était vraiment nickel,"Nous avons logé au 3em étage, pour y arriver quelques escaliers en colimaçon.
Logement très agréable et propre, vue sur les toits, une petite cuisine et une salle de douche, très bonne literie 
Très chouette quartier dynamique resto, bar ......et une délicieuse boulangerie juste en bas.
Tout était vraiment parfait !!! pour notre confort nous avions choisi de prendre le parking :o)",rien à dire,"9,2",Appart'hôtel,Lille," 8,8 "
Marie,France,0,2019-09-02,Fabuleux ,"Très bien placé, appartement charmant (nous avons eu celui au 1er étage nommé Grande Chaussée). 
Hélène est très réactive et à l’écoute de nos demandes. Grand lit très confortable et salle de bain très agréable et équipée.","Lumière au réveil surtout dans le salon car aucun rideaux sur la fenêtre au dessus de la porte. Assez bruyant, on entend facilement les autres voisins car les appartements donnent sur une petite court . Et canapé lit pas d’un grand confort mais pour 1 nuit c’était très bien.","9,2",Appart'hôtel,Lille," 8,8 "
Agnès,France,0,2019-09-02,Très bien,"L'emplacement à proximité de la grande braderie tout en restant au calme ; les bonnes idées déco ; la boulangerie artisanale à 50 m ; l'acces bien expliqué et possible H24( cf arrivée très tardive) ; la parfaite disponibilité de l'hôtesse par messages interposés, la spécialité de bienvenue, les fenetres oscillo-battantes très récentes...","Ce n'est pas que je n'aie pas apprécié, mes bagages étant légers et compacts, mais il faut en tenir compte : l'escalier qui conduit à Monnaie n'est pas adapté aux grosses valises",10,Appart'hôtel,Lille," 8,8 "
Julien,France,0,2019-07-29,Exceptionnel,Très bien décoré et équipé. L'emplacement au top !,Rien,10,Appart'hôtel,Lille," 8,8 "
Naoual,France,0,2019-07-13,excellent,"Hotel bien situé, appartements agréables et lumineux.
Hélène qui gère les reservations est aux petits soins et toujours à l'écoute. Nous avons pu échanger un appartement contre un autre sans souci.
Je n'ai pas encore trouvé mieux à Lille (Qualité/prix).
tout petit bémol : les stores ne sont pas occultants et laisse passer beaucoup de lumière au petit matin.",None,"9,6",Appart'hôtel,Lille," 8,8 "
Bruno,France,0,2019-07-12,Très agréable et je recommande cet établissement,Les conseils très précis et utiles pour profiter au mieux d’un séjour Lillois,Tout était parfait.,10,Appart'hôtel,Lille," 8,8 "
Agnès,France,0,2019-06-26,Studio parfait Lille,"L'emplacement proche du centre à pied, l'appartement studio rez de chaussée était frais (très appréciable) et calme, la communication avec la propriétaire est parfaite.",La difficulté pour stationner car c'est payant partout!!,"9,6",Appart'hôtel,Lille," 8,8 "
Eric,France,0,2019-06-24,Exceptionnel,Facile d’accès beau grand parfait,"Pas de volet, luminosité me réveille mais c’est très personnel",10,Appart'hôtel,Lille," 8,8 "
Twinkie,France,0,2019-06-11,Fabuleux ,"La situation géographique au top, des commerces à proximité.",Le manque de cloison dans la douche c’est compliqué avec les enfants,"9,2",Appart'hôtel,Lille," 8,8 "
Joanna,France,0,2019-06-02,Exceptionnel,"L' établissement situé dans un quartier animé de la vieille ville. L' appartement très comfortable et bien décoré, donnant sur un cour intérieur permet de se reposer si l'on souhaite d' être au calme. Un très bon séjour!",None,10,Appart'hôtel,Lille," 8,8 "
Daniel,France,0,2019-05-25,"Pratique, cool silence lit café du matin boulangerie à 20 m .. J'y retournerai avec plaisir","Décoration 
Organisation pour réservation et conseil",le quartier n'est pas encore restauré mais cela viendra,"8,3",Appart'hôtel,Lille," 8,8 "
Davy,Martinique,0,2019-05-24,Je recommande fortement,Son emplacement,None,10,Appart'hôtel,Lille," 8,8 "
André,France,0,2019-05-12,Exceptionnel,"Ambiance sympathique des appartements anciens...duplex auquel on accède par un escalier dans une cour donc tranquille...
Restauration qui a du charme... 
lit super confortable....
Situé dans un quartier agréable et très proche du centre !!!!",None,10,Appart'hôtel,Lille," 8,8 "
Patricia,France,0,2019-05-03,Fabuleux ,"La situation est parfaite pour le vieux Lille, tout est a proximité, boulangerie, restaurants, etc...
La décoration est très sympa, thé et café offert 👍",La douche est un peu petite,"9,2",Appart'hôtel,Lille," 8,8 "
Romain,France,0,2019-04-28,Exceptionnel,Excellent !!!,None,10,Appart'hôtel,Lille," 8,8 "
Francois,France,0,2019-04-22,Exceptionnel,"Emplacement 
Propreté 
Aménagement simple et efficace 
Capsules présentes pour premier matin 
Savon et serviettes présentes contrairement à certains commentaires","Escalier un peu dangereux 
Éclairage à améliorer (interrupteurs à côté sonnettes chambres...)",10,Appart'hôtel,Lille," 8,8 "
Sébastien,France,0,2019-04-19,Très bien,"L'organisation pour un check-in /out automatisé.
La décoration
Le calme","Le sol froid
La douche trop ouverte qui projette de l'eau dans toute la salle d'eau.","8,0",Appart'hôtel,Lille," 8,8 "
Anne,France,0,2019-04-18,Tres agreable sejour,Calme propre bien situé,"Les murs blancs pourraient être rafraîchis 
La douche inonde la salle de bain",10,Appart'hôtel,Lille," 8,8 "
