nom,pays,favorite,date,titre,bons_points,mauvais_points,note,type_etablissement,lieu,note_etablissement
Reynier,France,0,2020-01-30 00:00:00,très bon séjour,le parking très pratique - ll est dans l'hôtel,la salle du petit déjeuner est trop petite,"7,0",Hôtel,Lyon," 8,3 "
Clauduc,France,0,2020-01-30 00:00:00,Très bien,"Emplacement idéal
Parking à voiture sous l'hotel",None,"8,0",Hôtel,Lyon," 8,3 "
Clélia,Suisse,0,2020-01-29 00:00:00,Parfait pour un petit week-end,"La décoration de la chambre 
Le parking facile et idéal au centre de Lyon",Rien,"9,2",Hôtel,Lyon," 8,3 "
Alexandra,France,0,2020-01-27 00:00:00,Séjour à lyon en amoureux,"L'emplacement de l'hôtel. 
Le confort de la chambre ( matelas).
Le personnel agréable.",R.A.S,"8,0",Hôtel,Lyon," 8,3 "
Julie,France,0,2020-01-27 00:00:00,Rien à redire,"Taille de la chambre, accueil du personnel et le petit déjeuner",Un peu de bruit peut être,"8,0",Hôtel,Lyon," 8,3 "
Corentin,France,0,2020-01-26 00:00:00,Très bien,Le parking souterrain et le monte charge pour les voitures c'est top,None,"8,0",Hôtel,Lyon," 8,3 "
Eric,France,0,2020-01-26 00:00:00,Bien ,"Accueil sympathique, très bonne situation.","Équipements et prestations un peu légères pour du 4*.
Isolation vis à vis de la rue qui mériterait un rafraîchissement. 
Joint manquant dans la salle d eau qui fait que l eau de la douche coule au sol.","7,0",Hôtel,Lyon," 8,3 "
Jérôme,France,0,2020-01-26 00:00:00,Très bien !!! Moi et mon épouse allons y séjournés une seconde fois dans les quinze jours prochain.,"L'accueil, le confort, tranquillité bien insonorisées par rapport à la situation géographique et rapport qualité prix à notre attente, cette hôtel mérite ces étoiles.",Dommage pas assez de places de parking pour l'ensemble des clients de l'hôtel. ( rien de grave !!).,"9,0",Hôtel,Lyon," 8,3 "
Fabienne-anne,Guadeloupe,0,2020-01-23 00:00:00,Hôtellerie de qualité,Très belle prestation hôtelière. Qualité de service. Personnel aimable et disponible.,Tout est au top,"9,0",Hôtel,Lyon," 8,3 "
Laurence,France,0,2020-01-23 00:00:00,Très bien,PETIT DEJ SUPER,LA TV NE MARCHAIT PAS AINSI QUE LA PETITE VEILLEUSE DE LIT,"8,0",Hôtel,Lyon," 8,3 "
Eric,France,0,2020-01-22 00:00:00,Très bien,Le personnel.Disponible et courtois.Excellente situation de l'établissement,None,"8,0",Hôtel,Lyon," 8,3 "
Ghislaine,France,0,2020-01-19 00:00:00,Très bien,"Chambre spacieuse confortable et très propre
Calme . Personnel très accueillant et très professionnel. C'est agréable d'être bien reçu. Merci",None,"8,0",Hôtel,Lyon," 8,3 "
Arsac,France,0,2020-01-19 00:00:00,j'aime,le personnel en particulier du soir est vraiment sympa.,les camions de poubelles le matin vers 5h30,"8,0",Hôtel,Lyon," 8,3 "
Andrée,France,0,2020-01-17 00:00:00,"séjour très agréable, chambre spacieuse, belle vue","La disponibilité du personnel, la propreté",coût du parking,"8,0",Hôtel,Lyon," 8,3 "
Baptiste,France,0,2020-01-17 00:00:00,Fabuleux ,Hotel magnifique,difficile d'accès en voiture si on ne prend pas le parking,"9,0",Hôtel,Lyon," 8,3 "
Christel,France,0,2020-01-15 00:00:00,Bien ,"L’hôtel est charmant et bien placé. A la réception le personnel est adorable. 
La chambre est grande et agréable","La literie est trop dure à mon goût. 
Les femmes de ménage ont été très désagréables. Elles hurlaient l’une sur l’autre dans les couloirs. Elles ont râlé parce que je ne sortais pas assez vite de la chambre.","7,1",Hôtel,Lyon," 8,3 "
Dominique,France,0,2020-01-14 00:00:00,A découvrir calme tout en étant proche du centre ville.,Hôtel bien situé proche des transports en commun. Personnel agréable qui est un plus non négligeable. Petit déjeuner agréable et au calme car les horaires calmes sont affichés. Literie très agréable. Salle de bain au Top... A découvrir,"Rien de particulier. Sauf peut-être les canapés de l'entrée qui sont un peu ""vieux"" avec une assise ""fatiguée"". Mais cela reste un détail.","9,0",Hôtel,Lyon," 8,3 "
Vincent,France,0,2020-01-14 00:00:00,Très bien,Accueil chaleureux et très sympathique,"L'insonorisation de la chambre n'était pas parfaite. Un voisin avait décidé de regarder la télé tard, heureusement j'avais des boules quies. Pas de problème pour le bruit de la rue, quartier calme.","8,0",Hôtel,Lyon," 8,3 "
Jean,France,0,2020-01-13 00:00:00,"Sejour agreable , mais dommage pour le bruit.","Petit dejeuner bien. Emplacement bien.
Personnels très sympa.","Par contre , l'hotel est un peu bruyant. (Bruits exterieurs).","7,0",Hôtel,Lyon," 8,3 "
Mariine,France,0,2020-01-13 00:00:00,Bien ,None,"On entend tous les bruits, les gens qui parlent, les femmes de ménages qui règlent leurs comptes, les portes qui claquent... pour dormir ce n'est pas l'idéal.","7,0",Hôtel,Lyon," 8,3 "
Céline,France,0,2020-01-12 00:00:00,Très bien,Excellent emplacement et petit déjeuner bon,Problème de ventilation dans la salle de bain,"8,0",Hôtel,Lyon," 8,3 "
Roger,Suisse,0,2020-01-12 00:00:00,Sympa,Le changement de chambre afin d'avoir une baignoire,Rien,"8,0",Hôtel,Lyon," 8,3 "
Gérard,France,0,2020-01-08 00:00:00,BON SEJOUR,"emplacement très bien pour visiter 
petit déjeuner bien mais cher
chambre calme et confortable",LA SALLE DU PETIT DEJEUNER TROP PETITE,"8,0",Hôtel,Lyon," 8,3 "
Mimouna,France,0,2020-01-06 00:00:00,Pour visiter la ville tted,"La chambre avec terrasse et belle vue sur la ville
Le parking
Le petit déjeuner 
L emplacement
Le perdonnem",Rien,"8,0",Hôtel,Lyon," 8,3 "
Rj18-09,Suisse,0,2020-01-04 00:00:00,Fabuleux ,"L'emplacement, la proximité du centre-ville",La météo 😉,"9,0",Hôtel,Lyon," 8,3 "
Leo,France,0,2020-01-03 00:00:00,Bien ,La localisation,None,"7,9",Hôtel,Lyon," 8,3 "
Michel,France,0,2020-01-01 00:00:00,Très bien,None,"Une légère odeur d'égout dans le hall et escalier
Une salle un peu trop petit pour le petit-déjeuner","8,0",Hôtel,Lyon," 8,3 "
Julie,Belgique,0,2019-12-31 00:00:00,Établissement confortable et personnel sympathique,La localisation dans la ville et le confort de la chambre,"Le petit-déjeuner est décevant, peu de choix et la salle du petit-déjeuner est très petite.","7,5",Hôtel,Lyon," 8,3 "
José,France,0,2019-12-29 00:00:00,"Personnel acceuillant, & bon rapport qualité prix.",La possibilité de se garer dans le parking de l'hôtel & la situation géographique de l'hotel.,"Rue un peu bruyante la nuit, sinon RAS","8,0",Hôtel,Lyon," 8,3 "
Mirko,Italie,0,2019-12-27 00:00:00,Un jour à Lyon,Position,None,"8,3",Hôtel,Lyon," 8,3 "
Roger,France,0,2019-12-27 00:00:00,Excellence,"En quelques mots, satisfait par par l’accueil et les prestations de cet hôtel.","Petit bémol, je suis resté deux jours et la chambre n’a pas été faite pendant cette période .
Période de Noël explique cet oubli","9,6",Hôtel,Lyon," 8,3 "
Gilles,Belgique,0,2019-12-25 00:00:00,Pause sur lyon,Chambre spacieuse et confortable,None,"8,0",Hôtel,Lyon," 8,3 "
Romain,Suisse,0,2019-12-25 00:00:00,Fabuleux ,Le calme et la propreté,Moquette,"9,2",Hôtel,Lyon," 8,3 "
Sophie,France,0,2019-12-20 00:00:00,Super sympa !!! On a adoré !,"Le surclassement, la vue depuis la chambre, la taille de la chambre, la propreté, le personnel","Les tarifs changeants au fil des jours, l'aspect de l hotel depuis l'extérieur dommage pour un 4 étoiles","9,6",Hôtel,Lyon," 8,3 "
Géraldine,Autriche,0,2019-12-17 00:00:00,Très bon rapport qualité/prix/emplacement,"Personnel très agréable, bien situé, calme et propre.",None,"8,0",Hôtel,Lyon," 8,3 "
Lucie,France,0,2019-12-16 00:00:00,espace et citadine !,Le surclassement de la chambre et la disponibilité du personnel,"le petit dej, salle pas très bien entretenue, et petit dej trop succinct.","8,0",Hôtel,Lyon," 8,3 "
Aurelie,France,0,2019-12-15 00:00:00,Fabuleux ,"Très bon emplacement, literie confortable, chambres calmes, décoration des chambres très soignée.",Le hall d'entrée n'est pas à la hauteur du reste de l'hôtel (semble moins bien entretenu et parfum d'ambiance trop présent),"9,0",Hôtel,Lyon," 8,3 "
Julien,France,0,2019-12-15 00:00:00,Fabuleux ,"Un emplacement idéal. Pour le shopping , visite et restaurant","Look un peu vieux, et lifting serait bien venu.","9,2",Hôtel,Lyon," 8,3 "
Valerie,France,0,2019-12-11 00:00:00,Fabuleux ,"Emplacement idéal dans Lyon et parking appréciable. Les chambres sont belles, grandes et confortables ; l'accueil souriant.",None,"9,2",Hôtel,Lyon," 8,3 "
Eric,France,0,2019-12-08 00:00:00,Fabuleux ,"L'accueil, le confort, l'emplacement, le parking et le petit déjeuner !","La lumière de la niche de l'entrée qui ne s'eteind pas ! Mais pas gênant, il faut fermer la porte !
Et ce souci devrait être résolu rapidement...","9,2",Hôtel,Lyon," 8,3 "
Michel,Suisse,0,2019-12-08 00:00:00,"séjour parfait , je le recommande","bien situé et propre en ordre,personnel à l'écoute , petit déjeuner parfait",None,"9,0",Hôtel,Lyon," 8,3 "
Philippe,France,0,2019-12-02 00:00:00,Fabuleux ,très bien dans l'ensemble,None,"9,0",Hôtel,Lyon," 8,3 "
Marie-mélodie,France,0,2019-12-01 00:00:00,Très agréable,La chambre était très agréable (lit confortable) et grande salle de bain avec le nécessaire.,Salle de petit déjeuner trop petite,"9,0",Hôtel,Lyon," 8,3 "
Manon,France,0,2019-12-01 00:00:00,Encore un bon séjour en famille dans cet hôtel bien placé.,"L’amabilité de la réceptionniste et sa disponibilité.
Nous avons pu avoir notre chambre un peu avant l’heure prévue. 
Le petit déjeuner, sous forme d’un buffet garni et diversifié. 
Belle vue sur l’hôtel Dieu et bonne position géographique.
Propreté de la chambre et qualité de la literie.","Le manque de papier toilette dans les wc et pas de rouleaux en stock dans la chambre.
L’isolation d’une des fenêtres sur l’exterieur qui n’était pas terrible.
Le monde au petit-déjeuner et le manque de place.","7,0",Hôtel,Lyon," 8,3 "
Philippe,France,0,2019-12-01 00:00:00,Bien,"L emplacement 
Belle deco de Noël dans le hall","Salle de petit déjeuner vraiment étriquée, flux impossible, bruit face aux va et vient des ascenseurs mais il y a des travaux en vue à priori ouf","7,0",Hôtel,Lyon," 8,3 "
Elisabeth,France,0,2019-12-01 00:00:00,petit week end intense et trés agréable,"grande chambre
personnel à écoute et très dynamique",None,"9,0",Hôtel,Lyon," 8,3 "
Guillaume,France,0,2019-12-01 00:00:00,Un repos attendu dans un lieu calme et propre. Avec un personnel souriant,Lit très confortable. Silencieux.,La salle à manger est nettement pas à la dimension de l’hôtel puisque nous avons attendu dix minutes avant de pouvoir prendre notre petit déjeuner. Une erreur de l’architecte ?,"8,0",Hôtel,Lyon," 8,3 "
Anne,France,0,2019-11-22 00:00:00,Bien ,L'emplacement et les chambres spacieuses,La salle du petit-déjeuner est un peu petite. Ca s'est bousculé le matin...,"7,0",Hôtel,Lyon," 8,3 "
Marie,France,0,2019-11-21 00:00:00,Bien ,None,"Avec une facture de prés de 200 euros pour la nuit petit dej et dîner, ayant payé la veille au soir de mon départ, la personne qui avait fait la facture a oublié le room-service:1euros qui m'ont été demandé alors que j'étais pressée(raison pour laquelle j'avais tout réglé la veille).
je trouve que pour un hôtel qui se positionne sur cette gamme c'est vraiment mesquin comme politique, étrange gestion de la relation client...","7,0",Hôtel,Lyon," 8,3 "
Nicole,Cambodge,0,2019-11-20 00:00:00,Fabuleux ,"chambre très spacieuse,ils nous ont fourni en plus du lit bébé un chauffe biberon un transat our la douche ainsi qu'un matelas à langer ce qui est très appréciable lorsqu' on voyage avec des bébés.
Vue sur le Rhône et personnel sympatique et disponible","rien, tout était parfait","9,0",Hôtel,Lyon," 8,3 "
Hervé,France,0,2019-11-18 00:00:00,Exceptionnel,Pratique et moderne,Chaise en paille non assortie au mobilier,"9,6",Hôtel,Lyon," 8,3 "
Bruno,France,0,2019-11-18 00:00:00,Bien ,"Placé non loin du centre et au calme, assez neuf, literie un peu ferme mais ok , personnel très sympa","le petit déjeuner assez moyen en qualité et espace petit, odeur persistante de mangue (artificielle) dans tous les étages (odeur un peu écœurante à force)","7,0",Hôtel,Lyon," 8,3 "
Alexandra,France,0,2019-11-18 00:00:00,Bien ,"J'ai aimé la décoration de la chambre, la douche. Le personnel était très sympa !",Je n'ai pas apprécié les oreillers qui étaient trop durs. Le petit déjeuner serait à améliorer.. notamment les croissants,"7,0",Hôtel,Lyon," 8,3 "
Erick_nyon,Suisse,0,2019-11-17 00:00:00,Très bien pour un weekend - mais hôtel vieillot qui demande à être rafraichi,La chambre,Le lobby,"7,0",Hôtel,Lyon," 8,3 "
Laurent,Suisse,0,2019-11-13 00:00:00,Bien ,"Emplacement
Parking
Personnels très sympathique et professionnelle","Beaucoup de bruit extérieur
Prix final ne correspond pas à la réservation
Peu de confort pour un 4 étoiles","7,1",Hôtel,Lyon," 8,3 "
Fabienne,France,0,2019-11-12 00:00:00,Bien ,"excellent emplacement
personnel à l'accueil très agréable",salle du petit déjeuner trop petite,"7,0",Hôtel,Lyon," 8,3 "
Aurélien,France,0,2019-11-11 00:00:00,Superbe,None,"Hôtel très bien placé. Beaucoup de chose a faite aux alentours sans prendre la voiture.
Petit-déjeuner au top. Seul petit defait il faut arriver à la bonne heure pour avoir de la place sinon un peu d attente.
Chambre très propre.","8,8",Hôtel,Lyon," 8,3 "
Lydia,France,0,2019-11-10 00:00:00,Fabuleux ,Nous avons eu un problème de chauffage dans notre chambre et le personnel a été à l'écoute et efficace pour nous déplacer dans une autre chambre plus confortable.,None,"9,0",Hôtel,Lyon," 8,3 "
Goulouk,France,0,2019-11-10 00:00:00,Fabuleux ,.,La salle du petit déjeuner est très petite,"9,2",Hôtel,Lyon," 8,3 "
Claude,France,0,2019-11-09 00:00:00,Bien ,None,"PRIX DU PARKING TROP ELEVE NON INDIQUE LORS DE LA RESERVATION
PRIX DU PETIT DEJEUNE","7,5",Hôtel,Lyon," 8,3 "
Didier,Belgique,0,2019-11-05 00:00:00,Nous y retournerons,"Situation proche du centre tout en étant au calme.
Parking sécurisé.
Personnel à l'accueil très serviable et gentil.
Buffet petit déjeuné varié, très bon.",Salle du petit déjeuné trop petite-attente pour avoir une table,"8,0",Hôtel,Lyon," 8,3 "
Chantal,France,0,2019-10-28 00:00:00,Très bien situé.,Chambres rénovées avec goût.,La salle de restaurant beaucoup trop petite pour le petit déjeuner. Mais il semblerait qu’il y ait un projet d’agrandissement.,"8,8",Hôtel,Lyon," 8,3 "
Olivier,France,0,2019-10-28 00:00:00,Fabuleux ,Tout,Peut être les lumières de la salle de bain un peu faibles ...,"9,2",Hôtel,Lyon," 8,3 "
Aurélie,France,0,2019-10-27 00:00:00,Bien ,"Literie confortable 
Emplacement géographique idéal",Un peu de monde le matin au petit déjeuner et une seule personne pour gérer le tout,"7,9",Hôtel,Lyon," 8,3 "
Alexandrine,France,0,2019-10-25 00:00:00,Superbe,Chambre spacieuse et très propre. Literie impeccable. Personnel disponible et aimable.,"Salle de petit-déjeuner exigue, buffet moyen.
Chambre donnant sur la rue, très bruyante la nuit","8,8",Hôtel,Lyon," 8,3 "
Isabelle,Gabon,0,2019-10-24 00:00:00,Week-end proche vieux Lyon,Confort de la literie,"Pas de parking bien qu’annoncé, bruyant (rue passante)","8,3",Hôtel,Lyon," 8,3 "
Sophie,France,0,2019-10-23 00:00:00,Fabuleux ,Excellent accueil. Chambre familiale tres bien conçue. Bouilloire dans la chambre.,Odeur desagreable dans la chb en entrant sans doute liée au fait que les chb viennent d etre refaites. Elles sont d ailleurs très agréables.,"9,2",Hôtel,Lyon," 8,3 "
Catherine,France,1,2019-05-19 00:00:00,parfait,nous avons mangé dans notre chambre. Tout a été parfait pour un excellent séjour à Lyon.,None,10,Appart'hôtel,Lyon," 7,6 "
Abdallah,France,0,2020-03-15 00:00:00,TOP TOP TOP,l'accueil,rien,"9,0",Appart'hôtel,Lyon," 7,6 "
Benoit,France,0,2020-03-08 00:00:00,Bien ,"La chambre est spacieuse pour 2
L’emplacement est idéal à proximité de tout
Le prix est très correct pour Lyon",Prévoir du papier toilettes en quantité suffisante pour un séjour de 3 jours,"7,0",Appart'hôtel,Lyon," 7,6 "
Jocelyne,France,0,2020-03-04 00:00:00,Très bien,Sur la rue très calme. Pratique quand il s'agit d'être près de la gare sNCF et du quartier d'affaires,None,"8,0",Appart'hôtel,Lyon," 7,6 "
Sandra,Belgique,0,2020-02-29 00:00:00,Bien ,Bien situé et confort correct,None,"7,1",Appart'hôtel,Lyon," 7,6 "
Abdelali,France,0,2020-02-29 00:00:00,Content et je n'hésiterai pas de revenir,"La sympathie du personnel, la localisation de l'hôtel et le rapport qualité prix.",Le nettoyage des chambres et le changement des serviettes ne se fait qu'une fois par semaine.,"8,0",Appart'hôtel,Lyon," 7,6 "
Florence,France,0,2020-02-25 00:00:00,Très bien,L'emplacement idéal. Les équipements la propreté. Super pour un weekend ! ou en semaine,Rien à signaler,"8,0",Appart'hôtel,Lyon," 7,6 "
Karine,France,0,2020-02-24 00:00:00,Fabuleux ,None,"Super séjour, je recommande","9,0",Appart'hôtel,Lyon," 7,6 "
Vincent,France,0,2020-02-20 00:00:00,"Très bien,nous y rerournerons","Spacieux pour une famille de 4,bien placé,propre,bonne literie,calme",None,"8,0",Appart'hôtel,Lyon," 7,6 "
Béatrice,France,0,2020-02-20 00:00:00,Conforme à mes attentes,"Le confort de la literie, l’appart côté jardin et la Tv grand ecran",Le bruit de la tringlerie d’ascenseur,"7,0",Appart'hôtel,Lyon," 7,6 "
Christian,France,0,2020-02-18 00:00:00,Idéal pour les séjours de courte durée.,"Indépendance, et accès facile. Sécurisation de la zone parking.",None,"9,0",Appart'hôtel,Lyon," 7,6 "
Patrick,France,0,2020-02-17 00:00:00,Endroit spacieux par rapport à une chambre d’hôtel et bien situé au niveau transports,La dimension de la chambre et les équipements,"Appartement très bruyant quand il y a du vent, persiennes qui battent.","8,0",Appart'hôtel,Lyon," 7,6 "
Amandine,France,0,2020-02-17 00:00:00,Bien ,"Les lit confortables, les grands placards.","Le sol était collant en arrivant, les chaises en tissu très sales et les jeunes qui parlent fort dans les couloirs le soir ou la nuit.....","7,0",Appart'hôtel,Lyon," 7,6 "
Catherine,France,0,2020-02-12 00:00:00,Bien ,"Appartement sympa , bien chauffé","Le bruit des voisins , jusqu'à dans la nuit ......
Nous avions demandé un premier étage et nous nous sommes retrouvés au cinquième.......rien d autres nous a été proposé","7,0",Appart'hôtel,Lyon," 7,6 "
Miss,France,0,2020-01-25 00:00:00,Bon séjour,"Malgré le fait que Part-Dieu soit en travaux, j'ai eu la chance d'atterrir dans un quartier plutôt calme.
Au niveau du logement, les draps, serviettes et nécessaire de toilette (savon, shampooing, gel douche) étaient fournis et le lit (et oreillers) était très confortable ! ;D",None,"9,0",Appart'hôtel,Lyon," 7,6 "
Julien,France,0,2020-01-19 00:00:00,Superbe,"Une terrasse en plus, c’était inattendu!","Il manque quelques détails, pouvoir accrocher le pommeau de douche, sel/poivre etc...","8,8",Appart'hôtel,Lyon," 7,6 "
Ahmed,Tunisie,0,2020-01-12 00:00:00,Proximité transports commerces et supermarchés. Toutes les commandités sont dispo.,Proximité et acceuil,Éclairage,"8,0",Appart'hôtel,Lyon," 7,6 "
Elisabeth,France,0,2020-01-08 00:00:00,Superbe,"Très bon accueil. 
Très bon rapport qualité prix.",None,"8,8",Appart'hôtel,Lyon," 7,6 "
Lamia,Maroc,0,2020-01-06 00:00:00,"Bien, quelques points à améliorer","Superficie
Le calme","Poussière sous le lit. 
Pas de sèche-cheuveux
Bruit provenant la nuit du compteur (eau chaude)","8,0",Appart'hôtel,Lyon," 7,6 "
Esher,France,0,2020-01-02 00:00:00,Fabuleux ,"La chambre était très propre !! 
Rapport qualité / prix très bien.",None,"9,0",Appart'hôtel,Lyon," 7,6 "
Laurence,France,0,2019-12-26 00:00:00,bon rapport qualité prix. c'est ce que je recherchais.,je n'ai pas pris le petit déjeuner sur place.,la chambre plus petite que sur la photo.,"7,0",Appart'hôtel,Lyon," 7,6 "
Didier,France,0,2019-12-10 00:00:00,"Bon séjour, a recommander",le calme la proximité du métro,"le lundi matin temps d'attente , une seule personne pour les départs et les entrés, ça bouchonne…..","7,0",Appart'hôtel,Lyon," 7,6 "
Flo,France,0,2019-12-10 00:00:00,Bien ,Le lieu : proche du tram et metro,"Petit dej de 9€, un.peu cher.
Il devrait etre plus varié (fruits secs, fruits frais, oeufs seraient agreables)
Le sol devrait etre refait dans les chambres","7,9",Appart'hôtel,Lyon," 7,6 "
Denise,La Réunion,0,2019-11-03 00:00:00,"Agréable, confortable.",La taille de l'appartement. L'agencement des pièces. Appartement accueillant,Le bruit du 1er soir. Les autres soirs ont été calmes.,"7,0",Appart'hôtel,Lyon," 7,6 "
David,France,0,2019-09-02 00:00:00,"Avis mitigé; très en dessous , qualitativement de son homologue rennaise: la Villa Camilla",La situation et la relative fraicheur de l'appartement alors qu'il faisait très chaud dehors + présence d'un ventilateur,"attente jusqu'à 16h pour pouvoir occuper notre appartement ( on nous l'avait contractuellement promis pour 15h ). Vaisselle très insuffisante dans les appartements ( la moitié de ce qui était prévu à l'inventaire manquait : très compliqué du coup pour organiser les repas sur place, ) ...Frais supplémentaires, du coup, de restauration à l'extérieur","6,7",Appart'hôtel,Lyon," 7,6 "
Adil,Maroc,0,2019-08-24 00:00:00,Très bon emplacement,"Très calme 
Bon emplacement",None,"8,5",Appart'hôtel,Lyon," 7,6 "
Francine,Belgique,0,2019-08-23 00:00:00,"Détente, calme","Appartement propre et l'immeuble aussi. Faudrait penser à changer les ustensiles de cuisine.
Pas loin de la gare,centre ville et magasins","Les ustensiles vieillots de la cuisine ( casserole, couverts,.. )","7,5",Appart'hôtel,Lyon," 7,6 "
Martine,France,0,2019-08-20 00:00:00,"bien situé, studio trèspropre, personnel agréable, quelques efforts à faire pour le halld'accueil","le studio était très propre, le personnel aimable . toutefois le personnel doit être polyvalent, aussi il a fallu attendre une demi-heure pour la remise des clefs, et pas de sièges à l'accueil !","l'entrée devrait être rénovée pour être plus accueillante, on a l'impression d'entrer dans un HLM !
heureusement que le studio était agréable !","8,3",Appart'hôtel,Lyon," 7,6 "
Monique,France,0,2019-08-07 00:00:00,Agréable,"Le personnel de ménage
La proximité des moyens de transport, le quartier","Pas de climatisation, un ventilateur, des moustiques, ascenseur en panne deux fois.","6,2",Appart'hôtel,Lyon," 7,6 "
Dominique,La Réunion,0,2019-08-06 00:00:00,Bien sans plus beaucoup de bruit le matin de bonheur au rdc mais laverie bien fonctionnelle.,None,l'équipement cuisine mal entretenu.,"6,5",Appart'hôtel,Lyon," 7,6 "
Soltan_gris,France,0,2019-08-05 00:00:00,"Emplacement pour famille impéccable dans la période louée, beaucoup d'étudiants.","Confort et équipement adapté pour une famille
Appartement propre et fonctionnel
Emplacement dans une zone peu touristique mais accès transports en communs aisé
Parking réservé en sous sol - parfait","Manque une climatisation, la période de notre location lors de canicule a été difficile
Le canapé lit aurait été mieux si deux lits superposés","8,8",Appart'hôtel,Lyon," 7,6 "
Isabelle,France,0,2019-08-01 00:00:00,Bien ,"Bien situé, propre et confortable. Parking très pratique.","Terasse vide, pas de mobilier de jardin.","7,5",Appart'hôtel,Lyon," 7,6 "
Antonio,Italie,0,2019-08-01 00:00:00,Appartement pratique et propre,Pas d'attache murale prévue pour le pommeau de douche,None,"7,5",Appart'hôtel,Lyon," 7,6 "
Marion,France,0,2019-07-12 00:00:00,Superbe,Calme et bien situé,Il faisait très chaud,"8,8",Appart'hôtel,Lyon," 7,6 "
Gerald,France,0,2019-05-31 00:00:00,Bien ,La kitchenette,Manque la climatisation et un balai,"7,1",Appart'hôtel,Lyon," 7,6 "
Amélie,France,0,2019-05-17 00:00:00,très bien,appartement confortable et fonctionnel,None,"7,5",Appart'hôtel,Lyon," 7,6 "
Hélène,France,0,2019-05-06 00:00:00,"Rapport qualité prix correct. Attention, si vous arrivez le week-end, hôtel injoignable","La situation géographique de l'hôtel (près de la gare PART DIEU) et l'accessibilité des transports en commun
La mise à disposition des clefs dès mon arrivée",Le studio était proche de la cage de l'ascenseur et les plaques électriques ne fonctionnaient pas,"7,5",Appart'hôtel,Lyon," 7,6 "
Mefiteh,Algérie,0,2019-04-19 00:00:00,Ça c'est passé comme on voulait merci,Le lit bien et les ustensiles de cuisine très bien,"Plaque chauffante ne marchait pas bien. 
Shampoing insuffisant pour une semaine","7,9",Appart'hôtel,Lyon," 7,6 "
Isabelle,France,0,2019-04-18 00:00:00,Bien ,"Logement propre et calme.
Couchage confortable. 
Récupération des clé même quand accueil fermé.",Un peu loin du vieux Lyon.,"7,1",Appart'hôtel,Lyon," 7,6 "
Gagliardini,France,0,2019-04-08 00:00:00,Bien ,L'emplacement,None,"7,9",Appart'hôtel,Lyon," 7,6 "
Emmanuel,France,0,2019-02-22 00:00:00,Très bien,"Insonorisation, sécurité,propreté,proximité transport","Cafetière bancale , ne pas pouvoir mettre Le pommeau de douche en hauteur , rideau sale au niveau de l aération coffre de volet","7,5",Appart'hôtel,Lyon," 7,6 "
Gérard,France,0,2019-01-02 00:00:00,cool....accessible...sympa..,le calme...,manque...Papier hygiénique et 1 sac poubelle...,"7,5",Appart'hôtel,Lyon," 7,6 "
