nom,pays,favorite,date,titre,bons_points,mauvais_points,note,type_etablissement,lieu,note_etablissement
May,France,0,2019-01-27 00:00:00,Bien ,Les équipements mis en place,Le bruit dû au bar situé en face,"7,9",Appart'hôtel,Nantes," 7,9 "
Martine,France,0,2019-01-25 00:00:00,Fabuleux ,"Bon rapport qualité /prix.Très bien situé, propre et bien aménagé",Bruyant ! Le café en face est ouvert jusqu’à 2 h du matin et il est très fréquenté,"9,0",Appart'hôtel,Nantes," 7,9 "
Laurianne,France,0,2019-01-25 00:00:00,Très bien,None,"Peu d’eau chaude (quelques minutes) malgré le suivi du mode d’emploi pour la chaudière 
Rue un peu bruyante avec bar juste en dessous","8,3",Appart'hôtel,Nantes," 7,9 "
Catherine,France,0,2019-01-23 00:00:00,"Nous sommes satisfaits, ameublement, confort et propreté conformes à nos exigences, nous reviendrons","La situation géographique est excellente, à proximité de tous les commerces et des sites à visiter. On fait tout à pied par contre, l'arrivée en voiture est très compliquée étant donné tous les sens uniques et les voies fermées à la circulation. En ce qui concerne la chambre, nous avons constaté des entrées d'air froid par le sol, par les prises de courant, par le meuble de salle de bain et par le placard d'entrée ce qui oblige à augmenter la puissance des radiateurs. C'est dommage pour des logements récents.",Le stationnement coûte assez cher.,"7,9",Appart'hôtel,Nantes," 7,9 "
Julien,France,0,2019-01-18 00:00:00,Bien ,"Netflix
 literie",Sac encombrant l entree des petit travaux a faire trou dans les murs,"7,9",Appart'hôtel,Nantes," 7,9 "
Nicolas,France,0,2019-01-14 00:00:00,Bien mais attention au bruit,"+ Propre
+ Confortable pour le prix 
+ Bien placé
+ Équipements","- Le bruit venant du bar en dessous
- L’eau chaude","7,1",Appart'hôtel,Nantes," 7,9 "
Carmelo,France,0,2019-01-11 00:00:00,Très bien,"Appartement confortable et bien équipé, situé hyper centre",Le bar en face de l' immeuble et sa terrasse. Impossible de fermer l'oeil avant 2h du matin...,"8,3",Appart'hôtel,Nantes," 7,9 "
Colette,France,0,2019-01-04 00:00:00,Nantes est une belle ville !,L'emplacement plein centre - le confort de la chambre,"Le couloir d'entrée était très encombré par des sacs de linge durant tout le week- end.
Immeuble locatif situé en face d'un bar de nuit très très bruyant jusqu'à 3 H du matin. 
Frigidaire vide malgré les infos transmises (boissons fraîches ....)
Dommage !","6,7",Appart'hôtel,Nantes," 7,9 "
Claire-lise,Suisse,0,2019-01-03 00:00:00,Studio propre et neuf,"Appartement bien centré, propre avec du mobilier neuf. Bien pensé et surtout une bonne literie neuve.",Le manque de couteau à pain et couteau de service. Un aspirateur. Un essuie vitre pour la cabine de douche. Le bruit de la rue mais on ne peut pas tout avoir ! Un lieu centré avec de la plénitude.,"7,5",Appart'hôtel,Nantes," 7,9 "
Richard,France,0,2018-12-28 00:00:00,Fabuleux ,"Tout le reste, confort,proximité de tout",Le bruit de la rue,"9,2",Appart'hôtel,Nantes," 7,9 "
Eve_paris,Thaïlande,0,2018-12-28 00:00:00,En face d’un bar bruyant : fuyiez !,None,"L’appartement est en face d’un bar très fréquenté, impossible de dormir avant 2/3 h du matin. Puis à 7 h c’est le camion poubelle. A fuir !","8,5",Appart'hôtel,Nantes," 7,9 "
Sha,France,0,2018-12-13 00:00:00,Bien ,None,Ne pas avoir le bon code de la porte de l’appartement surtout quand on rentre à 2h du matin,"7,5",Appart'hôtel,Nantes," 7,9 "
Fiona,Guyane française,0,2018-12-02 00:00:00,Fabuleux ,"Cadre agréable, appartement cosy","Il n'y a pas d'ascenseur, les escaliers sont exigus pour monter les bagages ce n'est pas top.
Un vrai lit king size ça aurait été parfait","9,2",Appart'hôtel,Nantes," 7,9 "
Thierry,France,0,2018-12-02 00:00:00,Bien ,Emplacement en centre ville. Appartement confortable( literie ) et bien équipé ( cuisine ),Lumière du couloir de l’immeuble ne s éteignant pas ( installer une minuterie ou avoir une porte d entrée d appartement plus hermétique et le pb est vite résolu) .,"7,5",Appart'hôtel,Nantes," 7,9 "
Margaux,France,0,2018-12-01 00:00:00,Fabuleux ,"Très lumineux, très bien équipé et lit confortable",Rien de particulier,"9,2",Appart'hôtel,Nantes," 7,9 "
Christophe,France,0,2018-11-28 00:00:00,Bien ,La literie était convenable. Les rangements optimisés. Mais un peu sommaire pour un séjour romantique.,None,"7,1",Appart'hôtel,Nantes," 7,9 "
Ousmane,France,0,2018-11-25 00:00:00,Nantes belle ville,"Le service client qui répondait à mes questions rapidement.
Bel appart confortable.
A proximité de la garde, de la cathédrale, du château du Duc de Bretagne, et d'autres lieux. 
Restaurants, bars et autres lieux de distraction l'entourent.","Seul hic, la chambre n'est pas bien insonorisée. Surtout qu'il y a une place, lieu de rencontre, à quelques mètres de l'appartement. Pas idéal pour bien dormir en cas d'évènements. Je ne sais pas si en temps normal c'est le même résultat.
C'est dommage sachant que le nombre de voitures qui y passe se compte sur le bout des doigts. Quasiment que des piétons.","9,2",Appart'hôtel,Nantes," 7,9 "
Noblet,France,0,2018-11-19 00:00:00,Bien ,"Le confort, l'autonomie et la flexibilité des horaires.",Le bar en dessous de la fenêtre bruit jusqu'à 2h30 du matin... trop bruyant.,"7,5",Appart'hôtel,Nantes," 7,9 "
Gxwenaelle,France,0,2018-11-18 00:00:00,Superbe,None,"Venir avec des boules quies pour les sommeils légers, hyper bien situé mais en face d un bar...","8,8",Appart'hôtel,Nantes," 7,9 "
Antoine,France,0,2018-11-05 00:00:00,Très agréable,Situation géographique / netflix,"Lumière automatique de l'escalier, reste allumée toute la nuit...passe sous la porte et moyen en environnement.","9,2",Appart'hôtel,Nantes," 7,9 "
Tatiana,France,0,2018-11-04 00:00:00,Bien mais sans plus,Localisation et prix,"Propreté : poils partout dans la chambre, linge sale dans sacs oranges dans l’entrée pendant 3 jours.
Équipements : trous dans le mur, pas de boissons froides ni de tablette comme indiqué dans la réservation, pas de conciergerie où laisser ses bagages.","6,7",Appart'hôtel,Nantes," 7,9 "
Ouss,France,0,2018-10-30 00:00:00,Fabuleux ,"La propreter, l'emplacement et les equipements..","La tablette ne fonctionner pas. 
Il yavais 2 lits simple au lieu d'un lit double.","9,2",Appart'hôtel,Nantes," 7,9 "
Aldo,France,0,2018-10-29 00:00:00,Séjour agréable dans un quartier vivant.,Les équipements. La mise à disposition d'une tablette. L'emplacement en centre-ville.,"Les horaires d'arrivée et les horaires de départ. 
Pas de service de bagagerie.","8,5",Appart'hôtel,Nantes," 7,9 "
Bruno,France,0,2018-10-15 00:00:00,Très bien,La propreté des lieux et Netflix,Les boissons dans le frigo annoncées n'y étaient pas,"8,0",Appart'hôtel,Nantes," 7,9 "
Marie,France,0,2018-10-14 00:00:00,Agréable étape au coeur du centre ancien,"La situation au coeur du centre ancien et très esthétique avec ses immeubles en pierre grège . La proximité de tout : commerces , lieux à visiter , bords de Loire.
La parfaite organisation de ce studio ( nous étions au second et il y en a 4 sur 4 étages ).
La rénovation très récente avec des normes de confort actuelles et très satisfaisantes.
La commodité du parking indiqué par le loueur ( Decré Bouffay )et situé à 150 m , en accès par la rue piétonne de Briord : à droite en sortant de la porte du parking puis à gauche dans la rue de Verdun et entrée après un magasin de jouets et juste en face du ( fameux ) café Le Ribouldingue .
La proximité des Galeries Lafayette ( rue de la Marne , qui suit la rue de Verdun ) et où se trouve, au sous sol, un Monoprix alimentaire avec tout ce qu'il faut pour le séjour.","Ce qui est dit par tous.tes , le bruit des fumeurs et buveurs de bière en terrasse au café juste en dessous dès 18h et allant crescendo dans cette rue piétonne très animée. 
Les escaliers sans main courante à droite pour descendre. 
Je déconseillerais le dernier étage qui est mansardé apparemment. Deux étages m'ont paru suffisants .","8,8",Appart'hôtel,Nantes," 7,9 "
Christine,France,0,2018-10-13 00:00:00,Séjour correct.,"La situation en plein cœur de la ville et le parking à proximité,quoique un peu cher.","Des sacs de linge entreposés dans le couloir d’ entrée,étroit,qui sont restés tout le week-end.","7,9",Appart'hôtel,Nantes," 7,9 "
Aurelie,France,0,2018-10-07 00:00:00,Très bien,None,Je n'ai pas rencontré de personnel,"8,3",Appart'hôtel,Nantes," 7,9 "
Mv,France,0,2018-10-03 00:00:00,Bien ,"Tout était parfait en arrivant. Equipement au delà de nos espérances et situation géographique idéale. La cuisine est très fonctionnel, le lit confortable, et Netflix est un plus!!","Trois petits bémols sont arrivés par la suite. Linge sale dans des sacs dans l'entrée de l'appartement, qui n'ont pas été débarrassés, peu d'eau chaude pour deux douches, et le centre ville étant très bruyant la nuit, nous avions prit le soin de prendre une chambre insonorisée,... Qui ne l'était pas vraiment!!","7,5",Appart'hôtel,Nantes," 7,9 "
Martin,France,0,2018-10-03 00:00:00,Un bon week-end,"La proximité avec l'hyper centre de Nantes, Netflix.",None,"8,3",Appart'hôtel,Nantes," 7,9 "
Arnaud,France,0,2018-09-30 00:00:00,Bien ,"La machine a café, c'est vraiment super de pouvoir se faire un bon café le matin",La Télévision ne fonctionnait pas et la tablette était déchargée... Donc au prix de la chambre ça aurait été mieux que les équipements fonctionne,"7,9",Appart'hôtel,Nantes," 7,9 "
Mahieddine,None,1,2019-04-17 00:00:00,Tout était parfait,"L'accueil du personnel, la propriété des lieux et le service (petit déjà top)",None,10,Appart'hôtel,Nantes," 8,7 "
Céline,France,0,2020-03-08 00:00:00,Très bien !,"Le personnel très à l’écoute et aux petits soins
Le petit déjeuner très diversifié
L’option spa
La situation",Le hammam est un sauna mais très bien quand même !,"9,0",Appart'hôtel,Nantes," 8,7 "
Emma,France,0,2020-02-19 00:00:00,Exceptionnel,Chambre magnifique et propre tout à disposition et beaucoup de choix pour le petit déjeuner rien à dire je recommande.,None,10,Appart'hôtel,Nantes," 8,7 "
Fahar,France,0,2020-02-16 00:00:00,Magique,"Le spa était magnifique . Le personnel était au petit soin avec nous. L'hôtel est bien située 😍😍 
Parfait pour les séjours en couple",Il serait bien de proposer des peignoir aux personnes qui vont au spa,"9,0",Appart'hôtel,Nantes," 8,7 "
Vincent,France,0,2020-02-14 00:00:00,Fabuleux ,"Parking communicant, amabilité du personnel et confort général de la chambre","Hôtel moderne mais un peu éloigné du centre historique, personnel agréable, petits déjeuners copieux et variés, juste un effort à faire pour le renouvellement du thé et du café de la chambre dont la quantité ne varie pas si on loue plusieurs nuits... Un petit effort aussi côté ménage salle de bains et ce sera parfait !","9,0",Appart'hôtel,Nantes," 8,7 "
Bodin,France,0,2020-02-09 00:00:00,très bien mais quelque points a améliorer / par contre personnel TOP,petit déjeuner très bien / beaucoup de choix / salle calme /personnel très agréable (souriant et disponible ),température de la chambre trop basse a notre arrivée et lente a remonter/ bruit de la machinerie d'ascenseur,"8,0",Appart'hôtel,Nantes," 8,7 "
Morgane,France,0,2020-02-09 00:00:00,Lieu calme,"Avoir la cuisine c'est appréciable.
Le lit très grand format au top et bon matelas.
Le calme de l'hôtel. Bonne insonorisation.
Bel espace pour la chambre familiale.
Le spa agréable pour une heure.","J'aurais apprécié que tout soit en état de fonctionnement. La hotte et la lumière de la cuisine ne fonctionne pas.
Les joints de sol de la douche à l'italienne peu propre.
La literie du canapé pour notre ado peu confortable.","8,0",Appart'hôtel,Nantes," 8,7 "
Jacky,France,0,2020-02-05 00:00:00,"Nous avons pu flâner à pied dans le centre de Nantes, transports en commun au pied de l'hôtel.","Petit-déjeuner très complet, rien ne manquait. La salle est très accueillante, propre. Deux machines à café, thé, chocolat, etc, sont à disposition.","Rien, la place de parking a été ajustée en fonction de mon véhicule.","9,0",Appart'hôtel,Nantes," 8,7 "
Sérénella,France,0,2020-01-26 00:00:00,Fabuleux ,Nous avons aimé le spa privatif .... le hammam .... l ambiance zen ainsi que la décoration.... le petit dejeuner complet .... la superficie des chambres ... l accueil du personnel ainsi que le tarif .... l emplacement .... bonne qualité de literie .,Le petit bémol est au niveau des vestiaires du spa .... peignoir et serviettes pour pouvoir remonter dans les chambred et peut être envisager pouquoi pas de pouvoir prendre le petit déjeuner dans la chambre ....,"9,0",Appart'hôtel,Nantes," 8,7 "
Precilia,France,0,2020-01-13 00:00:00,"Un lieu agréable et adaptée pour un séjour sportif, proche du hangar skatepark de Nantes top !",spa et disponibilité du personnel,les places de parking,"8,0",Appart'hôtel,Nantes," 8,7 "
Marielle,France,0,2020-01-07 00:00:00,Superbe séjour dans la belle ville dynamique de Nantes!,petit dej bien complet. Service superbe. Grandeur de la chambre. Situation géographique avec tram juste à côté. Supermarché à côté.,"mettre des notices sur les serviettes à mettre dans la baignoire si on en veut de nouvelles.
pas de notice pour le placard cuisine - c'est à nous de nettoyer chaque jour.
Le kit liquide vaisselle eponge torchon manquait.","8,0",Appart'hôtel,Nantes," 8,7 "
Aurore,France,0,2020-01-01 00:00:00,Fabuleux ,La petit cuisine qui fait le plus par apport à d'autre hôtel. Accueil très agréable,"J'avais demander deux lits et on a eux un grand lit
Le parking de l'hôtel avait plus de place disponible, dans la rue pas de place on a du ce garé à 15 min à pied","9,0",Appart'hôtel,Nantes," 8,7 "
Sandrine,France,0,2019-12-30 00:00:00,Parfait,"Très belle suite spacieuse. Literie excellente. Nous avons aussi bien profité du spa.
Le centre ville n'est pas trop loin, encore plus rapide en utilisant un bicloo, dont une station se trouve au pied de l'hôtel.",rien,"9,0",Appart'hôtel,Nantes," 8,7 "
Sabine,Brésil,0,2019-12-23 00:00:00,Superbe,Chambre bien insonorisée et aménagée avec goût. Literie confortable.,None,"8,8",Appart'hôtel,Nantes," 8,7 "
Isabelle,France,0,2019-12-22 00:00:00,Fabuleux ,"L espace, la déco soignée, les petites attentions, l accueil, le calme",Juste un matelas trop ferme pour mon dos sinon hébergement d excellente qualité !!,"9,0",Appart'hôtel,Nantes," 8,7 "
Jordan,France,0,2019-12-13 00:00:00,Très bon séjour !,"Très belle chambre, SPA très agréable et personnel également très agréable, serviable et souriant.","Nous sommes déçu de devoir payer le parking à par, au prix où sont les chambres il pourrait être inclu de dans. Payer un parking 13€ par nuit nous trouvons cela excessif, je ne voudrais pas rester 1 semaine...","8,0",Appart'hôtel,Nantes," 8,7 "
Marc,France,0,2019-12-06 00:00:00,Vu le prix peut mieux faire (rapport qualité/prix),"Très bon accueil, chambre spacieuse avec un confort. Jolie décoration, avec quelques tableaux.
Bien équipé avec frigo, lave-vaisselle, plaque de cuisson. Thé, café, sucre, chocolat.
Le buffet ""petit déjeuner"" était correct, j'aurais apprécié plus de fruits.","Le stationnement devrait être inclus avec la chambre au vu du prix de celle-ci. 
13€ par nuit pour stationner dans l'hôtel ou l'on paie déjà un prix premium, c'est abusé.
Nous étions 4, et il y avait seulement 2 oreillés. Ils aurait pu penser à en ajouter 2 de plus.
En conclusion, très bien, mais vu le prix (182€ la nuit), un effort pour préparer la chambre, les choix au petit déjeuner à améliorer, et le stationnement devrait franchement être gratuit avec une chambre de ce prix.","8,0",Appart'hôtel,Nantes," 8,7 "
Valérie,France,0,2019-11-25 00:00:00,Fabuleux ,Excellent sejour,None,"9,0",Appart'hôtel,Nantes," 8,7 "
Isabelle,France,0,2019-11-13 00:00:00,Bien ,None,"Chambre pas prête à l heure demandée 
Bouteille d eau de chevet ouverte et entamee","7,5",Appart'hôtel,Nantes," 8,7 "
Catherine,France,0,2019-11-11 00:00:00,Belles prestations,"Literie impecc, gentillesse du personnel à l’accueil et au petit déjeuner. Beau petit déjeuner copieux, salle lumineuse.",None,"9,6",Appart'hôtel,Nantes," 8,7 "
Michel,France,0,2019-11-06 00:00:00,Au top!,Je Le recommande fortement !,None,10,Appart'hôtel,Nantes," 8,7 "
Julien,France,0,2019-11-02 00:00:00,Parfait ! Hôtel à recommander !,"Literie très confortable, chambre silencieuse et très spacieuse. 
Accueil impeccable (même avec une arrivée à 22h30).
Petit déjeuner très bon et varié (sucré, salé), un régal !
Je recommande !",Rien à signaler.,10,Appart'hôtel,Nantes," 8,7 "
Emilie,France,0,2019-10-06 00:00:00,"Très bon hébergement si je reviens à Nantes, je réserverais ici bien évidemment",Chambre spacieuse et personnel compétent et aimable,None,"8,0",Appart'hôtel,Nantes," 8,7 "
Washington,France,0,2019-10-03 00:00:00,Exceptionnel,"L’emplacement, L’accueil, le parking, le petit déjeuner, 
l’amabilité du personnel",None,10,Appart'hôtel,Nantes," 8,7 "
Morgane,France,0,2019-09-16 00:00:00,Exceptionnel,"Chambre spatieuse et tout confort
Il y'a même de quoi repasser son linge
La cuisine agréable pour ceux qui souhaitent rester plusieurs jours.","Très bon accueil avec les vérifications d'usage.
Très bonnes explications
Rien à dire
Je recommande",10,Appart'hôtel,Nantes," 8,7 "
Cheikh,Sénégal,0,2019-09-13 00:00:00,Agréable et reposant,"Tout était impeccable 
Courtoisie du personnel, professionnalisme,attention et sourire",Ras,10,Appart'hôtel,Nantes," 8,7 "
Jean-jacques,France,0,2019-09-12 00:00:00,"Bon séjour qui m'a permis de découvrir Nantes, dans un cadre agréable","emplacement très pratique. Proche d'un centre commercial, d'un Intermarché, et de plusieurs boulangerie.
On peut aller au centre ville à pieds. Pas besoin de voiture, transports en commun à proximité",J'aurais aimé que la place de parking de l'hôtel soit comprise dans le tarif,"8,8",Appart'hôtel,Nantes," 8,7 "
Veronique,France,0,2019-08-31 00:00:00,Exceptionnel,"Accueil, confort et propreté des chambres",None,10,Appart'hôtel,Nantes," 8,7 "
Yves,France,0,2019-08-31 00:00:00,Séjour agreable En famille,"La' qualité de l'accueil est parfaite.La chambre familiale est spacieuse propre et agréable à vivre pour un séjour courte durée.
Seul bémol le prix du petit déjeuner à 14 € est excessif!",Voir ci dessus,10,Appart'hôtel,Nantes," 8,7 "
Carole,France,0,2019-08-27 00:00:00,Bien ,La propreté et l'accueil du personnel,La literie avec deux matelas séparés pour un lit double,"7,5",Appart'hôtel,Nantes," 8,7 "
Pascal,France,0,2019-08-26 00:00:00,Exceptionnel,"Très confortable et une suite très spacieuse et bien agencée.
Repas en chambre très bon",On a malheureusement pas pu profiter du SPA qui était déjà réserver sur tous les créneaux...,"9,6",Appart'hôtel,Nantes," 8,7 "
Céline,France,0,2019-08-26 00:00:00,Exceptionnel,L’ Accueil très aimable,"options payantes pour un 4* : services Parking , spa ...","9,6",Appart'hôtel,Nantes," 8,7 "
Angelique,France,0,2019-08-25 00:00:00,On a adoré ! Tout était parfais,Nous avons tout aimé de notre arrivée à notre départ.,Rien,10,Appart'hôtel,Nantes," 8,7 "
Veronique,France,0,2019-08-21 00:00:00,Exceptionnel,"Personnel très aimable et à l’écoute
Chambre très fonctionnelle et très propre.",None,10,Appart'hôtel,Nantes," 8,7 "
Osc69,France,0,2019-08-18 00:00:00,Un séjour agréable à Nantes!,"La chambre était agréable et spacieuse, avec des équipements nous ayant permis de profiter de notre séjour. La salle de spa-détente était très agréable et bien faite, avec une jolie atmosphère.","La localisation géographique pourrait être mieux, à 15min à pied de la gare et 20min à pied du centre ville, il vaut mieux avoir une voiture ou apprécier marcher. Le personnel était assez variable mais ceci s'est expliqué : un très bon accueil professionnel des équipes attitrées et un peu plus de difficulté du personnel intérimaire.","8,8",Appart'hôtel,Nantes," 8,7 "
Licinio,France,0,2019-08-18 00:00:00,Bien ,"Kit ménage agreable.
2 teles agréable surtout quand on est avec des ado",Manque des couverts.,"7,9",Appart'hôtel,Nantes," 8,7 "
Alexandra,France,0,2019-08-12 00:00:00,Une belle parenthèse,"Hôtel très agréable, chambre spacieuse, propre, bien équipée, très bonne literie et excellent petit déjeuner ; le tout avec le sourire de l’ensemble du personnel !!!",None,"9,6",Appart'hôtel,Nantes," 8,7 "
Cat,France,0,2019-08-12 00:00:00,Exceptionnel,15 min pour rejoindre le centre qu on oublie vite vu les qualités des prestations. La chambre est sublime . L'accueil et le personnel était parfait,None,"9,6",Appart'hôtel,Nantes," 8,7 "
Korbendallas23,France,0,2019-08-11 00:00:00,Exceptionnel,"Excellent Accueil, petit kit de ménage, bien vu !!",None,10,Appart'hôtel,Nantes," 8,7 "
Julie,France,0,2019-08-11 00:00:00,Exceptionnel,Appartement tres bien équipé et propre,None,"9,6",Appart'hôtel,Nantes," 8,7 "
Facility,France,0,2019-08-09 00:00:00,TRES BON SEJOUR,"Hôtel agréable et bien entretenu - chambre très spacieuse, bien équipée - personnel très aimable et à l'écoute - très bon emplacement avec toutes les commodités",None,10,Appart'hôtel,Nantes," 8,7 "
Arthur,France,1,2019-08-08 00:00:00,Chambre très opérationnelle et très confortable. Je recommande vivement.,"La kitchinette très opérationnelle est compète et permet d'être autonome. La proximité du centre commercial de Beaulieu permet d'ailleurs de faire des courses jusqu'à des heures tardives (Hyper marché Carrefour ouvert jusqu'à 22H).
Le personnel est très agréable.
La literie est exceptionnelle (c'est pour ca d'abord qu'on est là).","Un peu décentré (par rapport aux lieux animés) mais pas tant que cela. 
Le petit déjeuné pourrait être plus varié: saumon, fuits secs, légumes.","8,8",Appart'hôtel,Nantes," 8,7 "
Audrey,France,0,2019-08-07 00:00:00,Très bien,L'hôtel est bien placé et personnel très gentil,Dommage qu'au petit déjeuner il n'y pas de produit frais,"9,2",Appart'hôtel,Nantes," 8,7 "
Sophie,France,0,2019-08-04 00:00:00,Bien ,Le petit déjeuner ; la tranquillité des lieux. La suite correcte. Séjour agréable. Personnels disponibles et professionnels,Un rafraîchissement des équipements et du mobilier ... des moquettes des joints de la baignoire,"7,5",Appart'hôtel,Nantes," 8,7 "
Jacqueline,France,0,2019-08-03 00:00:00,correspondant à nos besoins,"j'avais réservé cet établissement,car il y avait une kitchenette.",None,10,Appart'hôtel,Nantes," 8,7 "
Facility,France,0,2019-07-26 00:00:00,EXCELLENT SEJOUR,"Les chambres spacieuses, un grand bureau, la literie très confortable, la kitchenette, la climatisation, le spa très agréable, le personnel très aimable et serviable","La quartier manque un peu de charme mais il y a vraiment toutes les commodités (restau, supermarché, centre commercial, transports, etc ...)","9,6",Appart'hôtel,Nantes," 8,7 "
Carole,France,0,2019-07-23 00:00:00,Séjour très agréable au sein de cet hôtel,Toutes les prestations de cet hôtel sont excellentes.,None,10,Appart'hôtel,Nantes," 8,7 "
Emmanuel,France,0,2019-07-21 00:00:00,Exceptionnel,"La chambre très utile (partie cusine intégrée à la suite)
Lit très confortable
Situé à quelques centaines de mètres des li eux touristiques
Petit déjeuner juste parfait et très fourni",None,"9,6",Appart'hôtel,Nantes," 8,7 "
Emmanuel,France,0,2019-07-18 00:00:00,parfait,le confort le calme la gentillesse du personnel,None,"9,6",Appart'hôtel,Nantes," 8,7 "
Narymene,France,0,2019-07-17 00:00:00,Satisfaite à 100%,"J’ai passé une seule nuit là-bas , c’était agréable le personnel souriant la chambre très propre , a refaire sans hésiter",None,"9,6",Appart'hôtel,Nantes," 8,7 "
Yamina,France,0,2019-07-16 00:00:00,Exceptionnel,"Propre, confortable, bien situé",Rien,10,Appart'hôtel,Nantes," 8,7 "
Cheikh,Sénégal,0,2019-07-16 00:00:00,Bon séjour dans l ensemble,Le calme les équipements et le confort,L insistance des femmes de chambre à faire libérer la chambre alors que vous n êtes pas prêt!,"8,8",Appart'hôtel,Nantes," 8,7 "
François,France,0,2019-07-16 00:00:00,"Bon séjour, nous reviendrons.","La taille de la chambre et la petite cuisine. Le petit déjeuner varié. le parking un peu cher mais permettant d'avoir l'esprit tranquille. Un espace fumeur aménagé, même si ce n'est pas bien de fumer ...",J’espère que la bâche de protection de l'espace fumeur sera remise pour la saison des pluies ...,"9,2",Appart'hôtel,Nantes," 8,7 "
Hongfei,France,0,2019-07-15 00:00:00,Séjours confort et sympathique,"Le confort de la chambre, la propreté et la gentillesse de l’accueil.",La sèche serviette trop près de l’toilette. Le prix du spa est élevé.,"9,2",Appart'hôtel,Nantes," 8,7 "
Patrick,France,0,2019-07-14 00:00:00,Légèrement distant du centre. Haut niveau de service et de professionnalisme.,"L’accueil, le niveau de service et de compétence du personnel.
Le parking sécurisé et facile d'accès.",None,"9,2",Appart'hôtel,Nantes," 8,7 "
Marie,France,0,2019-07-08 00:00:00,Exceptionnel,"Le petit-déjeuner était varié, la salle très agréable je recommande !",None,10,Appart'hôtel,Nantes," 8,7 "
