nom,pays,favorite,date,titre,bons_points,mauvais_points,note,type_etablissement,lieu,note_etablissement
Jenny,France,0,2019-07-07 00:00:00,Très bien,"La taille de la chambre, le mobilier, petits accessoires d'accueil dans la salle de bain, la baignoire plutôt qu'une douche....","Les petits-déjeuners à 14 euros, qui n'en valent guère plus de 10. il n'y avait pas d'oeufs, ou de nourriture chaude.... l'attente de 10 minutes pour obtenir du pain qui plus est arrivé congelé. Trop peu de choix. Donc prix excessif. 
La literie est correct.","8,3",Appart'hôtel,Nantes," 8,7 "
Karim,France,0,2019-07-06 00:00:00,Très bien,Bon petit déjeuner et pas cher!,None,"8,3",Appart'hôtel,Nantes," 8,7 "
Philippe,France,0,2019-07-03 00:00:00,Exceptionnel,.,None,"9,6",Appart'hôtel,Nantes," 8,7 "
Adrien,France,0,2019-05-21 00:00:00,Exceptionnel,Bel établissement propre et calme,None,10,Appart'hôtel,Nantes," 8,7 "
Nicolas,France,0,2019-05-12 00:00:00,Exceptionnel,"Hôtel vraiment au top, calme et propre!! 
Accueil super!! A Conseiller",RAS,10,Appart'hôtel,Nantes," 8,7 "
Aurélie,France,0,2019-05-12 00:00:00,Bien ,"Propreté 
Grand lit confortable 
Salle de bain spacieuse avec baignoire 
Chambre spacieuse","Éloigné du centre ville 15 mins à pieds
Pas beaucoup d’ustensiles cuisine dans la chambre","7,9",Appart'hôtel,Nantes," 8,7 "
Jean-françois,Allemagne,0,2019-05-09 00:00:00,Bien ,"Parking sous terrain très pratique.
Petit-déjeuner très convenable ,bon rapport/qualité prix.",None,"7,9",Appart'hôtel,Nantes," 8,7 "
Vincent,France,0,2019-05-07 00:00:00,Fabuleux ,Très bon accueil -plan détaillé de la ville et explications de l hôtesse en bonus !,None,"9,2",Appart'hôtel,Nantes," 8,7 "
Gabriel,France,0,2019-05-06 00:00:00,Exceptionnel,"Emplacement 
Confort 
Propreté",None,10,Appart'hôtel,Nantes," 8,7 "
Benoît,France,0,2019-04-30 00:00:00,Fabuleux ,le personnel à l'écoute,None,"9,2",Appart'hôtel,Nantes," 8,7 "
Monsieurbubu,France,0,2019-04-29 00:00:00,Séjour familiale,"L'agencement de la suite familiale, la propreté, la facilité de stationnement et l'accueil du personnel.",Le bruit de nos voisins du dessus en pleine nuit et le bruit de l'ascenseur que nous entendions dans la chambre,"8,3",Appart'hôtel,Nantes," 8,7 "
Frederic,France,0,2019-04-29 00:00:00,Bien ,La qualité de la literie,Equipements cuisine insuffisants : en particulier pas grand choses comme ustensiles de travail,"7,9",Appart'hôtel,Nantes," 8,7 "
Frédéric,France,0,2019-04-28 00:00:00,Superbe,"- personnel tres agréable
- bon petit déjeuner
- spa agréable
- vue assez dégagée des chambres (9eme étage)
- quartier sans grand charme mais pas désagréable et pas très loin du centre","- chauffage difficile à régler (pour nous trop chaud)
- spa payant","8,8",Appart'hôtel,Nantes," 8,7 "
Christophe,France,0,2019-04-28 00:00:00,Bien ,"Le personnel est très serviable et accueillant, idéal pour les familles. Le petit déjeuner est excellent. Le calme des chambres et le coin cuisine pour dépanner très complet. L’emplacement accessible à pied depuis la gare et rendant facile l’accès du centre ville.","Le manque d’un deuxième rideau pour le séjour, la lumière des lampadaires du dehors pénétrant la pièce.","7,9",Appart'hôtel,Nantes," 8,7 "
Agnes,France,0,2019-04-27 00:00:00,Exceptionnel,tout,None,"9,6",Appart'hôtel,Nantes," 8,7 "
Julie,France,0,2019-04-24 00:00:00,Superbe,La literie,Les circulations un peu froides,"8,8",Appart'hôtel,Nantes," 8,7 "
François,France,0,2019-04-22 00:00:00,Très correct,"Literie
L'accueil des enfants pour la fête de Pâques par l'équipe du dimanche après-midi
Le personnel à l'accueil très gentil et très prévenant",Vérifier le nombre d'oreiller car il en manquait 1 sur 4 dans la chambre familiale,"9,6",Appart'hôtel,Nantes," 8,7 "
Aline,France,0,2019-04-22 00:00:00,Exceptionnel,"Bien placé, agréable et silencieux.",None,10,Appart'hôtel,Nantes," 8,7 "
Julien,France,0,2019-04-21 00:00:00,Excellent !,Le personnel à très gentiment accepté de changer notre chambre car elle n’avait pas de baignoire. Hôtel idéal pour visiter la ville.,None,10,Appart'hôtel,Nantes," 8,7 "
Julien,France,0,2019-04-20 00:00:00,Exceptionnel,None,Le supplément demandé pour le stationnement... un peu mesquin,10,Appart'hôtel,Nantes," 8,7 "
Steves,France,0,2019-04-20 00:00:00,Exceptionnel,"Très bien , propre , très bon accueil ,",C’est assez tôt pour quitter l’hôtel mais sinon tout est bon,"9,6",Appart'hôtel,Nantes," 8,7 "
Hugo,France,0,2019-04-15 00:00:00,"Super accueil, suites spacieuses, le spa est super et très bon emplacement.",Le jacuzzi,Rien,10,Appart'hôtel,Nantes," 8,7 "
Strad,France,0,2019-04-12 00:00:00,Exceptionnel,"Tout était parfait, j’ai été surclassée en suite , personnel très gentil chambre confortable , bon petit déjeuner TRÈS BIEN",Rien,10,Appart'hôtel,Nantes," 8,7 "
Virgivie,France,0,2019-04-01 00:00:00,Au top,Un établissement au top et un personnel super sympa et disponible,None,10,Appart'hôtel,Nantes," 8,7 "
Roselyne,France,0,2019-03-20 00:00:00,Je reviendrai si nécessaire,"Le confort, l'accueil, l'excellent petit déjeuner et pour moi son emplacement primordial",Problème électrique signalé à l'accueil,"9,2",Appart'hôtel,Nantes," 8,7 "
Digo,France,0,2019-02-17 00:00:00,A améliorer mais ça reste convenable,Bien et excellent,Un peu froid,"9,2",Appart'hôtel,Nantes," 8,7 "
Nelly,France,0,2019-02-12 00:00:00,fabuleux,"j'ai aimé le confort du lit ,la propreté de l'hôtel qui est très bien situé à quelque pas des transports publiques",None,"7,9",Appart'hôtel,Nantes," 8,7 "
Pierre,France,0,2019-02-11 00:00:00,Séjour court d'une nuit mais bel emplacement et hôtel très confortable,"L'établissement est très bien situé, très bien insonorisé, le lit est grand et vraiment confortable. Nous avons apprécié la baignoire ainsi que tout ces petits ""plus"" qui agrémentent la vie.",None,10,Appart'hôtel,Nantes," 8,7 "
Hervé,France,0,2019-02-10 00:00:00,établissement très agréable et personnel accueillant,"grand lit confortable, appartement très spacieux","Pour agrémenter le petit déjeuner des personnes ne mangeant pas de pain, il serait agréable de proposer des graines de toutes sortes au petit déjeuner",10,Appart'hôtel,Nantes," 8,7 "
Hubert,France,0,2019-02-03 00:00:00,Exceptionnel,"L'accueil, le confort, le silence",Rien,10,Appart'hôtel,Nantes," 8,7 "
Clémence,France,0,2019-01-27 00:00:00,Exceptionnel,"Chambres spacieuses et bien équipées. L'hôtel est bien placé, et permet de profiter de la ville à pieds. Petit déjeuner bien fourni, nous nous sommes régalés !",None,10,Appart'hôtel,Nantes," 8,7 "
Bernard,France,0,2019-01-26 00:00:00,On est jamais déçu chez Urban Suites,La qualité générale de l'établissement,Rein,"9,6",Appart'hôtel,Nantes," 8,7 "
Leonelli,France,0,2019-01-23 00:00:00,Exceptionnel,"La propreté ,la gentillesse du personnel 
Le spa ,la possibilité de manger à toute heure",Rien,10,Appart'hôtel,Nantes," 8,7 "
Fabienne,France,0,2019-01-23 00:00:00,Exceptionnel,"Très bien accueilli , chambre très confortable et notre moment passé au spa très apprécié",Plus éloigné du centre ville que nous pensions Mais Avec les uber très accessible et rapide,"9,6",Appart'hôtel,Nantes," 8,7 "
Caroline,France,0,2019-01-12 00:00:00,Superbe,"Une literie excellente, un personnel très accueillant et arrangeant, un petit déjeuné de grande qualité et très varié.",Rien,"8,8",Appart'hôtel,Nantes," 8,7 "
Lucette,France,0,2019-01-08 00:00:00,nous avons apprécier cette hôtel,"petit déjeuner copieux et varier aussi bien en sucre quand sale 
qu'il fasse un geste pour le jus de fruit (orange et pamplemousse que je digère pas a était remplacer pas du jus d ananas )
un accueil chaleureux","les camera dans l'espace détente même si je comprend le pourquoi 
la résonance de l’ascenseur dans la chambre ( 8eme étage ) 
le parking payant",10,Appart'hôtel,Nantes," 8,7 "
Laurent10,France,0,2019-01-04 00:00:00,Bien ,La réaction du personnel à l entrée qui a su rectifier cette insuffisance par leurs gentillesse et leurs réactions . Et pour cela je le recommande,La chambre n était pas clean,"7,5",Appart'hôtel,Nantes," 8,7 "
Pascale,France,0,2019-01-04 00:00:00,Exceptionnel,"Équipe très accueillante.
Le spa,très agréable, nous a permis une pause zen dans un programme de découverte de Nantes.
Emplacement idéal à proximité d’un arrêt de bus qui rend Nantes très accessible.
À recommander",None,10,Appart'hôtel,Nantes," 8,7 "
David,France,0,2019-01-02 00:00:00,Superbe,"L'emplacement, l'équipement","Rien, c'était parfait!","8,8",Appart'hôtel,Nantes," 8,7 "
Amelie,France,0,2019-01-02 00:00:00,"Très bon séjour, hotel agreable","Les attentions particulières, la propreté du lieu, le graaand lit",None,"9,6",Appart'hôtel,Nantes," 8,7 "
Belinha,France,0,2019-01-01 00:00:00,Fabuleux ,Le personnel très agréable,L emplacement est dans une zone pas très agréable,"9,2",Appart'hôtel,Nantes," 8,7 "
Coline,France,0,2019-01-01 00:00:00,Très chouette nouvel an,"Lit super moelleux, accueil chaleureuse ! MERCI !",None,"8,8",Appart'hôtel,Nantes," 8,7 "
Marc,France,0,2018-12-28 00:00:00,Exceptionnel,"Confort, propreté, grandeur de la chambre, petite cuisine bien équipée",Rien,"9,6",Appart'hôtel,Nantes," 8,7 "
Thierry,France,0,2018-12-25 00:00:00,Emplacement fabuleux dans une belle structure,Accueil chaleureux et professionnel,None,10,Appart'hôtel,Nantes," 8,7 "
Anne,Maroc,1,2019-01-15 00:00:00,Exceptionnel,"Les chambres spacieuses et luxueuses ,la literie exceptionnelle, le téléviseur grand écran.Le personnel aimable et compétent.Le reve en un mot....",Tout a été plus que parfait sans oublier les petits déjeuners,10,Hôtel,Nantes," 8,6 "
Alain,France,0,2020-03-10 00:00:00,Conforme à mes attentes,La disponibilité et la gentillesse des équipes ex,None,"8,0",Hôtel,Nantes," 8,6 "
Herve,France,0,2020-03-02 00:00:00,parfait ! à réserver les yeux fermés.,"un personnel aux petits soins, une décoration tendance digne d'un magazine de décoration, du service, une propreté irréprochable, chambres silencieuses, situation en coeur de ville exceptionnelle, je recommande vivement !",None,10,Hôtel,Nantes," 8,6 "
Francoise,France,0,2020-03-01 00:00:00,Parfait,Tout,Rien,10,Hôtel,Nantes," 8,6 "
Anne,France,0,2020-03-01 00:00:00,Hôtel très bien,"L’établissement est très bien situé, parking juste à côté, personnel très agréable.",Ras,"8,8",Hôtel,Nantes," 8,6 "
Caroline,France,0,2020-02-23 00:00:00,Très bien,"Central, calme et bien décoré.","Pas de machine à expresso dans la chambre ni de boissons dans le minibar, chose habituelle dans d'autres hôtels Mercure","8,0",Hôtel,Nantes," 8,6 "
Vincent,France,0,2020-02-19 00:00:00,Tout simplement parfait,"Établissement idéalement situé 
Personnel attentionné et charmant 
Je recommande vivement 
Tout a été parfait",Rien,10,Hôtel,Nantes," 8,6 "
Pascale,France,0,2020-02-19 00:00:00,Très bon séjour et très bon service mais chambre trop petite non isolée de la salle d'eau/toilettes,Tout le reste était très bien.,La chambre était très petite et la salle d'eau comprenant les toilettes était séparée du lit seulement avec une porte coulissante non isolée du reste de la pièce.,"8,0",Hôtel,Nantes," 8,6 "
Salomé,France,0,2020-02-17 00:00:00,Hôtel rénové avec goût,"La déco
Le petit-déjeuner","Lampe qui se décrochait dans la chambre
Eau de la douche/bain pas assez chaude
Lit de 140cm... un lit de 160 aurait été top !","8,8",Hôtel,Nantes," 8,6 "
Lionel,France,0,2020-02-16 00:00:00,Exceptionnel,"Attention du personnel
Literie et agencement de la chambre 
Emplacement",None,10,Hôtel,Nantes," 8,6 "
Julie,France,0,2020-02-16 00:00:00,Très bon week-end,L’emplacement est top!,Rien à signaler!,"8,3",Hôtel,Nantes," 8,6 "
Benjamin,France,0,2020-02-09 00:00:00,Fabuleux ,"Emplacement parfait
Jolie deco
Literie confortable
Salle de bain neuve","Odeur des toilettes pas nickel. 
Chambre assez petite","9,2",Hôtel,Nantes," 8,6 "
Gwenaelle,France,0,2020-02-03 00:00:00,trés agréable .,"Petit déjeuner correct en lien avec le standing de l'hotel ,c'est dommage que vous n'utilisiez pas plus de produits régionaux ( bellvaire).","C'est dommage que vous utilisiez encore des verres en plastique dans la salle de bain ,ce n'est pas trés green...","8,0",Hôtel,Nantes," 8,6 "
Sadio,France,0,2020-02-02 00:00:00,Exceptionnel,Emplacement en plein centre ville..,Rien,"9,6",Hôtel,Nantes," 8,6 "
Myriam,France,0,2020-01-25 00:00:00,Belle chambre dans un cadre superbe,"Personnel accueillant.
Chambre avec une belle décoration.
Le tarif est élevé mais justifié par une prestation de qualité",None,"9,0",Hôtel,Nantes," 8,6 "
Lodan,France,0,2020-01-23 00:00:00,Séjour Nantes,"Emplacement idéal, chambre superbe, salle de bains superbe, petit déjeuner buffet parfait. Hôtel magnifique et accueil chaleureux",Ras,10,Hôtel,Nantes," 8,6 "
Thierry,France,0,2020-01-09 00:00:00,Très bien,Emplacement. Personnel très accueillant,None,"8,0",Hôtel,Nantes," 8,6 "
Bastien,France,0,2019-12-31 00:00:00,Exceptionnel,Magnifique chambre,None,"9,6",Hôtel,Nantes," 8,6 "
Helene,France,0,2019-12-30 00:00:00,Exceptionnel,None,La pression de l’eau pour prendre une douche,10,Hôtel,Nantes," 8,6 "
Pascal,France,0,2019-12-30 00:00:00,Fabuleux ,"Bon emplacement , belle deco et personnel sympathique",Poubelle de la chambre non vidée,"9,2",Hôtel,Nantes," 8,6 "
Frank,France,0,2019-12-23 00:00:00,Exceptionnel,Excellent emplacement. Hôtel à la déco soignée. Chambre spacieuse et agréable. Literie de qualité. Très bon Pti déj..,None,10,Hôtel,Nantes," 8,6 "
Helene,France,0,2019-12-22 00:00:00,Bien,Le professionnalisme du personnel,None,10,Hôtel,Nantes," 8,6 "
Emmanuelle,France,0,2019-12-16 00:00:00,Endroit que je recommande,L’ambiance du lieu et l’accueil chaleureux,Le bruit dans la rue la nuit. Mauvaise isolation phonique,"8,0",Hôtel,Nantes," 8,6 "
Chris,France,0,2019-12-09 00:00:00,Très bien,Hôtel bien situé,"J’avais réservé pour trois personnes (deux adultes et une enfant de trois ans)nous avons eu deux chambres non communicante.
J’aurais aimé être informé","8,3",Hôtel,Nantes," 8,6 "
Marion,France,0,2019-11-24 00:00:00,Excellent séjour. Personnel très gentil,La gentillesse du personnel. Le confort de la literie et la décoration des chambres.,None,"9,0",Hôtel,Nantes," 8,6 "
Myweb,France,0,2019-11-19 00:00:00,Exceptionnel,La deco,Je n ai pas trop aimé le fait qu il n y ai pas d accueil. Salle de repas et accueil tt est ouvert.,"9,6",Hôtel,Nantes," 8,6 "
Chris,France,0,2019-11-17 00:00:00,Une équipe à notre écoute,"Nous avons aimé la disponibilité du personnel,l’établissement est vraiment très joli et propre. Je reviendrai avec plaisir.",None,10,Hôtel,Nantes," 8,6 "
Sarah,France,0,2019-11-12 00:00:00,Très bien placé,L’emplacement est parfait pour se balader dans Nantes et d’excellents restaurants à proximité sur les conseils de l’équipe réception.,La chambre un peu petite.,"8,3",Hôtel,Nantes," 8,6 "
Joseph,France,0,2019-11-05 00:00:00,très bien le personnel très agréable,None,lit un peu petit,"8,0",Hôtel,Nantes," 8,6 "
Stephane,France,0,2019-11-05 00:00:00,Très bien,None,Le lavabo de la salle de bain.,"8,0",Hôtel,Nantes," 8,6 "
Sylvain,Nouvelle-Zélande,0,2019-11-04 00:00:00,Très bien,None,Bruyant dans la rue,"8,3",Hôtel,Nantes," 8,6 "
Emmanuelle,France,0,2019-11-03 00:00:00,"Hôtel chaleureux, très bien rénové, personnel adorable , Très confortable par temps de pluie.","Hôtel chaleureux, très bien rénové, personnel adorable.",None,"8,8",Hôtel,Nantes," 8,6 "
Hélène,France,0,2019-11-03 00:00:00,Un peu cher mais très agréable.,Très bon emplacement en centre ville. Joli décoration. Personnel très serviable,Le matelas un peu trop mou et la salle de bon très petite. La couette trop chaude .,"7,9",Hôtel,Nantes," 8,6 "
Marilyn,France,0,2019-11-03 00:00:00,Moment inoubliable pour un week end en amoureux !,L emplacement est exceptionnel et le confort de la chambre est tout à fait à la hauteur !,"Petite déception pour le petit déjeuner apporté en chambre, en retard sur l horaire demandé, et peu en quantité et en choix finalement.","8,8",Hôtel,Nantes," 8,6 "
Sylvie,France,0,2019-11-03 00:00:00,Super séjour,"Tout !!!!
Le personnel est super 
Agréablement surprise par le calme de l’hôtel qui pourtant est en plein centre",Rien ...,"9,6",Hôtel,Nantes," 8,6 "
Anne,France,0,2019-10-27 00:00:00,Exceptionnel,"L’hôtel est très bien situé, le personnel très accueillant, la chambre était parfaite et sans aucun bruit. Nous reviendrons avec plaisir.",None,10,Hôtel,Nantes," 8,6 "
Christine,France,0,2019-10-24 00:00:00,Exceptionnel,"Hôtel très bien situé, une décoration tendance, , des prestations de qualité",None,"9,6",Hôtel,Nantes," 8,6 "
Lucie,France,0,2019-10-23 00:00:00,"Très bien, je recommanderai.","L'accueil, l'emplacement, la propreté. Nous avons été mise dans une grande chambre, ce qui était encore plus confortable que prévu.","Pas grand chose, nous avons utilisé le service de bagagerie, celui ci n'était pas trop surveillé, nous avons récupéré nos bagages nous même dans la pièce car il n'y avait personne à l'accueil.","9,0",Hôtel,Nantes," 8,6 "
Peggy,France,0,2019-10-22 00:00:00,La déco ne fait pas tout.,"Hôtel refait totalement : nouveau look, nouveau concept. La déco est très sympa, les tons et accessoires sont choisis avec goût, c'est cosy, on a tendance à s'y sentir bien d'une manière générale.","Le nouveau concept : il n'y a plus d'accueil physique. À l'arrivée dans l'hôtel, on ne sait pas où se diriger, ni à qui s'adresser. Une personne est installée sur une grande table dans la partie restaurant (?), en train de manger un plat dans une barquette. Ça sent un mélange de plat cuisiné, et d'égouts (des problèmes de ce coté là ?) dans tout le rez-de-chaussée. Surprise il s'agit de la personne qui doit vous accueillir ! Du coup, on a l'impression de la déranger, mais elle nous accueille avec le sourire, au milieu de tout et de rien, puisqu'il n'y a plus d'accueil et que l'on ne sait pas ni où se mettre, ni où mettre ses affaires. Mais elle nous explique que c'est nouveau, c'est pour plus de proximité avec le client puisqu'il n'y a plus de comptoir qui nous sépare. À part pour lui faire un hug, je ne vois pas bien l'intérêt, mais soit.
Ce sera comme ça pendant 2 jours, on ne sait pas à qui s'adresser, on a l'impression de clairement déranger. Et pire au moment de partir, puisque plusieurs personnes attendent d'être accueillies, mais ne savent pas où se diriger, ni dans quel ordre passer.
Nous souhaitions dormir, nous avons mis le petit signe ""do not disturb"". Et là, à 13h, un homme de l'équipe de ménage tape à la porte et nous réveille pour faire le ménage, clairement il est déjà tard pour lui ! Pas d'excuses de sa part, pas un sourire. Merci. Nous travaillons dans le spectacle, nous sommes rentrées tard, oui nous dormons à 13h. Nous en faisons part à la personne qui ère au rez-de-chaussée, sa réponse : ""Mais il était quelle heure ?"" (sous-entendu, à partir d'une certaine heure il a le droit de vous déranger), et ensuite, ""ah mais il fallait mettre le panneau 'ne pas faire le ménage' !"". Zut, c'est donc notre faute, nous n'avons pas mis le bon panneau !!!","7,5",Hôtel,Nantes," 8,6 "
Mayaklain,France,0,2019-10-15 00:00:00,Fabuleux ,"La literie très confortable, la situation géographique, il est en plein cœur de ville, juste à coté du passage Pommeraye la gentillesse du personnel, petit dej au top",chambre vieillotte toilette dans la salle de bain et chambre trop petite,"9,2",Hôtel,Nantes," 8,6 "
Pauline,France,0,2019-10-11 00:00:00,"Hôtel très bien situé, et chambre très agréable","Etablissement très central, très bien situé par rapport aux rues commerçantes et aux divers points d'intérêt du centre-ville. La chambre était relativement spacieuse, aménagée avec goût et avec touts les équipements nécessaires.",None,"9,2",Hôtel,Nantes," 8,6 "
Jean-christophe,France,0,2019-10-09 00:00:00,Exceptionnel,"Emplacement en plein de cœur de ville
Très bien isolé 
Chambre bien équipée et bien décorée 
Bonne literie 
Personnel agréable","Petit déjeuner a améliorer 
Crêpes froides - peu de choix",10,Hôtel,Nantes," 8,6 "
Marie-christine,France,0,2019-10-08 00:00:00,Très bien,"la situation, le cadre, l'acueil",None,"8,0",Hôtel,Nantes," 8,6 "
Ahmed,Maroc,0,2019-10-07 00:00:00,Sejour agreable,"Les croissants chauds 
Lit confortable",None,"8,0",Hôtel,Nantes," 8,6 "
Eric,France,0,2019-10-06 00:00:00,Une magnifique escapade amoureuse.,"Nous avons été ravis de l'accueil adorable et attentionné de Capucine, Delphine et leurs collègues. Un grand merci pour nous avoir surclassés. La mise à disposition des flûtes et du seau à Champagne nous ont permis d'apporter une teinte glamour à ce séjour. 
 En 24h et une nuit, nous nous sommes fait de magnifiques souvenirs...😊🤩",None,"9,6",Hôtel,Nantes," 8,6 "
Catherine,France,0,2019-10-02 00:00:00,Pour une nuit c’est ok,"Emplacement très bien
Hôtel espace réduit , chambre et salle de bain trop petit",None,"9,0",Hôtel,Nantes," 8,6 "
Marie,France,0,2019-09-26 00:00:00,Super,"Copieux
ESprit convivial",-,"8,8",Hôtel,Nantes," 8,6 "
Christele,France,0,2019-09-20 00:00:00,très bon séjour,Etablissement très bien située . Personnel dispo,None,10,Hôtel,Nantes," 8,6 "
Florence,France,0,2019-09-19 00:00:00,Nous avons passé un agréable moment dans cet hôtel.,La décoration de la chambre et de l'hôtel en général. La chambre donnait sur une cour donc c'était silencieux. La douche était spacieuse.,Quelques joints dans la douche sont à refaire mais rien de grave.,"9,0",Hôtel,Nantes," 8,6 "
Pierre-jean,Suisse,0,2019-09-15 00:00:00,Chambre confortable mais triste: entièrement peinte en noir! Lumière insuffisante,None,"Pas d’information sur l’accès difficile à travers une zone piétonne, inaccessible en voiture sans mot de passe, que nous n’avions pas reçu !","7,5",Hôtel,Nantes," 8,6 "
Clément,France,0,2019-09-10 00:00:00,Très bon hôtel bien situé,"Hôtel très bien situé, en face du passage pommeraye. Le personnel a été adorable avec nous. Le petit-déjeuner était bon et copieux.",None,"9,2",Hôtel,Nantes," 8,6 "
Chloé,France,0,2019-09-01 00:00:00,"Très bon hôtel, mais situer proche d’animation en centre ville. Du bruit la nuit","Lit très confortable, Nespresso a disposition dans la chambre. Petit déjeuner très complet.",2 paignoires pour trois personnes. Clim trop forte à la prise de la chambre,"9,6",Hôtel,Nantes," 8,6 "
Jean,Belgique,0,2019-08-30 00:00:00,Notre séjour a été tout à fait agréable malgré la forte chaleur.,Le petit déjeuner très bon et varié. On aurait souhaité que l'accès en voiture soit possible avec un accès parking.,L'accessibité en voiture.Notre séjour a été fort agr,"8,8",Hôtel,Nantes," 8,6 "
Regis,France,0,2019-08-28 00:00:00,Belle expérience,"Le confort, la décoration, la simplicité de l'équipe d'accueil, l'emplacement en hyper centre",quelques traces de poussières à plusieurs endroits dans la chambre,"9,6",Hôtel,Nantes," 8,6 "
Melgie,France,0,2019-08-26 00:00:00,Exceptionnel,"Nous avons tout aimé ! l'emplacement, la déco, l'accueil, la disponibilité, séjour très agréable. Nous y retournerons !","Un seul bémol au niveau de la salle de bain, il n'y a avait pas de nécessaire de toilette, c'est une chose que j'aime bien trouver. Mais ce n'est qu'un détail.","9,6",Hôtel,Nantes," 8,6 "
Jeanne,France,0,2019-08-25 00:00:00,Bien ,None,"Comment se rendre à l'hôtel quand il n'est pas précisé que le quartier est piéton?
Il n'est pas très agréable de traîner ses bagages après avoir eu beaucoup de difficultés pour garer sa voiture!!","7,9",Hôtel,Nantes," 8,6 "
Xavier,France,0,2019-08-22 00:00:00,Hôtel intéressant pour sa situation géographique,Lit confortable,Chambre sombre et pas prête à 17h30 bruit petit déjeuner varie mais manque jus d'orange frais salade de fruit ou fruit frais il n'y avait que des pommes!,"8,3",Hôtel,Nantes," 8,6 "
Patrick,France,0,2019-08-22 00:00:00,Très bien,Excellent petit déjeuner et amabilité du personnel.,Chambre un peu petite.,"8,3",Hôtel,Nantes," 8,6 "
Fanny,France,0,2019-08-22 00:00:00,Agréable court séjour sur Nantes en famille dans un joli cadre,"La décoration, l'extrême centre ville",Le petit déjeuner pourrait être plus diversifié,10,Hôtel,Nantes," 8,6 "
Manuel,France,0,2019-08-18 00:00:00,Bien ,Séjour agréable et accueil au top,Lit trop petit (140 par 190),"7,5",Hôtel,Nantes," 8,6 "
Juliette,France,0,2019-08-18 00:00:00,Très Bel hôtel bien situé,"Les + 
-Au cœur du centre ville mais rue piétonne peu accessible en voiture 
-Literie super confortable et vaste 
- décoration soignée et vraiment réussie ! 
- chambre spacieuse 
- Bon rapport qualité prix","Les - 
- Ménage, Poussière sur notre tête de lit qui ne datait pas d’un jour 
- lit bébé du petit arrive en retard, pas d’oreiller ni de couverture ... 
- Personnel débordé et non à la hauteur d’un 4etoiles. Accueil en vrac, personnel davantage accaparé par le téléphone que par les clients sur place , pas de bureau de réception donc un membre du personnel avait étalé assiette repas , papiers dans la salle principale ...drôle d’effet","7,5",Hôtel,Nantes," 8,6 "
