nom,pays,favorite,date,titre,bons_points,mauvais_points,note,type_etablissement,lieu,note_etablissement
Pascale,France,0,2019-12-27 00:00:00,Parfait je recommande,Le lieu le professionnalisme du personnel,RAS,10,Hôtel,Cannes," 7,9 "
Mauro,Suisse,0,2019-12-17 00:00:00,Super relaxant,"Super hotel face a la mer , j ai eu la chance d etre surclassė. le Spa est gènial.super relaxant",None,10,Hôtel,Cannes," 7,9 "
Clement,France,0,2019-12-16 00:00:00,Exceptionnel,Tout a était super,Mieux vaut une douche à l’italienne plutôt qu’une petites baignoire,"9,6",Hôtel,Cannes," 7,9 "
Michel,France,0,2019-12-10 00:00:00,Exceptionnel,"Situation 
Personnel très accueillant",None,"9,6",Hôtel,Cannes," 7,9 "
Moslim,France,0,2019-12-08 00:00:00,Hôtel au mieux 4 étoiles - SPA 5 étoiles,"Hotel parfaitement situé ; Personnel agréable ; Accès libre au SPA (compris dans la prestation) et plutôt complet ; Horaires pour le petit déjeuner confortable (même pour les moins matinaux, jusqu'à 11h00).","Chambre avec des équipements usagés, miroir de la SDB rouillé, Douchette en mauvais état, Poussière dans la SDB, Serviettes à l'arrivée avec odeur d'humidité, WC mal fixé, brosse WC cassée, Sèche cheveux poussiéreux et collant, ... particulièrement déçus par la chambre, qui n'est à notre sens (et objectivement) pas à la hauteur d'un 5 étoiles.
Autre point de déception : le Petit déjeuner ... nous nous attendions à ce qu'il soit inclus dans le prix affiché sur Booking, et à notre grande surprise NON. Possible erreur de notre part, mais se retrouver à payer un petit déjeuner à 29 euros / personne alors que celui-ci est nettement inférieur à ce qu'on peut s'attendre pour un hotel 5 étoiles (pas de vrai café notamment...).","5,0",Hôtel,Cannes," 7,9 "
Anthony,France,0,2019-12-08 00:00:00,Exceptionnel,"L’accueil, les équipements, le petit déjeuner et l’emplacement",L’isolation entre les chambres,10,Hôtel,Cannes," 7,9 "
Claudine,France,0,2019-11-18 00:00:00,Week-end agréable,Tout le reste le petit-déjeuner avec énormément de choix les équipements du spa et la petite attention dans la chambre à notre arrives pour l a anniversaire de mon conjoint,Le lit un peu petit,"9,6",Hôtel,Cannes," 7,9 "
Nathalie,France,0,2019-11-10 00:00:00,À refaire,Accueil parfait sauna piscine chambre ...,None,"9,6",Hôtel,Cannes," 7,9 "
Carmelyas,France,0,2019-11-08 00:00:00,Exceptionnel,Le spa et le jacuzzi extérieur,None,10,Hôtel,Cannes," 7,9 "
Azem,Suisse,0,2019-11-05 00:00:00,A revenir,Personnel très professionnel et enmsble,Rien à dire top de top,"9,6",Hôtel,Cannes," 7,9 "
Jean,France,0,2019-11-03 00:00:00,Bon ,None,"Très mal insonorisé 
Sanitaires moyens
Hôtel vielissant","5,8",Hôtel,Cannes," 7,9 "
Géraldine,France,0,2019-11-03 00:00:00,agréable,le spa,rien,10,Hôtel,Cannes," 7,9 "
Denis,France,0,2019-11-02 00:00:00,"le personnel est au top, les chambres sont trop petites et pas assez au calme.",Le personnel au top.,Les chambres! Très petites par rapport au prix de la nuitée. c'est une honte comparé à d'autres hotels dit de prestige.,"6,2",Hôtel,Cannes," 7,9 "
Giuseppe,France,0,2019-10-28 00:00:00,Que du pur bonheur,"La délicate attention de l'hôtel qui a l'occasion de notre 25ème anniversaire de mariage nous a surclassé et fait trouver une chambre joliment décorée de pétales de roses et une bouteille de champagne 🤗
Le spa magnifique avec piscine à l'eau de mer chauffée.",Rien,10,Hôtel,Cannes," 7,9 "
Guillaume,France,0,2019-10-28 00:00:00,Excellent !,"L'emplacement à un jet de pierre de la croisette, en dessous du vieux Cannes est idéal.
Le Roof-Top avec son restaurant et son bar est le lieu ou il faut diner pour profiter d'une vue intégrale sur la baie de Cannes.
Le Spa est tout simplement exceptionnel, un petit plus pour le jacuzzi extérieur face à la baie !","Le prix du parking privé, trop élevé.",10,Hôtel,Cannes," 7,9 "
Bertrand,France,0,2019-10-25 00:00:00,Exceptionnel,"situation, personnel, tout était tres bien",None,10,Hôtel,Cannes," 7,9 "
Dominique,France,0,2019-10-20 00:00:00,excellent!,"l accueil , le confort de la chambre , les prestations de l hôtel. la literie excellente et tout les produits nécessaires et indispensables pour un établissement de ce standing.",peut etre un petit rafraichissement de la salle de bain,10,Hôtel,Cannes," 7,9 "
Michel,France,0,2019-10-10 00:00:00,En bref bien placé mais pas au niveau d’un 4 étoiles .,"La situation, l’amabilité de certaines réceptionnistes et de la plupart des voituriers.",L’accueil un peu froid parfois...le service au bar panoramique plus que nul... les chambres petites et défraîchies . Certains aliments froids au petit déjeuner...,"6,2",Hôtel,Cannes," 7,9 "
Aubergier,France,0,2019-10-06 00:00:00,Séjour agréable et relaxant,Le personnel très gentil et efficace a toute demande petit déjeuner très copieux beaucoup de choix.,Dommage car pour le prix j’ai eu une chambre vue sur la rue.,10,Hôtel,Cannes," 7,9 "
Allyson,France,0,2019-10-06 00:00:00,Exceptionnel,Le personnel est très agréable et serviable,None,10,Hôtel,Cannes," 7,9 "
Sadoine,France,0,2019-10-06 00:00:00,Excellent,"On a été bien accueilli par le personnel et conseille par rapport à directement activités que l'on pouvait faire à Cannes.
Personnel très professionnel et à l'écoute de sa clientèle 
Je recommande fortement cette établissement",None,10,Hôtel,Cannes," 7,9 "
Jean,France,0,2019-09-23 00:00:00,Passable,None,Hôtel viellisant trop cher et vas beenp,"5,4",Hôtel,Cannes," 7,9 "
Said,France,0,2019-09-17 00:00:00,Exceptionnel,"Super hôtel, personnel au petit soin et très bien situé juste en face du port. Recommande fortement",None,"9,6",Hôtel,Cannes," 7,9 "
Chérifa,France,0,2019-08-26 00:00:00,Passable,"Le lit, la disponibilitée du personnel","La douche ne fonctionnait pas, l’état désastreux des balcons","5,4",Hôtel,Cannes," 7,9 "
Hassan,France,0,2019-08-26 00:00:00,Médiocre ,Non du tout,Tout,"2,9",Hôtel,Cannes," 7,9 "
Lina,France,0,2019-08-24 00:00:00,Au top,Excellent,La salle de bain,"4,2",Hôtel,Cannes," 7,9 "
Samuel,Suisse,0,2019-08-05 00:00:00,"séjour agréable , emplacement idéal",le bar étage supérieur,"le restaurant et sa cuisine libanaise, le déplacement dans les sous-sol pour aller à la piscine.
Piscine par propre plusieurs tâches de rouille, pas traitées.","5,4",Hôtel,Cannes," 7,9 "
Morgan,France,0,2019-07-28 00:00:00,Superbe séjour au Radisson Blu,"Chambre impeccable, personnel au top, souriant et avenant. Je connaissais déjà la qualité du spa, mais alors l hôtel est dans la même lignée, toutes les prestations pour se sentir bien, du haut de gamme tout simplement...",None,10,Hôtel,Cannes," 7,9 "
Gianni,France,0,2019-06-24 00:00:00,Ne pas choisir cet hotel il y a beaucoup mieux ailleurs et moins cher !,pas grand chose,L'hotel est cher pour ce que c'est. Il est dans un mauvais état exterieur. Les photos ne reflètes pas la réalité. Le déjeuner n'était pas bon pour un 5 étoiles. Rien d'extravagant vraiment.,"5,4",Hôtel,Cannes," 7,9 "
Eddy,France,0,2019-06-08 00:00:00,Exceptionnel,Champagne et pétales de rose en cœur sur le lit,Les petits toilettes super étroit (les bras qui touche des 2 côtés digne d’un camping car,10,Hôtel,Cannes," 7,9 "
Valérie,France,0,2019-06-03 00:00:00,Séjour agréable...à refaire,Petit déjeuner excellent….très copieux….personnel très bien,None,10,Hôtel,Cannes," 7,9 "
Benjamin,France,0,2019-06-02 00:00:00,Passable,Bonne emplacement et le spa est agréable.,"La salle de bain était salle : poils dans la baignoire, pansement utilisé et beaucoup de poussière entre le lavabo et la baignoire.
Il y avait des cheveux sur la table de nuit.
Nous avons commandé deux plats à 23h qui étaient médiocres, tout ça pour une chambre au prix de 235€..!","5,4",Hôtel,Cannes," 7,9 "
André,France,0,2019-05-30 00:00:00,Décevant,la gentillesse du personnel,"La taille du lit , la superficie de la chambre (Micro ), le matelas , tout petit écran plat ,l'accès au SPA un vrai labyrinthe bref , avec ma femme nous étions content de changer d'hotel .","4,2",Hôtel,Cannes," 7,9 "
Mathieu,France,0,2019-05-30 00:00:00,'une de miel réussie,Localisation et le super spa,None,10,Hôtel,Cannes," 7,9 "
Benoit,France,0,2019-05-16 00:00:00,Exceptionnel,"L’accès illimité au spa, même le jour du départ. La piscine intérieure / extérieure à l’eau de mer chauffée à 31 C, le top. 
P’tit dej’ magnifique",Rien ne nous a déçu,10,Hôtel,Cannes," 7,9 "
Stephanie,France,0,2019-05-14 00:00:00,"Un excellent séjour, une vue formidable et un personnel attentif.","- L'attention du personnel qui a répondu favorablement a ma demande d'être surclassée pour notre anniversaire de mariage ! Très sympathique nous avons beaucoup apprécié.
- La préparation de la chambre le soir",Points d'amélioration : des volets électriques pour davantage couper de la lumière,"9,6",Hôtel,Cannes," 7,9 "
Hassina,France,0,2019-04-29 00:00:00,Décevant,None,"La Chambre beaucoup trop petite.
Nous avons découvert des poiles sur l’un des matelas.
Toujours courir après le personnel pour obtenir des serviettes, peignoirs ect.
Très mauvais rapport qualité / prix.","4,2",Hôtel,Cannes," 7,9 "
Ramsdam,France,0,2019-04-22 00:00:00,Vraiment dessus,Pas grand chose à part la vue,Le service du personnel,"5,0",Hôtel,Cannes," 7,9 "
Claire,France,0,2019-04-21 00:00:00,"Très moyen, décevant pour un 5 étoiles. Nous n'y retournerons pas",Personnel agréable et souriant,"Chambre vieillotte et mal entretenue, pas à la hauteur d'un 5 étoiles 
Petit déjeuner moyen, pas de grille pain, manque de propreté. .. 5 étoiles à revoir!!!!!!!","4,6",Hôtel,Cannes," 7,9 "
Paola,France,0,2019-04-21 00:00:00,Chère pour l’etat de la chambre. Mais spa incroyable,Grand lit. Petit déjeuné satisfaisant,L’état de la chambre. Coup dans les murs morceau de miroirs manquant.,"5,8",Hôtel,Cannes," 7,9 "
Marie,France,0,2019-04-19 00:00:00,Détente et culture.,"Compétence et amabilité du personnel, notamment au restaurant 360° et en thalassothérapie. Proximité de sites culturels (musée de la Castre, musée Bonnard, Vallauris et îles de Lérins).",Nenion !,10,Hôtel,Cannes," 7,9 "
Celia,France,0,2019-04-14 00:00:00,Au top.,"Le personnel était vraiment au top... 
la chambre spacieuse, salle de bain somptueuse. 
Notre séjour c’est passer à merveille. 
L’espace SPA est vraiment bien.
Je recommande !","Le parking payant au prix de 40€/ nuit. 
Mais les voituriers sont très professionnel et très gentil.",10,Hôtel,Cannes," 7,9 "
Thomas,France,0,2019-04-08 00:00:00,Exceptionnel,"Accueil par le personnel digne d’un hôtel de luxe, accompagné d’une surprise a l’arrivée car nous avons été surclassés dans une suite. La chambre et la vue mer étaient magnifiques",None,10,Hôtel,Cannes," 7,9 "
Hayette,France,0,2019-03-31 00:00:00,Odieux !,"Belle terrasse, belle vue sur la terrasse, confort du lit très bien.","La salle où est servi le petit déjeuner on se croirait dans un self service.. Contrairement au Radisson de Nice On a le choix de manger en salle ou sur la terrasse avec une vue à couper le souffle. On a du changer de chambre car on se croirait dans une cage à poule, on a demandé une chambre de luxe vue sur la ville Les photos sont trompeuses attention.. Un serveur nous a servi deux verres sans support sans apéritif sans serviette On se croirait à la brasserie du coin, Même à la brasserie du coin c’est présentable. Ce n’était pas Digne D’une prestation D’un hôtel cinq étoiles... Nous Ne sommes pas Rester une nuit de plus on a du changer d’hôtel..","5,8",Hôtel,Cannes," 7,9 "
Charles,France,0,2019-03-31 00:00:00,"je n'y retournerai plus jamais,","rien, pas un 5 étoiles restaurant vraiment pas bien ils m'ont resservi 2 fois le plat et 2 fois trop cuit pour ma femme pareil , service digne d'une auberge quelconque ,cher et mauvais","le restaurant, les sdb trop petites, le wc qui gêne quand ont sort de la douche faut être équilibriste et j'en passe...
les thermes pas terrible.... trop de monde et pas très propres","5,4",Hôtel,Cannes," 7,9 "
Stefano,Italie,0,2019-03-30 00:00:00,Exceptionnel,Top,None,10,Hôtel,Cannes," 7,9 "
Angeline,France,0,2019-03-27 00:00:00,Détente dépaysement total tout été très bien.,"De pouvoir profiter de la thalaso toute l’apres Midi un pur bonheur un petit déjeuner parfais avec des produits frai, personnels très accueillant... ont reviendra.",None,10,Hôtel,Cannes," 7,9 "
Bakta,France,0,2019-03-25 00:00:00,Très déçu,La thalasso,"Les chambres sont minuscules et sales.
La rambarde du minuscule balcon est extrêmement sale 
Le petit dej sans saveur","2,9",Hôtel,Cannes," 7,9 "
Wuiart,France,0,2019-03-25 00:00:00,Agréable,"Hotel bien situé 
Petit déjeuner avec un large choix
Chambre spacieuse en suite","Cheveux dans la baignoire...
A l’arrivee, impossible de retrouver notre reservation alors que nous avons réservé sur booking.. très désagréable d’attendre et de voir des clients passer à côté de nous !","6,2",Hôtel,Cannes," 7,9 "
Gerald,France,0,2019-03-16 00:00:00,Passable,L’emplacement,"L’accueil inégal à la réception 
Une bouteille d’eau le premier jour dans la chambre et plus rien.
Très peu de bouteilles dans le mini frigo. Une seule bouteille d’eau
Serviettes pas très agréables","5,4",Hôtel,Cannes," 7,9 "
Valia,France,0,2019-03-08 00:00:00,Un beau WE,"Petit déjeuner au top!
Spas au top!
Chambre basique, propre et personnel au top!",None,"9,6",Hôtel,Cannes," 7,9 "
Cecile,France,0,2019-03-06 00:00:00,Parfait le bonheur,Personnel hyper sympa et deco sublime,None,10,Hôtel,Cannes," 7,9 "
Christine,France,0,2019-03-04 00:00:00,séjour très agréable,l'accessibilité au spa,None,10,Hôtel,Cannes," 7,9 "
Maxime,France,0,2019-02-24 00:00:00,Excellent nous y reviendrons avec plaisir,"Le personnel très accueillant et sympathique ! Chambre très propre 
Le petit déjeuner bien garnis 
Et le centre de bien être excellent",Prix du petit déjeuner un petit peux élever,10,Hôtel,Cannes," 7,9 "
Lisette,France,0,2019-02-17 00:00:00,Passable,Le Personnel de l’hôtel était très très sympathique heureusement d’ailleurs car grâce à eux nous avons pu avoir une chambre plus sympathique,L’établissement tout simplement très vieillissant les chambres sont exigu et petite 10 11 m² tout au plus... On sent bien qu’ils nous ont donné vraiment ce qui resté…La salle de bain est pourri vous regarderez les photos ça vous laisse perplexe,"5,0",Hôtel,Cannes," 7,9 "
Joel,France,0,2019-02-14 00:00:00,Excellent séjour! Pure merveille,"L'amabilité et le professionalisme du personnel, responsable client très à l'écoute et tres attentionné, le grand confort des lits , petit dejeuner tres varié, la piscine du spa , vue splendide, roof top superbe...",L'eclairage dans les chambres un peu insuffisant,10,Hôtel,Cannes," 7,9 "
Enzo,France,0,2019-02-05 00:00:00,Au top,Merci pour la gentillesse et l'accueil !,None,10,Hôtel,Cannes," 7,9 "
Stephanie,France,0,2019-01-30 00:00:00,Exceptionnel,Tout,Rien,10,Hôtel,Cannes," 7,9 "
Rémi,France,0,2019-01-28 00:00:00,Exceptionnel,"Très bonne prestation, tout etais propres , établissement a la hauteur de notre attente",La peinture du toilette etais un peu vielle,10,Hôtel,Cannes," 7,9 "
Marianne,France,0,2019-01-27 00:00:00,Déçue cette fois ci.,"Le spa,le petit déjeuner.","Toujours heureuse d’y venir mais la dernière fois 
J’ Ai été déçue de la chambre, le manque de propreté et le bar à l’étage très cher pour pas grand chose. Je vous rappelle que cela fait presque 10fois que je m’y rend.","6,2",Hôtel,Cannes," 7,9 "
Salomon,France,0,2019-01-27 00:00:00,Confort et volupté,On a tout aimé et en particulier le centre thalassothérapie attenant,None,"9,6",Hôtel,Cannes," 7,9 "
Jc,France,0,2019-01-21 00:00:00,Agréable,Piscine agréable mais surchargé,Chambre tres étroite. Personnel de chambre tres bruyant quand ils se déplacent de chambre en chambre. On nous a réveillé alors qu on dormait en toquant de manière véhémente avant l heure de restitution de la chambre (2h avant ),"6,2",Hôtel,Cannes," 7,9 "
Alain,France,0,2019-01-20 00:00:00,Passable,Le roof top avec le bar et le petit déjeuner .,"Établissement un peu vieillissant et pas à la hauteur d’un 4 étoiles . Peinture défraîchie , les abords de la piscine pas nettoyés , les gobelets vu le vendredi étaient encore en place le dimanche matin .","5,4",Hôtel,Cannes," 7,9 "
Isabelle,France,0,2019-01-17 00:00:00,Séjour à renouveler.,Très bon accueil. Bonne literie. Très bien situé. Thalasso au top.,None,10,Hôtel,Cannes," 7,9 "
Dominique,France,0,2019-01-16 00:00:00,j ai passé 3 jours à l hotel et je suis ressourcée comme après une semaine de vacances,le petit déjeuner la gentillesse du personnel les piscines tout tout tout,ne changez rien,10,Hôtel,Cannes," 7,9 "
Sylvain,France,0,2019-01-16 00:00:00,Parfait,"Habituées des hôtels 5 étoiles, ce radisson est exceptionnel à tout point de vue. La suite paradis est incroyable. L’acceuil Et le service méritent la palme.
Merci",None,10,Hôtel,Cannes," 7,9 "
Sarah,France,0,2019-01-13 00:00:00,Séjour génial,"L'accueil , l'espace thalasso",Pas de places de parking aux alentours et la place du parking de l'hôtel relativement cher,"9,6",Hôtel,Cannes," 7,9 "
Aurelie,France,0,2019-01-11 00:00:00,Exceptionnel,L emplacement la tranquillité le personnel la propreté,Rien,"9,6",Hôtel,Cannes," 7,9 "
Nicolas,France,0,2019-01-08 00:00:00,C'est bien,"La chambre est très belle , la piscine est très grande avec une vu magnifique et le personnel très intentionnelle. Continuez comme ça",Le petit-déjeuner mal organisé il manque beaucoup de chose comme plusieurs sort de jambon ou du fromage,"9,6",Hôtel,Cannes," 7,9 "
Jenjen17,France,0,2019-01-01 00:00:00,Pas mal,L emplacement et le personnel,"Le lit pas confortable, seulement 2 petit coussin pas confortable du tout . Et par rapport au prix ça n’en vaut pas la peine . Chambre normal .","5,0",Hôtel,Cannes," 7,9 "
Ali,France,0,2018-12-29 00:00:00,Très bien,"Tout était nickel, 2ème fois que je passe par cet hôtel, la piscine chauffée, le jacuzzi en plein air chauffé avec une magnifique vu, et le personnel très sympa.",None,"9,6",Hôtel,Cannes," 7,9 "
David,France,0,2018-12-28 00:00:00,Exceptionnel,"La qualité du personnel, merci à Sarah pour le kids club, l’emplacement, le petit déjeuner très bon (surtout le brioche au sucre), et la piscine chauffée au top.",None,"9,6",Hôtel,Cannes," 7,9 "
Mathys06,France,0,2018-12-24 00:00:00,Exceptionnel,Hôtel magnifique restaurant incroyable les chambres sont très belle le personnel très accueillant rien a redire cote thalassothérapie vraiment au top piscine à l’eau de mer un hôtel vraiment à recommander,None,10,Hôtel,Cannes," 7,9 "
Cha,France,0,2018-12-18 00:00:00,Exceptionnel,"Nous avons passé un week end en famille et nous sommes ravis de l’hôtel il est magnifique, bien situé , niveau propreté rien à redire, les chambre bien équipé et design , la piscine chauffée intérieur extérieur ainsi que le jacuzzi vraiment satisfaite nous reviendrons sans aucun doute ..",None,10,Hôtel,Cannes," 7,9 "
Jean,France,0,2018-12-12 00:00:00,Terriblement bien,Tout était super,Rien,10,Hôtel,Cannes," 7,9 "
Yannick,France,0,2018-12-09 00:00:00,Tres bien,"Pres de tout
Personnel tres bien",Notre chambre avait un vieille fenetre qui ne s ouvrait plus,"9,6",Hôtel,Cannes," 7,9 "
Marie,France,0,2018-11-26 00:00:00,Tres bien,Tout c'était génial j'étais très bien accueilli très très bon séjour inoubliable,Rien,10,Hôtel,Cannes," 7,9 "
Sandrine,France,0,2018-11-22 00:00:00,Tarifs trop élevés,"La proximité de la plage et du centre ville,le personnel de la réception ,le bar terrasse sur le toit","Chambre pas assez spacieuse, centre de bien être trop éloigné des chambres et sauna et hammam situé à l étage supérieur à la piscine,déjeuner trop élevé par rapport aux produits proposés","6,2",Hôtel,Cannes," 7,9 "
Julien,France,0,2018-11-19 00:00:00,"Bon séjour, petit déjeuné au prix élevé","l'emplacement, le personnel, 
accès aux termes","parking difficile
chambre assez petite
Petit déjeuné moyen qualité/prix
manque de communication sur les accès aux termes","6,2",Hôtel,Cannes," 7,9 "
Mohamad,France,0,2018-11-19 00:00:00,exeptionel,le personel est trop sympa surtout monia et farida elles etaient vraiment tres tres adorable et à l’ecoute tres souriante,None,10,Hôtel,Cannes," 7,9 "
Dominique,France,0,2018-11-18 00:00:00,Ne vaux pas le détour !!!,literie confortable,"le couloir qui conduit au spa et faire des gros travaux car établissement très vieillissant !!!De très mauvaises odeurs 
dans le couloir du spa !!!","5,0",Hôtel,Cannes," 7,9 "
Malik,France,0,2018-10-29 00:00:00,Exelent sejour,Le spa super,Ras,10,Hôtel,Cannes," 7,9 "
Sandra,France,0,2018-10-22 00:00:00,Merveilleux,La vue du spa est magique,None,10,Hôtel,Cannes," 7,9 "
Tdm,France,0,2018-10-14 00:00:00,expérience très décevante,"Le SPA et le petit-déjeuner ( bons produits mais peu de choix. 
Les bagagistes qui ont été les seuls membres du personnels ayant fait preuve de professionnalisme et d’amabilite","Nous avions réservé une chambre double exécutive avec vue mer pour 2 nuits depuis le mois d'août, puis disposant d’un jour supplémentaire, nous avons réalisé une nouvelle réservation (en septembre) pour la nuit du dimanche dans une chambre supérieure vue ville. 
Nous sommes arrivés en dehors de la haute saison. 
Or, nous nous sommes vus attribuer une chambre au 1er étage qui ne correspondait absolument pas à notre réservation et très bruyante, l’hotel n’etait pourtant pas plein. 
Nous avons exigé une chambre correspondant à notre réservation et nous sommes retrouvés au 4ème étage dans une chambre avec vue sur les palmiers (empêchant de voir la mer) après avoir nous-mêmes pris en charge nos effets. 
Heureusement un bagagiste très aimable nous a aidé dans cette démarche. 
A ce stade, nous n’avons pas fait état du soucis relatif à la vue, toutefois, en nous couchant, nous nous sommes rendus compte qu’au lieu d’un grand lit, la chambre était dotée de lit jumeau pour un couple! 
De nouveau nous en avons fait état. 
Nous avons donc quitté cette chambre pour nous retrouver dans la chambre 315. Or, cette chambre n’étant pas disponible avant 15h, nous avons été contraint de refaire nos bagages et attendre pour nous assurer qu’il n’y aurait plus de problème cette fois. S’agissant d’un établissement 5 étoiles, il est regrettable que la direction n’est pas proposé que le changement de chambre soit pris en charge par le personnel. Cela nous aurait éviter d’annuler l’excursion prévue le samedi après-midi, d’autant que le dimanche a été pluvieux. 
A aucun moment une personne de la direction n’est venue nous voir pour s’excuser du traitement qui nous a été infligé. 
Bref, expérience très décevante","6,2",Hôtel,Cannes," 7,9 "
Pascal,France,0,2018-09-18 00:00:00,nuit blanche au Radison,None,"chambre donnant sur la rue beaucoup trop bruyante
chambre trop petite
piscine loin de l'hôtel","5,8",Hôtel,Cannes," 7,9 "
Jean-françois,Suisse,0,2018-09-16 00:00:00,Décevant,Son emplacement uniquement,"L'arrogance du personnel à notre arrivée, la propreté, aucune explication des lieux (piscine, spa) Des boissons entamées dans le minbar à notre arrivée.
Chambre petite pour une soi-disant chambre Business. Pas de fruits offert ou autre attention. Désolant et triste","4,6",Hôtel,Cannes," 7,9 "
Harry,France,0,2018-08-28 00:00:00,En dessous des attentes par rapport au prix.,"la localisation de l'hotel, la piscine qui était interessante avec une belle vue, le restaurant sur le toit etait exceptionnel, avec de la bonne nourriture et une bonne ambiance.","On a essayé de me facturer des prestations non réalisées, la chambre était minuscule et ne faisant pas luxueuse du tout, c'est décevant. Il faut marché 10 minutes pour aller à la piscine. Des gens ont été malade après avoir petit déjeuné des oeufs.","6,2",Hôtel,Cannes," 7,9 "
Julien,France,0,2018-08-24 00:00:00,Le personnel surtout à la réception a du travail à faire pour être au niveau.,None,"L’accueil déplorable a l’arrivee. Agressivité, non professionnalisme. Chambre prête en retard, piscine balneo sale, pas de chaise longue disponible. Conciergerie non professionnelle","5,8",Hôtel,Cannes," 7,9 "
Marie,France,0,2018-08-13 00:00:00,Décevant,Sans aucun doute la piscine : super !!!,La chambre petite et en souple / le petit déjeuner très moyen,"4,6",Hôtel,Cannes," 7,9 "
Cécile,France,0,2018-07-23 00:00:00,Bonne situation mais cher pour la qualité des prestations. Personnel très accueillant,La localisation et la gentillesse du personnel,Les installations désuètes et le buffet du petit déjeuner . Très cher pour la qualité du buffet.,"5,0",Hôtel,Cannes," 7,9 "
Marie,Belgique,0,2018-07-16 00:00:00,Très agreable,Ambiance,None,10,Hôtel,Cannes," 7,9 "
