nom,pays,favorite,date,titre,bons_points,mauvais_points,note,type_etablissement,lieu,note_etablissement
Patricia,Suisse,1,2018-07-11 00:00:00,Le rêve d'un week-end,"L'accueil et la gentillesse du personnel.
Les bons conseils des concierges.
Chambre avec vue mer, trop bien....
Hôtel en face de la plage, superbe séjour, bien trop court.",Un peu déçu de n'avoir pas eu de fruits de saison au petit déjeuner.,10,Hôtel,Nice," 8,0 "
Jean-marc,France,0,2020-03-14 00:00:00,Excellent séjour,"La gentillesse, le professionnalisme et la disponibilité de l'ensemble du personnel.
La qualité de la chambre avec balcon et vue sur mer.
Le restaurant en Roof Top.
Une attention toute particulière, à l'occasion de notre anniversaire de mariage, nous a été réservée. Un grand merci au manager général.",Rien,"9,0",Hôtel,Nice," 8,0 "
Stéphanie,France,0,2020-03-11 00:00:00,séjour sympathique,"chambre avec vue sur la mer et terrasse pour prendre un petit déjeuner très agréable, literie confortable",None,"9,0",Hôtel,Nice," 8,0 "
Frederic,France,0,2020-03-10 00:00:00,Fabuleux ,La vue,None,"9,0",Hôtel,Nice," 8,0 "
Alexandra,France,0,2020-03-07 00:00:00,Emplacement ideal et personnel au petit soin,La chambre était vaste et très bien meublé. La salle de bain également. L’hôtel donne sur la promenade des anglais idéal pour se mettre en appétit pour l’énorme petit déjeuner proposé avec un personnel au petit soin.,Une partie de l’hôtel est encore en travaux ce qui peut occasionner des bruits. Le parking de l’hôtel est payant ce qui n’était pas indiqué dans les critères de booking.,"9,0",Hôtel,Nice," 8,0 "
Cyril,France,0,2020-03-06 00:00:00,Fabuleux ,"La vue imprenable sur la mer.
Les chambres modernes.","La façade de l'établissement n'ai pas au standing de l'intérieur.
Il manque juste un jacuzzi.","9,0",Hôtel,Nice," 8,0 "
Leila,France,0,2020-03-03 00:00:00,Très bon séjour en amoureux !,"Personnel très agréable, chambre confortable ! un grand bonus pour le lit ! L'hôtel est bien situé et le petit déjeuner très bon et copieux !",Le bruit de l'extérieur..,"7,0",Hôtel,Nice," 8,0 "
Visie,France,0,2020-02-29 00:00:00,sympa,None,il n y avait ni peignoir ni chaussons ! pour une chambre avec balcon c est dommage !,"8,0",Hôtel,Nice," 8,0 "
Riad,France,0,2020-02-28 00:00:00,Bien ,L’emplacement,Équipement SB insuffisant pour 2 personnes,"7,9",Hôtel,Nice," 8,0 "
Valerie,France,0,2020-02-26 00:00:00,Fabuleux ,Le service,L’éloignement,"9,2",Hôtel,Nice," 8,0 "
Schaeffer,France,0,2020-02-26 00:00:00,bon,l'accueil,None,"9,0",Hôtel,Nice," 8,0 "
Fabrice,France,0,2020-02-24 00:00:00,Pas mal,"Confort de la chambre et en particulier la literie
Proximité du tramway pour se rendre en centre ville.","La rapport qualité prix du petit-déjeuner n'est pas exceptionnel.
Le tarif du parking est excessif 32€ la journée !","8,0",Hôtel,Nice," 8,0 "
Sylvie,France,0,2020-02-23 00:00:00,Superbe séjour. A refaire.,"La chambre premium spacieuse, confortable et au calme, la vue superbe sur la mer et la promenade des Anglais, l'arrêt de tram juste derrière l'hôtel",Rien,"8,0",Hôtel,Nice," 8,0 "
Brigitte,France,0,2020-02-23 00:00:00,Bien ,"L’emplacement,la propreté, le personnel agréable.",Pas possible d’avoir un jus de fruit frais au roof top à 16h00. À 23:00 le bar ferme alors que nous sommes en période de carnaval. Pas de chausson ni de peignoir dans la chambre il faut le réclamer. Le petit déjeuner est bien il faut juste revoir la cuisson des œufs pochés.,"7,5",Hôtel,Nice," 8,0 "
Nicole,France,0,2020-02-23 00:00:00,Hôtel sur la promenade des anglais,"hôtel agréable 
personnel très bien.",None,"8,0",Hôtel,Nice," 8,0 "
Laurent,France,0,2020-02-22 00:00:00,Bon hôtel abordable sur la Promenade des Anglais,"Chambre agréable et calme, sauna très propre et personnel très sympathique.",Le petit-déjeuner est bon avec des produits variés mais les produits pourraient être de meilleure qualité et plus locaux pour ce genre d'établissement.,"8,0",Hôtel,Nice," 8,0 "
Julie,France,0,2020-02-22 00:00:00,Bel hôtel un peu trop loin du centre ville,"Chambre spacieuse et bien décorée, hall hôtel bien décoré. Bon petit déjeuner . Personnel très sympathique et disponible sauf employé du check-out","Prix exorbitant du parking à plus de 32€ la journée 
Check-out très impersonnel voir désagréable, aucune question pour savoir si nous avions apprécié notre séjour,plus froid qu’une machine.
Dommage car on quitte les lieux sur une mauvaise impression","8,0",Hôtel,Nice," 8,0 "
Bruno,France,0,2020-02-20 00:00:00,"agréable, sauf l'accueil, hélas.",None,"l'accueil expéditif, style au suivant, monsieur stressé qui parlait vite et pas sympathique. le reste du personnel, très bien.","7,0",Hôtel,Nice," 8,0 "
Nabil,France,1,2020-02-19 00:00:00,Égal à Lui même,La chambre vue mer,Rien à dire petit dej un peu cher mais bon...,"8,5",Hôtel,Nice," 8,0 "
Charles,France,0,2020-02-18 00:00:00,Très agréable,Le room service,None,"9,0",Hôtel,Nice," 8,0 "
Virginie,France,0,2020-02-17 00:00:00,Fabuleux ,None,"Réservation pour 3, le lit banquette est très inconfortable","9,2",Hôtel,Nice," 8,0 "
Valentin,France,0,2020-02-16 00:00:00,Bien ,Le petit déjeuner excellent très healthy,Notre vue tramway,"7,9",Hôtel,Nice," 8,0 "
Magali,France,0,2020-02-16 00:00:00,Très bien,"Le petit déjeuné varié
L'emplacement face à la mer
La chambre assez grande
La propreté 
L'isolation 
Le hammam et sauna","- J'avais sélectionné un lit double et on a eu 2 lits simples
-À l'arrivée 2 petites bouteilles d'eau du mini bar offertes, le 2ème jour on nous apporte 2 autres petites bouteilles d'eau sans nous préciser qu'elles étaient payantes","8,0",Hôtel,Nice," 8,0 "
Mickael,France,0,2020-02-16 00:00:00,Fabuleux ,None,"L'espace de vie dans les chambres.
La décoration tres appréciable.","9,0",Hôtel,Nice," 8,0 "
Nabil,France,1,2020-02-11 00:00:00,Égale à un radisson,"La vue et la chambre vue mer et le restaurant sur le toit .
Le confort de la literie","Le prix du petit dej et du parking 
Très très excessif.","7,9",Hôtel,Nice," 8,0 "
Nadjib,France,0,2020-02-07 00:00:00,Très bien,"Personnel 
Emplacement 
Petit déjeuner 
Vue",Il n’y avait pas de chaussons dans la chambre,"8,3",Hôtel,Nice," 8,0 "
Pierre,France,0,2020-02-04 00:00:00,Très bien,"Personnel parfait
Festival de saveurs au restaurant. Tres bon",Mauvaise insonorisation de la chambre malgre un 4e etage,"8,0",Hôtel,Nice," 8,0 "
Dalila,France,0,2020-02-02 00:00:00,Fabuleux ,Gentillesse du personnel et un accueil très professionnel,Réveillée malheureusement par des déplacements de meubles et personnes parlant fort dans le couloir,"9,0",Hôtel,Nice," 8,0 "
Jean,France,0,2020-01-31 00:00:00,Très bon séjour,Tout,None,"8,0",Hôtel,Nice," 8,0 "
Melvin,États-Unis,0,2020-01-27 00:00:00,Fabuleux ,"Le personnel très sympathique, la belle vue, l'accueil au top. Et surtout leur participation à l'écologie ! Très bon point !",2 lits collé en 1 pour faire un lit King Size c'est malheureux.. à revoir.,"9,0",Hôtel,Nice," 8,0 "
Bougmohammed,Algérie,0,2020-01-25 00:00:00,Excellent,Tous,Rien du tous,"9,0",Hôtel,Nice," 8,0 "
Philippe,France,0,2020-01-25 00:00:00,Vacances du jour de l an,Le confort et l’accueil,"Le restaurant panoramique, décevant coté service, une commande de vin jamais arrivée tout au long du repas, une note gonflée par deux desserts alors qu’ils étaient dans le menu, dommage car le service n’est pas à la hauteur de l’enseigne","8,8",Hôtel,Nice," 8,0 "
Melissa,France,0,2020-01-22 00:00:00,Très bon week-end,Pratiquement tout,None,"9,2",Hôtel,Nice," 8,0 "
Francois,France,0,2020-01-19 00:00:00,"Superbe vue, chambre et hôtel rénové avec grand goût.",Rénové il y a deux ans. Excellent 4 étoiles!! Mériterait un jour un 5. Literie au top!,Boissons du bar chères..,"9,0",Hôtel,Nice," 8,0 "
Luc,France,0,2020-01-19 00:00:00,Fabuleux ,"la vue de la terrasse, la nuit.
l'atmosphère de la cafeteria le soir, très sympathique.",None,"9,0",Hôtel,Nice," 8,0 "
Societe,France,0,2020-01-18 00:00:00,Digne d’un Radisson,"La vue du roof top 
La piscine 
Et le spa",Rien,"7,1",Hôtel,Nice," 8,0 "
Marie-,France,0,2020-01-16 00:00:00,Bien ,Tout était bien dans l ensemble avec un bon petit-déjeuner,Le bruit du chauffage clim et l éloignement avec le centre-,"7,0",Hôtel,Nice," 8,0 "
Majda,France,0,2020-01-14 00:00:00,Excellent,Agréablement surprise,None,"9,0",Hôtel,Nice," 8,0 "
Marc,France,0,2020-01-13 00:00:00,Comblé au-delà de mes attentes,"La réactivité du personnel, la qualité de reception, et l'écoute toujours présente.
L'hôtel est d'une grande qualité, et je reviendrai volontier à mon prochain séjour à Nice.","Seul bémol, je préfère la douche à la baignoire. (problème personnel avec une jambe)
Sinon tout est parfait","8,0",Hôtel,Nice," 8,0 "
Jacqueline,Belgique,0,2020-01-12 00:00:00,Agréable séjour dans hôtel confortable,"Beau buffet petit déjeuner et belle piscine sur le toit.
Personnel très serviable",None,"8,0",Hôtel,Nice," 8,0 "
Ben3421,France,0,2020-01-12 00:00:00,Fabuleux ,Tout le reste etait au top c est propre c est beau et la terrasse avec vie sur mer splendide,On ne peut pas dire qu on a pas apprécié mais le petit dejeuner etait tres classique pas énormément de choix,"9,0",Hôtel,Nice," 8,0 "
Eric,France,0,2020-01-10 00:00:00,Sympa mais accueil trop froid,"Logement 
Situation géographique",Personnel à l’accueil...le sourire ce n’est pas payant c’est gratuit!!!!,"7,0",Hôtel,Nice," 8,0 "
Olias,Belgique,0,2020-01-06 00:00:00,Superbe,La vue impressionnante du dernier étage,Le lit beaucoup trop dure a mon goût,"8,8",Hôtel,Nice," 8,0 "
Patrick,France,0,2020-01-06 00:00:00,Fabuleux ,Tres bien,Parking de l'hotel = beaucoup trop cher….,"9,0",Hôtel,Nice," 8,0 "
Romain,France,0,2020-01-05 00:00:00,Fabuleux ,La vue,Le bruit,"9,2",Hôtel,Nice," 8,0 "
Jean-luc,France,0,2020-01-01 00:00:00,Un excellent week-end,"Le petit déjeuner est exceptionnel, le personnel est parfait, la chambre vue mer est spacieuse et confortable, le restaurant sur le toit est succulent.",None,"9,2",Hôtel,Nice," 8,0 "
Thierry,Côte-d'Ivoire,0,2019-12-29 00:00:00,Bien ,La convivialité du personnel,None,"7,5",Hôtel,Nice," 8,0 "
Marc,France,0,2019-12-26 00:00:00,Très bien,None,Hôtel trop chaud et très bruyant la nuit fenêtres ouvertes,"8,0",Hôtel,Nice," 8,0 "
Xavier,France,0,2019-12-17 00:00:00,bien,"La vue face à la mer, l'espace de la chambre","le chauffage qui ne se règle pas, l'inconstance de la température de l'eau de la douche .","8,0",Hôtel,Nice," 8,0 "
Ahamadou,France,0,2019-12-16 00:00:00,Bien dans l'ensemble .,"Deux nuits , avec un personnel chaleureux , sympa , et vraiment a l’écoute du client.",Pre venir le client d'une éventuel Cautions,"9,0",Hôtel,Nice," 8,0 "
Richard,France,0,2019-12-09 00:00:00,"Séjour satisfaisant, restaurant en terrasse qui vaut la visite","Petit déjeuner très bien, emplacement bien","Un peu cher, pas d'eau à disposition gratuite à l'arrivée, impression un peu pingre...","7,0",Hôtel,Nice," 8,0 "
Marc-christian,Suisse,0,2019-12-03 00:00:00,Fabuleux ,Personnel sympathique,Petit déjeuner non inclus,"9,2",Hôtel,Nice," 8,0 "
Celine,France,0,2019-11-25 00:00:00,"Hôtel confortable, très bien situé, avec un personnel très serviable et accueillant.","J'ai particulièrement apprécié l'accueil, la gentillesse et la disponibilité du personnel que ce soit à la réception (réceptionniste, concierge) ou à l'accueil du petit déjeuner. Hammam et sauna très agréables.","J'ai regretté l'absence de chaussons pour aller de la chambre au spa. Ménage effectué tardivement le 2eme jour, n'était pas réalisé lorsque nous sommes rentrées vers 14h00 à cause des intempéries. Air et eau passant par la fenêtre (alerte rouge météo donc hors norme)","8,0",Hôtel,Nice," 8,0 "
Fabrice,Suisse,0,2019-11-24 00:00:00,Vue sur mer,"PDJ buffet parfait, simple mais rien ne manque, personnel attentif et souriant, situation idéale, proche de l'Aéroport, proche de la ville, proche de tout :-)","Le prix du parking/garage est un peu élevé, pratique mais un peu cher.","8,0",Hôtel,Nice," 8,0 "
Philippe,France,0,2019-11-10 00:00:00,Très bien,Emplacement / literie /petit déjeuner,Chambre plus petite que d’habitude et pour un hôtel de cette qualité on apprécierait des toilettes séparées,"8,3",Hôtel,Nice," 8,0 "
Patrice,France,0,2019-11-08 00:00:00,Fabuleux ,Le personnel,"Un peu loin du centre 
27 euros pour un petit déjeuner moyen","9,2",Hôtel,Nice," 8,0 "
Fabrice,France,0,2019-11-03 00:00:00,Un hôtel digne de ses 4 étoiles,Un hôtel digne de ses 4 étoiles offrant de belles prestations et disposant d'un personnel attentionné.,None,"9,2",Hôtel,Nice," 8,0 "
Alain,France,0,2019-11-03 00:00:00,Superbe,La grande chambre avec vue sur mer.,Bon rapport qualité prix. Un petit sentiment de tourisme de masse.,"8,8",Hôtel,Nice," 8,0 "
Melanie,France,0,2019-10-29 00:00:00,Séjour,"Le reste top ! Service, amabilité !",Chambre familial avec de la pub mensongère je m’attendait pour mes enfants à un petit cadeau comme sur la photo mais à part le prix rien du tout... Sdb abîmée c’est dommage.... !,"7,1",Hôtel,Nice," 8,0 "
Louise,France,0,2019-10-27 00:00:00,Bien ,Superbe vue de la chambre.,Les petits déjeuners bas de gamme et donc trop chers. La salle de bain rénovée seulement à moitié et inconfortable.,"7,5",Hôtel,Nice," 8,0 "
Gregory,France,0,2019-10-17 00:00:00,Hôtel bien calme grand.,None,Il est dommage que la piscine ne soit pas chauffée. Et fort dommage que les bouteilles d'eau soit dans le mini bar donc payante et non offerte pour un 4 étoiles. Il manque un spa et des massages pour être au top.,"8,0",Hôtel,Nice," 8,0 "
Marc,France,0,2019-10-13 00:00:00,Superbe,"L’hôtel est très agréable, le roof top génial. Chambres très belles et confortables.","Chambre vue mer très sympa (petit déjeuner sur le balcon vaut le coup) mais la nuit on entend un peu trop la circulation même avec les fenêtres (doubles) fermées.
Enregistrement un peu long (45mn d’attente) ce qui est inhabituel pour ce type d’hôtel.","8,8",Hôtel,Nice," 8,0 "
Jean,France,0,2019-10-07 00:00:00,"bien pour se reposer ,mais un peu loin du centre et un peu cher pour des prestations classiques","TROP CLASSIQUE , un peu triste à l'intérieur et envahi de pigeons voraces à l'extérieur§","GROS HÔTEL ""ANONYME""","7,0",Hôtel,Nice," 8,0 "
Jean-paul,Canada,0,2019-10-02 00:00:00,très belle expérience en général,"le comfort ,l'hospitalité du personnel la qualité du resto","un peu loin des activités et des resto 
les deux lit un peu petit et trop rapprocher l'un de l'autre
le commutateur de la salle de bain est à l'extérieur pas pratique la nuit pour l'autre personne qui dort","9,2",Hôtel,Nice," 8,0 "
Mohamed,Maroc,0,2019-10-02 00:00:00,Excellent hotel pour un séjour d’affairea,Tres comfortable. Tres propre.,Un peu impersonnel,"9,2",Hôtel,Nice," 8,0 "
Laura,Belgique,0,2019-09-18 00:00:00,Bel hôtel mais personnel peu souriant,"La chambre était belle avec une déco moderne et contemporaine, très lumineuse. Belle salle de bain. 
Les pâtes à la truffe de leur restaurant étaient succulentes. Le rooftop est arboré de la piscine, du bar et du restaurant avec vue superbe sur la promenade des Anglais et l'océan. Amateur des décollages d'avion, vous serez ravis d'en observer toutes les 2 minutes.","L'accueil a été froid, pas d'explication sur notre chambre ni l'établissement en détail… Le réceptionniste ne parlait pas très fort et n'était pas du tout souriant. Pas d'attention particulière pour notre passage à l'occasion de notre voyage de noces à part une bouteille d'eau plate et d'eau pétillante offertes ainsi qu'une lettre de félicitations. On aurait espéré une vue mer avec un balcon étant donné le prix pour la chambre supérieure réservée…
Petit déjeuner pas mal mais trop bruyant, trop de gens.","6,7",Hôtel,Nice," 8,0 "
Joël,France,0,2019-09-18 00:00:00,Agréable.,L'emplacement. La Chambre.,L'accueil.,"9,2",Hôtel,Nice," 8,0 "
Mohamed,France,0,2019-09-16 00:00:00,Agréable sauf que 32euros de parking PAR JOURS VU LE PRIX DE CHAMBRES CELA DEVRAIS ÊTRE INCLUS,None,"Le parking devrait être gratuit pour les clients !
32 euros par jours c'est honteux !!!!!!!!!","6,7",Hôtel,Nice," 8,0 "
Mireille,France,0,2019-09-03 00:00:00,Très bon séjour dans un très bel hôtel,Nous avions un vol très tôt le matin avec une arrivée a l hôtel a 8hrs.L hôtel a mis directement notre chambre a disposition et ce fut très appréciable.,None,"7,9",Hôtel,Nice," 8,0 "
Muriel,Suisse,0,2019-09-02 00:00:00,Agreable,Bon petit déjeuner,Le fait de payer en plus la plage privee. Je pensais que cette prestation était une prestation de l'hôtel sans frais,"7,1",Hôtel,Nice," 8,0 "
Germain,Guadeloupe,0,2019-08-27 00:00:00,Superbe,None,Le prix des boissons au bar trop élevé,"8,8",Hôtel,Nice," 8,0 "
Body,France,0,2019-08-23 00:00:00,Bien mais un peu déçue du rapport qualité-prix,"La terrasse et les équipements de l'hôtel (spa,restaurant, piscine,taille des chambres)",Plage privée payante pour les clients de l'hôtel !,"8,3",Hôtel,Nice," 8,0 "
Friant,Belgique,0,2019-08-23 00:00:00,bonne expérience pour une nuit mais n'irai pas pour mes vacances,"situation, chambre propre, isolation phonique par rapport à extérieur très bonne",le prix du petit déjeuner est exorbitant,"7,1",Hôtel,Nice," 8,0 "
Claudine,Suisse,0,2019-08-19 00:00:00,Fabuleux ,"la gentillesse et le professionnalisme des personnes des personnes à l'accueil. La chambre spacieuse et très bien équipée, la literie est très confortable. La qualité et l'énorme choix du petit déjeuner était juste exceptionnelle. La plage privée. La piscine sur le toit. Le tram juste derrière l'hôtel.",Le manque de place au petit déjeuner. L'hôtel un peu loin du centre mais ça fait du bien de marcher un peu.,"9,2",Hôtel,Nice," 8,0 "
Pacalousud,Belgique,0,2019-08-18 00:00:00,Vue sur la mer admirable,"Le personnel disponible, confort, piscine, au bord de la mer, facile d accès de l aéroport et du centre ville en transport en commun","L équipement fitness, pas de matériel, pas de place, déception car ç était bien mentionné dans la description","8,8",Hôtel,Nice," 8,0 "
Marie,Suisse,0,2019-08-18 00:00:00,Agréable,Proximité de la mer.,"Trop petits espaces, pas de place dans la piscine ni le restaurant. Les plages sont payantes et il faut s'y prendre en avance pour chaque réservation...","6,7",Hôtel,Nice," 8,0 "
Sophie,France,0,2019-08-16 00:00:00,Fabuleux ,Chambre très propre et spacieuse. Piscine sur le toit très agréable. Personnel à l’écoute et charmant. Petit déjeuner avec beaucoup de choix.,Tout était parfait,"9,2",Hôtel,Nice," 8,0 "
Richard,France,0,2019-08-15 00:00:00,Fabuleux ,Plage privée,La pina colada du bar piscine nulle,"9,2",Hôtel,Nice," 8,0 "
Georges,France,0,2019-08-06 00:00:00,L'hôtel Radisson Blue reste une valeur sûre sur Nice,"Le Radisson Blue de Nice reste une valeur sûre, avec un emplacement privilégié en première ligne et son toit qui offre à la fois une piscine, un bar et un restaurant panoramique sur la baie (dépaysement assuré).","Fort de tous ses avantages l'hôtel draine une clientèle de bon niveau financier mais pas nécessairement de bonne éducation, notamment le soir venu où certains estivants sont particulièrement bruyants en retour de fête en ville, quand ils ne la font pas directement en chambre. Nous avons dû signaler à la réception un voisin très bruyant en heures très tardives dès le second jour.","8,8",Hôtel,Nice," 8,0 "
Audrey,France,0,2019-08-03 00:00:00,Bien ,La vue,L’insonorisation pourrait être meilleure pour les chambres qui donnent sur la mer.,"7,9",Hôtel,Nice," 8,0 "
Alexandre,France,0,2019-07-23 00:00:00,Un peu déçu,Les équipements dont la piscine sur le toit,"Le manque de rigueur (ex petit dej au 223 après 10h30 2 viennoiseries/1boisson chaude/1 jus-12euro/perso- résultat 1 mini viennoiserie)
La plage propre mais une lenteur dans les commandes sur plage et un manque de professionnalisme dans le suivi des commandes.
Du coup, le rapport qualité/prix apparaît nettement en retrait.","6,7",Hôtel,Nice," 8,0 "
Stephane,France,0,2019-07-21 00:00:00,Fabuleux ,None,Le matelas légèrement trop souple a mon goût,"9,2",Hôtel,Nice," 8,0 "
Magali,France,0,2019-07-19 00:00:00,Superbe,Le rooftop et le personnel au petit soin,L’emplacement et les travaux qui gachent un peu la vue,"8,8",Hôtel,Nice," 8,0 "
Gerard,France,0,2019-07-07 00:00:00,sejou r court mais satisfaisant,emplacement ideal terrasse.,None,"8,8",Hôtel,Nice," 8,0 "
Steing,France,0,2019-07-06 00:00:00,Fabuleux ,"ROOF TOP
LA CHAMBRE",NE PAS FERMER LA PISCINE AUSSI TÔT EN ETE,"9,2",Hôtel,Nice," 8,0 "
Nabil,France,1,2019-07-05 00:00:00,Fabuleux ,"La piscine sur le toit , la vue face à la mer 
Le Personnel","Le prix du petit dej vraiment très cher surtout avec un enfant qui déjeune très peu .
Le prix du parking .
Le Check IN a 15h pas top","9,2",Hôtel,Nice," 8,0 "
Nathalie,Belgique,0,2019-07-03 00:00:00,Superbe moment dans un endroit calme,Beau Buffet déjeuner literie confortable salle de bain spacieuse exellente insonorisation des chambres bonne situation géographique piscine sur le toit exellent restaurant avec une vue magnifique sur Nice,None,"7,5",Hôtel,Nice," 8,0 "
Aurelie,France,0,2019-07-03 00:00:00,Superbe,None,Problèmes administratifs à l’accueil,"8,8",Hôtel,Nice," 8,0 "
Stéphane,France,0,2019-06-27 00:00:00,Bien ,None,Aucun bar après 23h,"7,9",Hôtel,Nice," 8,0 "
Domenico,France,0,2019-06-25 00:00:00,Bien ,La vue et le personel surtout les voiturier bagagistr adorable.,"La salle de fitness minable vetuste ridiculement petite, et dangereusement degradé surtout les appareils de musculation
Un sejour en amoureux et on nous donne deux lit coller mm pas attacher pour un king seize on s est retrouver a tomber entre les deux lit toute la nuit c est agaçant quand on paye 300 euro la nuit 
Tres radin sur les produit de beaute dans la salle de bain 
Ok pour la protection de la planeye et contre le plaqtique dans ce cas au moins plus de savon solide! Et au moins des peignoirs","7,1",Hôtel,Nice," 8,0 "
Svetlana,Belgique,0,2019-06-23 00:00:00,Très super séjour à Nice,"Tout était super!
Merci beaucoup !","Les travaux sur la promenade des anglais. 
Aussi, dommage que l'accès à la plage soit payante pour les résidents de l'hôtel.","9,2",Hôtel,Nice," 8,0 "
Veronique,France,0,2019-06-15 00:00:00,Agréable,None,Les travaux promenade des anglais. Meme s ils n y sont pour rien L hôtel devrait prévenir les clients,"6,7",Hôtel,Nice," 8,0 "
Reda,Maroc,0,2019-06-12 00:00:00,Bien ,"très loin et ils ne nous ont pas donné ce qu'on a réservé et payé, ainsi que jusqu'à maintenant pas encore recu le montant bloqué de la carte de crédit",None,"7,5",Hôtel,Nice," 8,0 "
Guillaume,France,0,2019-06-02 00:00:00,Très bien,Très belle vue.,Service très lent au roof bar restaurant.,"8,3",Hôtel,Nice," 8,0 "
Bruno,France,0,2019-06-02 00:00:00,Sympa,La piscine sur le toit ce qui permet une exposition au soleil à tout moment de la journée.,None,"9,2",Hôtel,Nice," 8,0 "
Josiane,Suisse,0,2019-05-30 00:00:00,Bien ,"La piscine , la chambre",Le vin au verre est trop cher et les salades à la piscine trop chères pour la quantité dans l’assiette,"7,5",Hôtel,Nice," 8,0 "
Valerie,France,0,2019-05-28 00:00:00,Excellent ! on y retournera.,Nous avions une remontée d'odeur dans la chambre vue mer. L'hotel nous a surclassé directement pour toute la duree du sejour. Nous avons eu une suite vue mer. Execellent ! Le restaurant aussi est tres bon. Le buffet du matin est fantastique .Nous avons passé un excellent sejour. Le seul bémol est les travaux devant l'hotel sur la promenade qui ne sont pas terminés et qui gâche un peu la vue et la ballade depuis l'hotel.,None,"8,8",Hôtel,Nice," 8,0 "
Chantal,France,0,2019-05-25 00:00:00,Bien ,MAUVAIS EMPLACEMENT,None,"7,5",Hôtel,Nice," 8,0 "
Ida,France,0,2019-05-12 00:00:00,Bien ,Petit déjeuner délicieux et l ensemble très bie,None,"7,5",Hôtel,Nice," 8,0 "
Brigitte,France,0,2019-05-05 00:00:00,Un peu cher,La literie très confortable,La salle du petit déjeuner trop de brut trop de va et vient..,"7,1",Hôtel,Nice," 8,0 "
Bil909z,France,0,2019-04-29 00:00:00,Très bien,None,Promenade des anglais en travaux en face de l hotel,"8,3",Hôtel,Nice," 8,0 "
Caroline,France,0,2019-04-28 00:00:00,Agréable,"Le rooftop
Le petit dej 
Le personnel agréable et efficace","L’emplacement très bruyant quand on ouvre les fenêtres de la chambre et sur le balcon 
Le matelas très dur","6,7",Hôtel,Nice," 8,0 "
David,Belgique,0,2019-04-25 00:00:00,Très bon,La piscine et le bar sur le toit.,Le service au bar et au restaurant laisse à désirer. Peu de serveur parle Français,"8,3",Hôtel,Nice," 8,0 "
Dominique,France,0,2019-03-31 00:00:00,Séjour très agréable,Service confort et situation excellente,Pas de climatisation et impossible d’ouvrir Les fenêtres sur la promenade des anglais sans être dérangés par la circulation.,"9,2",Hôtel,Nice," 8,0 "
Louis,France,0,2019-03-27 00:00:00,Sinon hôtel très agréable,None,"Le bruit de la chambre 648 au dessus de la
Mienne jusqu’a 2 heures du matin","7,5",Hôtel,Nice," 8,0 "
