nom,pays,favorite,date,titre,bons_points,mauvais_points,note,type_etablissement,lieu,note_etablissement
Nathaniel,France,0,2019-06-16 00:00:00,Je reviendrai,None,"Personnel très agréable.
Excellente cuisine.","8,3",Hôtel,Nice," 7,4 "
Bénédicte,France,0,2019-06-05 00:00:00,Bien ,La situation géographique exceptionnelle. Le petit-déjeuner digne d'un quatre étoiles. Le personnel charmant.,"Le confort de la chambre sommaire, pas digne d'un 3 étoiles (absence de mini bar)","7,9",Hôtel,Nice," 7,4 "
Rosamond,France,0,2019-05-29 00:00:00,Bien ,None,Moquette tachée et pas de chausse pieds,"7,9",Hôtel,Nice," 7,4 "
Valérie,France,0,2019-05-26 00:00:00,"Très bien placé, personnel à l'écoute","Bon petit déjeuner, le personnel est présent et à l'écoute","l'établissement est un peu vieillissant, le hall, la salle de déjeuner...","8,8",Hôtel,Nice," 7,4 "
Isabelle,Suisse,0,2019-05-20 00:00:00,Agréable,L’emplacement,None,"6,7",Hôtel,Nice," 7,4 "
Martine,France,0,2019-05-19 00:00:00,Agréable,L’emplacement,Établissement désuet chambre petite rideau non occlusifs,"6,2",Hôtel,Nice," 7,4 "
Dengis,Belgique,0,2019-05-15 00:00:00,Séjour agréable dans un décor d'antan,"J'ai surtout apprécié l'emplacement de l'hôtel. La terrasse des orangers est particulièrement agréable. Ils ont en partie rénové : moquette dans couloirs, céramique salle de bain. L'hôtel a gardé un aspect un peu vieillot malgré le confort et cela m'a bien plu. Nettoyage correct et personnel serviable.","A la réception, problèmes pour retrouver ma réservation par Booking, soi-disant annulée . Visiblement leur système de réservation semble poser problème au personnel lui-même. Néanmoins la personne de la réception m'a accordé une chambre très correcte et s'est inquiétée le lendemain de savoir si elle me convenait.
Le check-out a été plus rapide.","7,5",Hôtel,Nice," 7,4 "
Bernadette,Suisse,0,2019-05-04 00:00:00,SéJOUR Agréable,Très bien placé et personnel agréable,café pas très bon!,"8,3",Hôtel,Nice," 7,4 "
Henri,France,0,2019-04-15 00:00:00,"Séjour agréable à tout point de vue, à refaire.","Personnel aussi bien à la réception qu'au Bar et au service petit déjeuné d'une extrême gentillesse, toujours le sourire ce qui devient rare. C'est sur nous reviendrons.","Petite odeur d'égout dans la douche qui disparaît lorsque l'on fait coller de l'eau.
Notre chambre, en front de mer est un peu bruyante à cause de la circulation, mais la vue sur mer compense cet inconvénient.","8,3",Hôtel,Nice," 7,4 "
Eric,France,0,2019-04-15 00:00:00,Excellent emplacement . Petit déjeuner bien agréable,La chambre est grande et la vue sur mer est magnifique,La literie est à revoir . Nous avons séjourné une semaine mais les draps n’ont pas été changé pendant la durée de notre séjour . C’est dommage !!!,"7,5",Hôtel,Nice," 7,4 "
Jean-michel,France,0,2019-04-05 00:00:00,Beaucoup de plaisir à découvrir une ville très agréable!,"L'emplacement est parfait, proche de la plage , du vieux Nice et de la coulée verte.Plein de possibilités de balades même à pied.
L'hôtel a beaucoup de charme et n'est pas standardisé.
Le cadre est charmant.
Possibilité de parking juste à côté(20€ 24 h00).","La chambre qui donne sur la cour est un peu triste...mais très calme.
La chambre était spacieuse mais un peu vieillote et le ménage un peu succin , la moquette en fin de vie !
ça reste toutefois acceptable dans l'ensemble.","7,9",Hôtel,Nice," 7,4 "
Eric,France,0,2019-04-02 00:00:00,Bien ,Hôtel demande de refrechesement,None,"7,9",Hôtel,Nice," 7,4 "
Caroline,France,0,2019-04-01 00:00:00,Pratique vu la proximité des plages et commerces mais tarif trop cher pour la chambre,"La proximité de tous les commerces, marchés aisni que la plages et la promenade des Anglais",La chambre .. la salle de bain et en particulier la baignoire (trop haute et trop petite avec le carrelage fissuré et recollé au silicone ... Le carrelage au sol fissuré ...et l'état de propreté de la chambre (je suis désolé mais je me suis demandé si le menage et le lit avait été fait quand nous sommes arrivés car tout était froissé - j'ai même demandé à une des femmes de ménage qui passait si notre chambre étiat faite ).,"7,1",Hôtel,Nice," 7,4 "
Yvette,France,0,2019-04-01 00:00:00,Agréable,Chambre vue mer,Le petit Dej. Et la salle la lourdeur des formalités de clés,"6,7",Hôtel,Nice," 7,4 "
Monique,Luxembourg,0,2019-03-31 00:00:00,Je rechoisirai cet hôtel sans hésitation.,"chambre rénovée de bon goût, salle de douche spacieuse, balcon vue mer, petit- déj. dans salle Belle Epoque, gentillesse du personnel, emplacement fabuleux","l’absence d’une <petite carte> au bar, exception faite d’une seule planchette","8,8",Hôtel,Nice," 7,4 "
Georges,Suisse,0,2019-03-27 00:00:00,Balade en couple,"Emplacements, la vue","Salle de bain pas propre, cheveux sur le sol manque de produits de soins dans la salle de bain: mouchoirs, nettoyeurs pour les oreilles, set à couture, serviettes à main","6,2",Hôtel,Nice," 7,4 "
Olivier,None,0,2019-03-21 00:00:00,Bien ,None,Chauffage trop élevé dans la chambre sans possibilité de réglage.,"7,9",Hôtel,Nice," 7,4 "
Stef2207,France,0,2019-03-21 00:00:00,Agréable,L emplacement,"Trop de bruits des femmes de menage dans les
Couloirs le matin et trop de raisonnace avec les autres chambres! J ai trouvé botre
Chambre trop bruyante!!!!","6,2",Hôtel,Nice," 7,4 "
Martin,France,0,2019-03-17 00:00:00,Bien ,"Super emplacement, personnel sympa","Structure vieillissante, manifique extérieur alors déception une fois à l intérieur, chambre côté ville était petite et vieillote avec salle de bain abîmée et pas propre.","7,5",Hôtel,Nice," 7,4 "
Corinne,France,0,2019-03-16 00:00:00,Très bien,Lit confortable chambre grande,None,"7,5",Hôtel,Nice," 7,4 "
René,Luxembourg,0,2019-03-09 00:00:00,Séjour très agréable et de qualité,"Emplacement parfait (plage et vieille ville)
Vue sur la mer
Accueil parfait",Installer un restaurant avec carte variée,"8,3",Hôtel,Nice," 7,4 "
Muriel,France,0,2019-03-09 00:00:00,Bien ,L emplacement,Le restaurant et le décor très défraîchis,"7,1",Hôtel,Nice," 7,4 "
Hermine,France,0,2019-03-09 00:00:00,Bien ,L emplacement et la disponibilité des employés,L odeur de l essence,"7,5",Hôtel,Nice," 7,4 "
Philippe,France,0,2019-03-09 00:00:00,Très bien,L’emplacement et la vue de la chambre,La vétusté des espaces communs,"8,3",Hôtel,Nice," 7,4 "
Francoise,France,0,2019-03-06 00:00:00,Bien ,None,la moquette dans les chambres,"7,0",Hôtel,Nice," 7,4 "
Jean,France,0,2019-03-06 00:00:00,Très bien,"Super les plages juste en face , petit déjeuner au top sucré et salé","pas de parking privé ,a savoir 23 euros pour la nuit","8,3",Hôtel,Nice," 7,4 "
Pascalb22,France,0,2019-03-03 00:00:00,Agréable,Emplacement,Hotel qui nécessite d'être rénové,"6,2",Hôtel,Nice," 7,4 "
Sebban,France,0,2019-02-26 00:00:00,Agréable,Propreté et services pas bon,Les cendriers p’eins De mégots dans la. Hombre a l arrivée odeur catastrophique pas de service en chambre pas de restauration en terrasse petit déjeuner très moyen,"6,7",Hôtel,Nice," 7,4 "
Christophe,France,0,2019-02-25 00:00:00,"très bon rapport qualité prix, personnel très aimable; charmant hotel proche centre ville",La localisation géographique; la gentillesse du personnel; la proximité du centre ville et des plages,None,"8,8",Hôtel,Nice," 7,4 "
Raphael,France,0,2019-02-21 00:00:00,cet hotel est tres bien situé et très agréable. tres bon rapport qualité prix,la chambre était correcte. Une chambre au calme en fond de couloir.,la vue depuis la chambre n'est pas agréable. Malgré tout elle est au calme.,"7,9",Hôtel,Nice," 7,4 "
Mehdi,France,0,2019-02-21 00:00:00,Quelle belle vue ...,"La vue de le chambre
L'emplacement","Hôtel un peu vieillot 
Demande de changement de chambre accepté sur booking 
une fois sur place, on me demande de rajouté un supplément.","6,7",Hôtel,Nice," 7,4 "
Fabrice,France,0,2019-02-18 00:00:00,Superbe,"La vue et la localisation 
Le côté pro de l’accueil",Rien,"8,8",Hôtel,Nice," 7,4 "
Claire,France,0,2019-02-17 00:00:00,Bien ,L’emplacement est top,Les photos ne correspondent pas forcément aux chambres,"7,5",Hôtel,Nice," 7,4 "
Gérard,Portugal,0,2019-02-16 00:00:00,Agréable,La déco.,Le personnel .. très moyen.. et le système.. un autre monde. Ascenseur souvent en panne . Clef chambre capricieuse.,"6,2",Hôtel,Nice," 7,4 "
Ludivine,France,0,2019-02-15 00:00:00,Mon compagnon et moi nous avons passé un très bon séjour super je recommende !!!,La chambre vue sur la plage,Pas grand-chose mis à part le prix de la chambre,"8,8",Hôtel,Nice," 7,4 "
Franck,France,0,2019-02-11 00:00:00,Chambre très confortable.,Qualité de la chambre et vue exceptionnelle sur la Promenade des Anglais.,Problème de chauffage trop élevé et impossibilité de réglage obligé d'ouvrir la fenêtre...,"8,3",Hôtel,Nice," 7,4 "
Roselyne,France,0,2019-02-09 00:00:00,chambre petite petit déjeuner 15 euros trop cher,le bar pas tres cosy,la décoration du coin bar,"7,0",Hôtel,Nice," 7,4 "
Christophe,France,0,2019-02-02 00:00:00,Bien ,None,"Hôtel un peu vétuste le faste d’antan est un peu passé !
Il demanderait une bonne rénovation 
Perso ma chambre toute petite sans grand standing ! Même pas de chaussons !
Malgré tout propre 
Literie confortable salle de bain d’époque !
Seul atout de l’hôtel son emplacement 
Petit déjeuner j’ai connu bien mieux surtout sur le salé !
A mon avis pour le prix il y a nettement mieux mais pas forcément sur la promenade !
Son réel atout son emplacement....","7,1",Hôtel,Nice," 7,4 "
Muriel,France,0,2019-01-31 00:00:00,séjour agréable,"Le lit était très confortable. La vue sur la mer est superbe, il y a un balcon. Chambre très calme au premier étage,, malgré la circulation. Chambre et salle de bain grandes et agréables.",None,"7,1",Hôtel,Nice," 7,4 "
Carpediem133,France,0,2019-01-30 00:00:00,Bien ,"L emplacement, près de la mer, la promenade et les magasins",Difficile à trouver du parking,"7,9",Hôtel,Nice," 7,4 "
Patrick,France,0,2019-01-29 00:00:00,très content,Super emplacement et personnel disponible et très agréable,mobilier et salle de bains vieillots,"8,8",Hôtel,Nice," 7,4 "
83flo-var,France,0,2019-01-28 00:00:00,cadre sympathique qui manque de rafraichissement,"L'hôtel est bien placé, sur la promenade, un parking souterrain (payant) à proximité.
Le personnel agréable, accueillant et disponible.
La chambre confortable et propre","Il serait judicieux de mettre a disposition dans les chambres un bouilloire avec thé et café et une bouteille d'eau, comme le font la plupart des hôtels de cette catégorie.
La salle de bain est vieillissante ...dommage","7,5",Hôtel,Nice," 7,4 "
Catherine,France,0,2019-01-27 00:00:00,Bon séjour,"La situation, grande chambre avec vue sur mer",J’aurais souhaiter bouilloire électrique pour tisane le soir un petit confort sympa,"7,5",Hôtel,Nice," 7,4 "
Stéphanie,France,0,2019-01-23 00:00:00,Impeccable et bon rapport qualité/prix car excellent emplacement,La decoration de la chambre. L’emplacement,Beaucoup trop chaud dans la chambre donc pas bien dormi.,"7,5",Hôtel,Nice," 7,4 "
Salih,France,0,2019-01-19 00:00:00,Bien ,Personnel très agréable et compétent les chambres très confortables de bon goût spacieuses vue exceptionnelle je recommande fortement . Petit clin d’œil à Jean personnage exceptionnel.,None,"7,5",Hôtel,Nice," 7,4 "
Christophe,France,0,2019-01-17 00:00:00,"Je conseille cet établissement pour un petit budget, si le tarif augmente la chambre devra évoluer.",Le personnel de l’hôtel est très accueillant et serviable.,"Chambre très petite, mais je comprends car le prix est peu onéreux. Cette dernière manque un peu de fraîcheur.","8,8",Hôtel,Nice," 7,4 "
Naima,Maroc,0,2019-01-16 00:00:00,Bien ,L’emplacement de l’hôtel est excellent. Le personnel est très accueillant et la chambre est confortable.,Petit déjeuner très pauvre . L’entrée de l’hôtel est vieille.,"7,9",Hôtel,Nice," 7,4 "
Debray,France,0,2019-01-14 00:00:00,très bel établissement mais qui a besoin de s'améliorer,"emplacement
matelas","moquette tachée
absence de cafetière dans la chambre
absence isolation phonique et thermique sur la rue
porte douche non étanche","6,7",Hôtel,Nice," 7,4 "
William,Pays-Bas,0,2019-01-11 00:00:00,Le faste d’antan,"J’adore ce voyage dans un autre temps, ici C année folles! Chambre spacieuses et modernes, côté mer ne pas manquer le lèver de soleil.",Un brin vieillissant...,"7,5",Hôtel,Nice," 7,4 "
Patricia,Suisse,0,2019-01-08 00:00:00,Bien ,La magnifique vue !,None,"7,9",Hôtel,Nice," 7,4 "
Mireille,France,0,2019-01-06 00:00:00,emplacement idéal . J'y retournerai .,L'emplacement de 1er ordre mais absence de parking . Le personnel est professionnel . Les chambres sont grandes. le Wifi est gratuit et fonctionne .,Le parking bien sûr …..et les moquettes à changer !,"7,5",Hôtel,Nice," 7,4 "
Paul,France,0,2018-12-31 00:00:00,"Très bon endroit pour découvrir Nice, on est près du centre à Pied.","Le personnel de chambre est très gentil
Il y a des parkings à proximité.
Etablissement idéalement situé en face de la mer et pas loin de Villefranche sur mer et St Jean Cap Ferrat.","les ascenseurs pas très rapides il y a souvent de l'embouteillage.
La pression de l'eau de la douche est un peu insuffisante. 
Il faudrait des distributeurs de boisson automatiques vers l'entrée.","8,3",Hôtel,Nice," 7,4 "
Kouros,Belgique,0,2018-12-20 00:00:00,Les nuit pas évident !(bruits),L’emplace,"Bruit de pas au plafond, chasse d’eau, claquement des portes","7,1",Hôtel,Nice," 7,4 "
Philippe,France,0,2018-12-19 00:00:00,Superbe,"Une réception un peu houleuse au départ liée a un débit précoce de notre facture !! , mais très bien géré par la responsable qui a fait preuve de pondération dans les échanges et qui nous a gentiment offert nos petit-déjeuners , une belle preuve de professionnalisme dans le commerce ! merci a elle !!!",None,"8,8",Hôtel,Nice," 7,4 "
Myriam,France,0,2018-12-17 00:00:00,Superbe,Lit super grand chaud douillet petit dej super personnel au petit soin,None,"8,8",Hôtel,Nice," 7,4 "
Khalilsow,Guinée,0,2018-12-16 00:00:00,2 NUITS,LE PROFESSIONALISME DU PERSONEL,L'ACCUEIL,"7,1",Hôtel,Nice," 7,4 "
Michele,France,0,2018-12-12 00:00:00,Bien ,"Son emplacement, son cadre","Dommage, pas de restaurant à cette période de décembre, alors que dans les conditions particulières est noté : restaurant
 Un devis vacances Bleues comporte aussi demi pension, ce qui est erroné.. juste un petit déjeuner possible à cette période","7,5",Hôtel,Nice," 7,4 "
Mohamed,France,0,2018-12-12 00:00:00,Agréable séjour,L’emplacement,La salle de bain aurait besoin d’un sérieux rafraîchissement,"8,8",Hôtel,Nice," 7,4 "
Philippe,France,0,2018-12-10 00:00:00,Superbe,"L'emplacement géographique est parfait (en plein centre de la Promenade des Anglais à Nice), le prix est plus que justifié.","La literie est un peu dure, la climatisation un peu vieille, le rez-de-chaussée un peu défraichi.","8,8",Hôtel,Nice," 7,4 "
Christophe,France,0,2018-12-06 00:00:00,Bien ,Le personnel est très sympa. Le prix aussi par rapport à l emplacement. Le calme...,"Hôtel de charme mais vieillot. Quand on arrive on fait un gros pas en arrière. M impression de visiter un musée. Chambres dans leur jus, moquette vieillotte...","7,5",Hôtel,Nice," 7,4 "
Rosaheat,Algérie,0,2018-12-01 00:00:00,Bien ,TouS,Bon,"7,9",Hôtel,Nice," 7,4 "
Michel,France,0,2018-11-30 00:00:00,Bien ,L'accès rapide à l'hôtel,"Nous avions appelé la veille pour demander une chambre à 2 lits, à l'arrivée pas fait (la personne, la veille, à la réception, n'avait pas noté mon message...) et attente de 20 minutes le soir avant que cela soit exécuté.","7,5",Hôtel,Nice," 7,4 "
Famillemarcala,Belgique,0,2018-11-25 00:00:00,Rapport qualité/prix par au rendez-vous ... Personnel de la réception très professionnel/à l'écoute,"La localisation par rapport à la plage (vue) et le centre ville
La qualité de la literie et le confort général de la chambre","Le bruit ! Absence d'acoustique - Quel trafic sur cette promenade des Anglais !
La propreté (plafonnage endommagé, peinture surtout dans le restaurant)
Le petit déjeuner pas très en ligne avec le standing de l'hôtel !!!
Le service déplorable d'un des serveurs du bar !","6,2",Hôtel,Nice," 7,4 "
Pascale,France,0,2018-11-20 00:00:00,Quelle déception 😞 !!!,La situation géographique proche des points stratégiques et le calme de l'hôtel,"La salle de bain très vieillotte totalement à refaire et la propreté de la baignoire, de la robinetterie qui laisse à désirer... J'ai du nettoyer moi même et cela n'est pas ce que l'on attend d'un hôtel ""3 étoiles""
Je suis très surprise et surtout très déçue.. Je voyage énormément et j'ai été beaucoup plus séduite de par des hôtel 2 étoiles qui offraient un confort ainsi qu'une hygiène irréprochable ce qui est loin d' être le cas ici
Dommage mais des rénovations urgentes s'avèrent nécessaires si le royal veut conserver ses étoiles !!!","6,7",Hôtel,Nice," 7,4 "
Ana,Suisse,0,2018-11-19 00:00:00,Bien ,l'empalement de l'hôtel,None,"7,5",Hôtel,Nice," 7,4 "
Didier,France,0,2018-11-17 00:00:00,Superbe,BIEN PLACE SUR LA PROMENADE,"HOTEL UN PEU DESUET QUI AURAIT BESOIN D UN BON RELOOKING 
PAS DE PARKING HOTEL ET DIFFICILE A TROUVER AUX ABORDS - PARKING PUBLIC A 500 M MAIS 20 EUROS","8,8",Hôtel,Nice," 7,4 "
Geraldine,France,0,2018-11-14 00:00:00,Bien ,"Chambre spacieuse
Très belle vue
Silencieux",Entretien des locaux (peinture moquette),"7,5",Hôtel,Nice," 7,4 "
Caroline,France,0,2018-11-09 00:00:00,Bien ,Bien situé proche du centre de la ville et face à la mer. Bon rapport qualité prix,Intérieur vieillissant qui nécessiterait une rénovation des peintures et un design plus actuel,"7,9",Hôtel,Nice," 7,4 "
Denise,France,0,2018-11-06 00:00:00,Très bien,"L’emplacement en face de la promenade des anglais 
La sympathie du personnel 
Matelas de Bonne qualité 
Pour le petit déjeuner on peut mieux faire (jambon moyen )le plus des fruits frais","Vétustée de la chambre vielle moquette 
Mauvais état de la salle de bain 
Moisissures au-dessus de la baignoire 
(Vue sur l’arrière cours)
N’hésitez pas à prendre vu sur la mer (les chambres sont dans un meilleur état)","8,3",Hôtel,Nice," 7,4 "
Nicole,Suisse,0,2018-11-06 00:00:00,un très bon hôtel point de vue prix qualité et surtout très apprécié par rapport à sa situation,"accueil chaleureux, personnel sympathique et souriante. Localisation de l'établissement.","la douche aurait eu besoin d'un rafraichissement, car le sol se décollé et du coups, l'eau stagné et ça a crée des fortes odeurs, styles d'égouts.","7,9",Hôtel,Nice," 7,4 "
Denise,France,0,2018-11-05 00:00:00,Bien ,"Accueil sympa et arrangeant 
Chambre côté ville à rénover 
Petit déjeuner ça va il y a des fruits frais 
Du gruyère du jambon (premier prix)
Café en machine","Il faisait chaud dans le restaurant 
On a mangé sur la terrasse","7,1",Hôtel,Nice," 7,4 "
Ouahiba,France,0,2018-11-04 00:00:00,"Très agréable séjour, les prestations étaient à la hauteur de nos attentes, personnel à l'écoute des","une situation géographique idéale, proche de toutes les attractions touristiques. vue magnifique sur la plage et la promenade des Anglais.",Les lieux ont besoin d'un rafraîchissement ( peintures et moquette),"8,8",Hôtel,Nice," 7,4 "
Sibylle,Suisse,0,2018-11-04 00:00:00,Agréable,None,Pas de machine à café frigo vide,"6,7",Hôtel,Nice," 7,4 "
Yannick,Suisse,0,2018-11-03 00:00:00,Très bien,L’emplacement et la vue,Le lit d’appoint pour un adulte est trop petit,"8,3",Hôtel,Nice," 7,4 "
Marie,France,0,2018-11-02 00:00:00,Superbe,Localisation géographique avec la vue sur la Promenade des anglais,Thé lipton du petit dej,"8,8",Hôtel,Nice," 7,4 "
Gwen,France,0,2018-10-23 00:00:00,Emplacement idéal après en ce qui concerne la chambre.. :s,"L'emplacement idéal sur la promenade des anglais, des commerces, du centre du bus.. l'ideal!! Personnel très accueillant !!!","Chambre vieillotte, douche a l'ancienne, difficile de régler la température de l'eau, salle de bain très vieillotte!","7,9",Hôtel,Nice," 7,4 "
Hourya,Maroc,0,2018-10-22 00:00:00,Bien dans l'ensemble,La situation géographique,"Salle de bain,oreillers","7,5",Hôtel,Nice," 7,4 "
Pascal,France,0,2018-10-21 00:00:00,Bien ,"La facilite de reservation, le personnel de la salle de pdj et la reception.",Un peu vétuste dans la salle de reception et dans les chambres.,"7,5",Hôtel,Nice," 7,4 "
Bertrand,France,0,2018-10-21 00:00:00,Superbe,"Accueil, chambre 404 très belle et vaste, lieu central (promenade des anglais) et une vraie belle vue sur mer !! Chambre bien insonorisée et déco soignée...",Petit déjeuner à améliorer ... pas de parking mais ça sur la promenade des anglais on ne peut pas tout avoir (parking public couvert non loin mais à prix délirant)! 😁,"8,8",Hôtel,Nice," 7,4 "
Philippe,France,0,2018-10-19 00:00:00,Peut mieux faire,Rapport qualité prix,15mm d’attente pour avoir la chambre 1seule personne à l’accueil.reveille par le tel à 7h 30 suite erreur .chambre dans son jus. Petit déjeuner light manque de choix,"7,1",Hôtel,Nice," 7,4 "
Alexis,France,0,2018-10-17 00:00:00,Bien ,Le lit xxl,La manière de faire le lit,"7,5",Hôtel,Nice," 7,4 "
Christophe,France,0,2018-10-15 00:00:00,Agréable.,"Le charme des anciens palaces, idéalement situé sur la Promenade.",Le mobilier des chambres côté ville gagnerait à être aligné sur celui des chambres côté mer.,"8,8",Hôtel,Nice," 7,4 "
Annyck,France,0,2018-10-12 00:00:00,De passage,"son emplacement central, le petit-déjeuner buffet","Cet hotel tres bien placé demanderait une bonne rénovation, un peu dans son ""jus"".","7,9",Hôtel,Nice," 7,4 "
Houri,France,0,2018-10-11 00:00:00,En résumé le rapport qualité prix est correct,Une balance pour peser le bagages.,"Manque d’hygiène.
J’ai trouvé des cheveux dans mes draps.
La moquette n’est pas très hygiénique.","6,7",Hôtel,Nice," 7,4 "
Monique,France,0,2018-10-09 00:00:00,bon séjour calme et gentillesse du personnel,"la situation géographique
le petit déjeuner
le calme","peut être, rénover les salles d'eaux- poignée anti-chute dans la douche et entretien des carreaux","8,3",Hôtel,Nice," 7,4 "
Nathalie,France,0,2018-10-07 00:00:00,Bien ,"Confort calme et emplacement
Personnel adorable
Bon accueil","L'odeur d'humidité moisie dans la salle d'eau 
Cabine de douche très glissante et petite (chambre individuelle)","7,9",Hôtel,Nice," 7,4 "
Colandane,Tunisie,0,2018-10-03 00:00:00,Très bien,"Chambre propre 
Vue imprenable sur la plage
Calme absolu",Literie,"6,7",Hôtel,Nice," 7,4 "
Racheleano,Suisse,0,2018-10-02 00:00:00,Agréable,Emplacement,Extérieur bien intérieur et chambres vieillissante à refaire. Triste.,"6,2",Hôtel,Nice," 7,4 "
Eddy,France,0,2018-09-15 00:00:00,Bien ,None,la salle de bain,"7,9",Hôtel,Nice," 7,4 "
Bella,Belgique,0,2018-09-05 00:00:00,A refaire,Emplacement de l’hotel ..,Lampe de chevet allumage pas conforme et surtout SDB le sèche cheveux qui pendait sur 2 fils j’en Avais peur,"7,5",Hôtel,Nice," 7,4 "
Isabelle,France,0,2018-08-29 00:00:00,AVONS PASSE UN BON SEJOUR,OUI TRES BIEN,CHAMBRE PAS NETTOYER QUAND FAIT LA DEMANDE (AVONS MIS A CHAQUE FOIS LE CARTON),"8,8",Hôtel,Nice," 7,4 "
Noureddine,Maroc,0,2018-08-25 00:00:00,En général bien,Petit déjeuner incompatible par rapport qualite/prix on peut mieux faire,Les fourmis dans la chambre partout ? Malgré les insecticides employes,"8,8",Hôtel,Nice," 7,4 "
Mohamed,Turquie,0,2018-08-24 00:00:00,Le petit déjeuner,None,"Pourquoi l’établissement a changé le lieu de petit déjeuner? 
Avant le buffet de petit déjeuner était au Bar c’était vraiment super","7,9",Hôtel,Nice," 7,4 "
Jean-luc,France,0,2018-08-22 00:00:00,bon pour une nuit,l'emplacement,le manque d'entretien de l'immeuble,"6,2",Hôtel,Nice," 7,4 "
Maria,Luxembourg,0,2018-08-22 00:00:00,Agréable malgré la chambre😏,La situation géographique,La chambre besoin d’etre Renouveler.,"6,7",Hôtel,Nice," 7,4 "
Simon,France,0,2018-08-06 00:00:00,Décevant.,L’emplacement et la vue,"Hôtel complètement défraîchi les chambres sont correct mais les parties communes sont de l’ancien siècle à l’image de l’accueil du personnel.
Attention hôtel pour senior.","7,1",Hôtel,Nice," 7,4 "
Mp,France,0,2018-08-04 00:00:00,Bien ,L emplacement parfait et le personnel très aimable,"Chambre vieillotte, à rénover....","7,1",Hôtel,Nice," 7,4 "
Abdallah,France,0,2018-08-02 00:00:00,Bien ,None,Délit de faciès à plusieurs reprise le personnel m’a questionner sur ma présence dans l’établissement alors que la chambre était à MON NOM,"7,1",Hôtel,Nice," 7,4 "
Hervé,France,0,2018-07-24 00:00:00,"ensemble satisfaisant, bonne literie, calme mais revoir le petit-déjeuner",l'emplacement,le petit-déjeuner,"7,5",Hôtel,Nice," 7,4 "
Jegathish,France,0,2018-07-09 00:00:00,Agréable,L'emplacement,La chambre et les équipements,"6,2",Hôtel,Nice," 7,4 "
Patrick,France,0,2018-07-03 00:00:00,Bien ,Le charme de l'établissement,None,"7,9",Hôtel,Nice," 7,4 "
Philippe,Belgique,0,2018-07-01 00:00:00,Bien ,"Chambre, vue magnifique. Petit-déjeuner varié.","L'accueil du personnel pourrait être amélioré. Cuisine du restaurant très médiocre.
Bruyant même en étage élevé.","7,1",Hôtel,Nice," 7,4 "
Sophia,France,0,2018-06-26 00:00:00,Très bien,None,Petit déjeuner trop simple,"8,3",Hôtel,Nice," 7,4 "
Jean-marc,Suisse,0,2018-06-25 00:00:00,Agréable,Emplacement et la vue depuis la chambre,"La moquette, le bar de la chambre vide","6,5",Hôtel,Nice," 7,4 "
