nom,pays,favorite,date,titre,bons_points,mauvais_points,note,type_etablissement,lieu,note_etablissement
Christophe,France,0,2019-03-28 00:00:00,Passable,Hôtel était proche de autoroute proche des transports en commun seul soucis la carte du restaurant très peux de choix,None,"5,4",Hôtel,Marseille," 7,0 "
Penneron,France,0,2019-03-19 00:00:00,Hotel très agréable,Le calme un personnel exemplaire,Super agréable pas de bruit.,10,Hôtel,Marseille," 7,0 "
Tenessa,France,0,2019-03-15 00:00:00,Séjour d'une nuit assez cher mais dîner et petit déjeuner pris sur place.,"Personnel très accueillant.
Repas avec bon rapport qualité/prix.
Accessible en fauteuil roulant manuel.",le papier toilette trop fin,"8,8",Hôtel,Marseille," 7,0 "
Nicolas,Royaume-Uni,0,2019-03-14 00:00:00,Assez médiocre ,"Malheureusement , rien par rapport au prix.","La qualité Campanile n est que l ombre d elle même dans cet établissement. Chambres vétustes, téléphone qui ne fonctionne pas, accueil plus que froid, et surtout nos affaires retiré de notre chambre entre les deux nuit?! Évidement nous n avons pas tout récupéré.","3,3",Hôtel,Marseille," 7,0 "
Mathieu,France,0,2019-03-13 00:00:00,Décevant,L accueil et la réception,Mauvaise literie sanitaire en mauvais état et pas toujours propre,"4,6",Hôtel,Marseille," 7,0 "
Mohmed,Italie,0,2019-03-08 00:00:00,Décevant,L'endroit,Le petit déjeuner est moins riche en plus ils ont pris le triple prix pour une personne par ma carte de crédit sans justificatif.,"4,2",Hôtel,Marseille," 7,0 "
Alexia,France,0,2019-03-05 00:00:00,Fabuleux ,"Petit bemol sur le vis a vis
Chambrejpropre spacieuse et calme",None,"9,2",Hôtel,Marseille," 7,0 "
Vero07,France,0,2019-02-22 00:00:00,Accueil exceptionnel....,"L accueil exceptionnel, la gentillesse de tout le personnel. 
Le repas du soir proposé sous forme de buffet ainsi que le petit-déjeuner sont variés et bons.",None,10,Hôtel,Marseille," 7,0 "
Bérengère,France,0,2019-02-11 00:00:00,Campanile: toujours aussi bien; très bon petit déjeuner devant jardin,"j'aime la bouilloire dans la chambre de votre chaine d'hotels, mais je ne supporte pas le thé Lipton alors j'apporte mon thé !
 super literie, grand calme",les 2 chambres n'étaient finalement pas communicantes,"9,2",Hôtel,Marseille," 7,0 "
Patricia,France,0,2019-01-29 00:00:00,Décevant,La tranquillité,"Chambre 220 : tele HS, Porte d'entrée ne fermant pas.
Buffet : Apparence pas du jour (de la veille)
Pâtisserie : pas fraîches (produits de la veille)","5,4",Hôtel,Marseille," 7,0 "
Choukri,France,0,2019-01-28 00:00:00,Tre bon confort d où la nuit appréciable,Le lit etait confortable et la couette super moelleuse!,De l aipassait par la fenêtre malgré le store complètement baissé! Dommage,"8,8",Hôtel,Marseille," 7,0 "
Alexandre,France,0,2019-01-27 00:00:00,Passable,None,"Il n ai pas tolérable d avoir une salle (sale)
De bain dans cet état . Aucun entretien
Chambre 122","5,4",Hôtel,Marseille," 7,0 "
Rosène,France,0,2019-01-24 00:00:00,"Personnel très professionnel, propreté de la chambre parfait !!",Nous avons demandée chambre au calme et c'était le cas. Nous avons très bien dormi.,None,10,Hôtel,Marseille," 7,0 "
Philippe,France,0,2019-01-19 00:00:00,Exceptionnel,Proche autoroute,Ca va propre,10,Hôtel,Marseille," 7,0 "
Christophe,Belgique,0,2019-01-08 00:00:00,Très moyen.,la douche,Le personnel,"5,4",Hôtel,Marseille," 7,0 "
Camilla,France,0,2019-01-03 00:00:00,Contents de repartir.,"J'ai aimé le fait que nous nous sommes réveillés en retard (10h) et l'équipe du restaurant nous a attendu, moi et mes enfants pour déjeuner.","J'ai été déçue du fait qu'il n'y avait pas de gel douche et après avoir fait 700 km on aurait voulu prendre une douche et comme il était déjà un peu tard, on était trop fatiguée pour se prendre la tête a demander a ce qu'on nous mette une recherche de gel douche... Nous avons trouvé que la moquette sentais mauvais.","5,0",Hôtel,Marseille," 7,0 "
Pruvot-perifel,France,0,2018-12-16 00:00:00,Superbe,"le calme et son confort, son cadre extérieur, son parking privé, l'espace de la chambre très satisfaisante",son plat du jour qui était inscrit au tableau mais qui n'était pas cuisiner ce soir là,"8,8",Hôtel,Marseille," 7,0 "
Florence,France,1,2018-12-05 00:00:00,grrr les gilets jaunes !!!mais je reviendrais,"je n'ai pas pu me rendre à l'hôtel à cause des gilets jaunes mais lorsque je doit aller sur Marseille je vais toujours dans cet hôtel le jardin y est agréable , la voiture en sécurité dans le parking le lit est bon , les chiens admis et le personnel accueillant .chambre petite mais suffisante j'aime beaucoup cet j'y retournerais un petit peu excentré mais c'est pas plus mal pour la tranquillité",None,"9,6",Hôtel,Marseille," 7,0 "
Sarl,France,0,2018-11-28 00:00:00,manque de professionnalisme,None,"Manque de professionalisme, 
Un gros manque de formation, pas de contact avec le client, on vous propose une table sans parler, sans vous demander si cela vous conviens.
Les buffets aussi bien froid, chaud ainsi que le buffet dessert pratiquement vide à chaque diner, devoir demander au personnel pour réapprovisionner est inadmissible cela doit venir et etre fait par le personnel.","5,0",Hôtel,Marseille," 7,0 "
Isabelle,France,0,2018-11-26 00:00:00,Superbe,Agréablement surprise ! Aucune nuisance sonore. Très propre.,None,"8,8",Hôtel,Marseille," 7,0 "
1951tiburce,France,0,2018-11-19 00:00:00,Etablissement à éviter le plus possible. Je ne le recommande pas et à personne.,"Rien. Même le repas chaud était froid. J'ai pris un duo entrée plat, jamais on ne m'a enlever l'assiette des entrées. J'ai aussi pris une bière au verre soit disant 25 CL je suis sûr que le verre ne peut contenir 25 CL.","L'accueil plus dur qu'ailleurs. Je suis pourtant un fidèle de la chaîne mais là horrible. La photocopie de ma carte d'identité. La chambre pas de papiers toilettes, la télévision qui fonctionne très mal, pas d'ampoule sur la lampe côté TV. La poubelle du toilette HS.","3,8",Hôtel,Marseille," 7,0 "
Katia,France,0,2018-10-29 00:00:00,Heureusement qu'il avait la ville Marseille quoi,L'accueil très agréable le service très agréable,La chambre était dégueulace à l'époque où nous sommes c'est henteux .,"5,0",Hôtel,Marseille," 7,0 "
Soltan,France,0,2018-10-29 00:00:00,Horrible,"Moquette de la chambre taché, dans la salle de bain, mauvaise odeur + joins de carrelage jaune pipi ! Poil dans la douche... 
we encrassé, cuvette taché
Bouilloire remplis de calcaire.. 
très bas de gamme",None,"2,9",Hôtel,Marseille," 7,0 "
Jacques,France,0,2018-10-29 00:00:00,Peut mieux faire,"Prix, propreté.","Vétusté de la chambre, SdB vieillotte.","5,0",Hôtel,Marseille," 7,0 "
Marie,"Abkhazie, Géorgie",1,2018-10-19 00:00:00,Du vrai bonheur!!!,"Un accueil de très bonne qualité avec des hotesses souriantes et à notre disposition. Une literie de très bonne qualité dans une chambre spacieuse, très bien insonorisée..... pas de bruit
La situation parfaite quand on arrive par le train.
Bref, je retiens l'adresse pour un prochain séjour à Marseille",None,10,Appart'hôtel,Marseille," 8,1 "
Claire,France,0,2020-03-20 00:00:00,Parfait pour visiter Marseille en arrivant en train,L emplacement près de la gare et du vieux port,"Il manque une cafetière
Impossible de baisser le chauffage","9,2",Appart'hôtel,Marseille," 8,1 "
Chris,France,0,2020-03-18 00:00:00,Très bien,IMPECCABLE,None,"8,0",Appart'hôtel,Marseille," 8,1 "
Eric,France,0,2020-03-18 00:00:00,"bon sejour , tres bien situé avec bon rapport qualité /prix","tres bien placé , proche a pieds du Vieux Port , bien équipé , bonne literie , bien insonorisé , parking payant proposé pour 10 euros par jour , accès un peu compliqué mais finalement tres pratique avec l'habitude.
Mais la présence d'une kitchenette tres bien équipée (avec lave vaisselle ) un peu gachée par le fait qu'il n'y a pas de table pour manger dans la piece ( juste un petit bureau tres etroit ) donc tres bien pour dormir , si vous comptez prendre vos repas dans la chambre cela est plutot compliqué ....","pas de place pour prendre le repas dans la chambre 
en periode de COVID 19 , la personne de la reception qui eternue et se mouche devant les clients sans protection particuliere","8,0",Appart'hôtel,Marseille," 8,1 "
Manthia,France,0,2020-03-15 00:00:00,👌🏽,Très bien situé et très propre!,None,"8,8",Appart'hôtel,Marseille," 8,1 "
Laurent,France,0,2020-03-15 00:00:00,manque un service de consigne pour les bagages.,appartement bien équipé et propre. literie confortable.,apprendre la veille de mon arrivée qu'il n'y avait pas de consigne pour les bagages.,"7,0",Appart'hôtel,Marseille," 8,1 "
Annie,France,0,2020-03-13 00:00:00,Très bien,L emplacement,None,"8,0",Appart'hôtel,Marseille," 8,1 "
M-hélène,France,0,2020-03-09 00:00:00,Bon choix pour un week end sur Marseilles,"La chambre était adaptée à nos besoins , la literie confortable.",Les modalités de sorties du parking étaient un peu compliquées.,"8,0",Appart'hôtel,Marseille," 8,1 "
Gérard,France,0,2020-03-09 00:00:00,Studio très confortable et hôtel juste à côté de la gare et du métro,Vue sur notre dame et la mer,None,"8,3",Appart'hôtel,Marseille," 8,1 "
Anthony,France,0,2020-03-07 00:00:00,Bien ,L’emplacement,None,"7,5",Appart'hôtel,Marseille," 8,1 "
Philippe,France,0,2020-03-05 00:00:00,Bien ,Le confort,"Pas de ménage quotidien
Pas de bagagerie le jour du départ","7,0",Appart'hôtel,Marseille," 8,1 "
Salim,Algérie,0,2020-03-04 00:00:00,assez bien,l'emplacement de l'hotel,que j'ai demandé une chambre coté boulevard pour apprécié mieux malheureusement j'ai eu une chambre de l'autre coté de l'immeuble.,"7,0",Appart'hôtel,Marseille," 8,1 "
Faouzi,Maroc,0,2020-03-02 00:00:00,"Très bon séjour, agréable","Chambre était bien équipé, confortable et assez spacieuse pour 2 personnes. J'ai apprécié la coopération de la réception de m'avoir changé de chambre que j'ai eu en premier lieu et que je n'avais pas aimé.",néant,"8,0",Appart'hôtel,Marseille," 8,1 "
Fatiha,Maroc,0,2020-03-01 00:00:00,Magnifique,None,Poubelles public à ordures à l'entrée de l'hôtel.,"7,0",Appart'hôtel,Marseille," 8,1 "
Maryse,Canada,0,2020-02-24 00:00:00,Bonne formule appart-hôtel.,"Immeuble propre, bien insonorisé avec quelqu'un à l'accueil 24 /24h. 
Lit confortable, mini cuisine pour cuisiner quelques repas. 
Situé à 300 mètres de la gare Saint-Charles et à 10 minutes de marche du vieux port.",Ce n'est pas un quartier idéal pour une femme qui voyage seule car le soir venu on ne voit que des hommes dans la rue dans ce quartier. Peu de bons restos et pâtisseries dans ce quartier.,"8,0",Appart'hôtel,Marseille," 8,1 "
Jean-marie,France,0,2020-02-24 00:00:00,Séjour correct,Lit confortable personnel aimable et à l écoute pas loin du centre et du port,Je n ai pas trop aimé le quartier un peu sale. En ce qui concerne la chambre il faudrait une cafetière,"7,0",Appart'hôtel,Marseille," 8,1 "
Anastasie,France,0,2020-02-24 00:00:00,j'ai passée un très bon séjour dans cette hotel avec mon compagnon,que l'hotel soit proche de la gare. une accueille chaleureuse des demoiselles à la réception. la chambre était vraiment propre lit confortable bref c'était genial,si seulement il pouvait avoir les babouches de chambre,"9,0",Appart'hôtel,Marseille," 8,1 "
Jérome,France,0,2020-02-23 00:00:00,Très bien,Le personnel sympas et le petit déjeuner qui est très bien avec du choix,"Rien , tout était parfait pour nous","8,5",Appart'hôtel,Marseille," 8,1 "
Catherine,France,0,2020-02-22 00:00:00,Petite halte avant de prendre le train .,"Accueil sympathique etlogement agréable car surclassement .Petits déjeuners copieux .
Très proche de la gare .",Rien . Compte tenu du prix.,"9,0",Appart'hôtel,Marseille," 8,1 "
Isabelle,France,0,2020-02-20 00:00:00,séjour agréable.,"Prix de la chambre.
Absence de bagagerie.",Mal isolé vis-à-vis du passage dans la rue.,"7,0",Appart'hôtel,Marseille," 8,1 "
Sanaa,France,0,2020-02-19 00:00:00,Très bon séjour,"Bon emplacement, confortable et pratique",Pas assez de descriptif détaillé pour l'utilisation des équipements. Ex: lave vaisselle,"8,0",Appart'hôtel,Marseille," 8,1 "
Marion,France,0,2020-02-18 00:00:00,Très bien,Une terrasse immense au 6 eme étage avec une vue magnifique sur notre dame de la garde chambre spacieuse beaucoup de rangement et très propre,None,"8,0",Appart'hôtel,Marseille," 8,1 "
Kessy,France,0,2020-02-17 00:00:00,Fabuleux ,None,"Excellent séjour, hôtel propre , j ai apprécié le lieu et l'espace .Je recommande.","9,0",Appart'hôtel,Marseille," 8,1 "
Laura_maxime,France,0,2020-02-16 00:00:00,Bon hotel et bonne situation,Bonne situation à seulement 15min a pieds du vieux port,Les murs et porte de la salle de bain aurait besoin d etre nettoyer!!! et repeint,"8,0",Appart'hôtel,Marseille," 8,1 "
Jean,France,0,2020-02-16 00:00:00,Très bien,Gentillesse,Garage séparé du bâtiment,"8,0",Appart'hôtel,Marseille," 8,1 "
Jean,France,0,2020-02-16 00:00:00,Nous reviendrons,None,Odeur de tabac dans l'appartement,"7,0",Appart'hôtel,Marseille," 8,1 "
Jacques,France,0,2020-02-10 00:00:00,Excellente étape,Equation qualite/coût,None,"8,0",Appart'hôtel,Marseille," 8,1 "
Jean-marie,France,0,2020-02-07 00:00:00,Bien avec un accueil chaleureux,None,Ça sentait le tabac froid,"8,0",Appart'hôtel,Marseille," 8,1 "
Duarte,France,0,2020-02-06 00:00:00,Très bien,La literie...,Propreté accessibilité...,"8,0",Appart'hôtel,Marseille," 8,1 "
Mohand,Algérie,0,2020-02-05 00:00:00,Très bien,Parfait,None,"8,0",Appart'hôtel,Marseille," 8,1 "
Catherine,France,0,2020-02-04 00:00:00,Résidence hôtelière agréable.,Proche de la gare. Accueil sympathique. Petit déjeuner complet.,Un peu petit pour 2 avec 2 valises.,"8,0",Appart'hôtel,Marseille," 8,1 "
Renee,France,0,2020-02-03 00:00:00,Très bien,Chambre claire. Vue dégagée.,"L'accès au parking de l'hôtel est facile. Mais pour sortir le lendemain c'est le chemin de croix...
Une explication plus complète s'impose.
Une méconnaissance de la ville par la réceptionniste.","8,0",Appart'hôtel,Marseille," 8,1 "
Zoubir,France,1,2020-02-03 00:00:00,ok,La gentillesse du personnel,"2 points: 
D'abord le fait que la résidence ne garde plus les bagages en consigne après le départ (midi). 
Ensuite le manque d'une cafetière de type expresso par exemple dans la chambre ce qui est la tendance dans presque tous les hôtels aujourd'hui.","8,0",Appart'hôtel,Marseille," 8,1 "
Yves,Tunisie,1,2020-02-03 00:00:00,Très bonne solution pour un court séjour à Marseille,"situation, kitchenette, plutôt calme","un seul ménage en 7 jours : ce qui entraîne manque de serviettes , de papier toilette, etc.. et dans ce registre je ne trouve pas très élégant de demander au client (par mail) de vider les poubelles (surtout à des clients bientôt octogénaire et au début d'un voyage épuisant !)","8,0",Appart'hôtel,Marseille," 8,1 "
Said,France,0,2020-02-02 00:00:00,Très bien,Je trouve que le petit déjeuner est chère vis a vis les cafés qui sont n'ai tour,Le parking,"8,0",Appart'hôtel,Marseille," 8,1 "
Philippe,France,0,2020-02-01 00:00:00,Séjour réussi dans une ville agréable,emplacement central pour visiter la ville et proche de la gare . quartier calme et chien accepté,un peu trop de chauffage,"8,0",Appart'hôtel,Marseille," 8,1 "
Caroline,France,0,2020-01-29 00:00:00,Très bien,Le confort et l’esthétique de la chambre salle de bain et cuisine,Le petit déjeuné rapport qualité/prix pas top,"8,3",Appart'hôtel,Marseille," 8,1 "
Mohamed,Tunisie,0,2020-01-28 00:00:00,Un très bon séjour à recommander et à le choisir la prochaine fois,Sécurité impeccable,Il y'a une odeur qui sortait de la canalisation qui est désagréable,"9,0",Appart'hôtel,Marseille," 8,1 "
Marie,France,0,2020-01-23 00:00:00,Très bien,manque un grill pain et verres ordinaires pour eau,None,"8,0",Appart'hôtel,Marseille," 8,1 "
Simone,France,0,2020-01-23 00:00:00,"Séjour calme, très bon accueil","Personnel très agréable
Situation géographique très pratique
Came et propreté désignent cet hôtel",rien,"9,0",Appart'hôtel,Marseille," 8,1 "
Ahmed,Algérie,0,2020-01-22 00:00:00,Ce nest pas mal vue la qualité prix et surtout l'emplacement de l'établissement.,L'emplacement surtout,Ecrit de lhotel en demandant delaisser la cuisine comme vous laviez trouvé à la rigueur oui mais dire à un cluent de vider la poubelle ce nest pas normal je trouve.,"7,0",Appart'hôtel,Marseille," 8,1 "
Alexandra,France,0,2020-01-21 00:00:00,Très bien,"Un accueil au top
Il faisait très chaud dans la chambre",None,"8,0",Appart'hôtel,Marseille," 8,1 "
Delphine,France,0,2020-01-19 00:00:00,très bien,None,"l insonorisation de la fenètre, me^me au 3 ème étage était moyenne... dommage","9,0",Appart'hôtel,Marseille," 8,1 "
Tarak,Algérie,0,2020-01-19 00:00:00,Bien ,None,Pas de bagagerie pour le depart,"7,0",Appart'hôtel,Marseille," 8,1 "
Bruno,France,0,2020-01-17 00:00:00,excellente dé&couverte,le petit déjeuner est vraiment très riche et bien approvisionné et très trais,None,"7,0",Appart'hôtel,Marseille," 8,1 "
Sabine,Portugal,0,2020-01-17 00:00:00,Superbe,La situation.. à 15 minutes du port,"L’odeur de fumée dans la chambre.
Manque de respect d’un client ...","8,8",Appart'hôtel,Marseille," 8,1 "
Benjamin,France,0,2020-01-16 00:00:00,"Agréable tout de même, malgré l'incident de la télé tombée en panne cette nuit. Je l'ai signalé.","La facilité de trouver la résidence, le confort et la qualité d'accueil.","L'odeur du renfermé à la sortie de l'ascenseur vers la direction des chambres. L'isolation phonique, je pouvais entendre le voisin cogné depuis la salle de bain. Agréable tout de même malgré l'incident de la télé qui est tombée en panne. Je l'ai signalé à l' accueil en partant ce matin.","8,0",Appart'hôtel,Marseille," 8,1 "
Lamyann,France,0,2020-01-03 00:00:00,Séjour court mais des plus agréable.,"Ce n'était pas notre premier séjour dans ce Residhomme mais l'accueil est toujours parfait. La chambre est une mini suite avec cuisine toute équipée, lave vaisselle inclus. Une belle terrasse avec une belle vue. Séjour court mais très agréable. C'est certain lorsque nous retournerons à Marseille nous descendrons de nouveau dans cet établissement.",None,"9,0",Appart'hôtel,Marseille," 8,1 "
Sophie,France,0,2019-12-29 00:00:00,Fabuleux ,"La gentillesse du personnels, les chambres très agréables et la proximité de l'hôtel au centre ville et commerces.",Dommage qu'il n'y a pas d'étendoir à linge dans les appartements en sachant qu'il n'y a un seul sèche linge.. Pas d'interventions services ménage pour 7 jours de réservation...,"9,2",Appart'hôtel,Marseille," 8,1 "
Mathilde,France,0,2019-12-19 00:00:00,Bien ,L’espace le lit le bureau,La saleté,"7,0",Appart'hôtel,Marseille," 8,1 "
Stef,Maroc,0,2019-12-06 00:00:00,Agréable,La situation,Trop de poussière dans la pièce,"6,7",Appart'hôtel,Marseille," 8,1 "
Elena,Bulgarie,0,2019-12-02 00:00:00,Exceptionnel,"L'hôtel est assez proche du centre ville. Propreté , lit confortable.","Il manque une bagagerie a l'hotel , ça ce fait partout déjà.","9,6",Appart'hôtel,Marseille," 8,1 "
Mostefa,Algérie,0,2019-11-28 00:00:00,Bien ,"Le lit confortable. Moyen Pour Cuisinier, calme (bonne isolation des chambres) ,TV bien régler",None,"7,0",Appart'hôtel,Marseille," 8,1 "
Grifon,France,0,2019-11-27 00:00:00,Superbe,La vue,Très salles sous le lit mais sinon très bien dans l'ensemble.,"8,8",Appart'hôtel,Marseille," 8,1 "
Lubrifiants,Algérie,0,2019-11-23 00:00:00,excellent séjours,"j'ai aimé l'emplacement, propreté , accueil , décoration , rapport qualité prix.",rien de spécial,"8,0",Appart'hôtel,Marseille," 8,1 "
Laurent,France,0,2019-11-21 00:00:00,Correct pour une nuit,Taille de la chambre et le petit déjeuner,"Le quartier (titre ST-CHARLES au lieu de porte D AIX), l'odeur de tabac froid présente dans la chambre","7,0",Appart'hôtel,Marseille," 8,1 "
Pascal,France,0,2019-11-19 00:00:00,Bien ,None,Le vrai point négatif de cette hôtel est qu'il ne propose pas de service de bagagerie (un comble vu la taille de l'hôtel). Nous avons quitter la chambre à midi et nous avons dû aller à la gare pour déposer nos bagages à la consigne (9.5 euros). Vraiment pas sympa.,"7,0",Appart'hôtel,Marseille," 8,1 "
Pauline,France,0,2019-11-19 00:00:00,Très bien,situé proche de la gare. appart hôtel avec de grande chambre bien agencée et bien décorée. petit déjeuner très bien avec du choix.,None,"8,0",Appart'hôtel,Marseille," 8,1 "
Hnb,Algérie,0,2019-11-19 00:00:00,Agréable,"L'éclairage, le chauffage, la literie pas mal, calme propre avec un emplacement stratégique","Manque d'articles dans la salle de bain
Sèche cheveux pas au top 
Vaisselles pas au complet et pas propre
Pas d'agents à l'entrée ni pour porter les bagages","6,7",Appart'hôtel,Marseille," 8,1 "
Andre',Italie,0,2019-11-17 00:00:00,Fabuleux ,"Emplacement 
Propriété 
Accueil",Seul le tapis des couloirs dois être changé si possible.,"9,2",Appart'hôtel,Marseille," 8,1 "
Larbi,Algérie,0,2019-11-14 00:00:00,"Correct, agréable.","l'emplacement, l'accueil et surtout la propreté des lieux",None,"7,0",Appart'hôtel,Marseille," 8,1 "
Helene,France,0,2019-11-11 00:00:00,Parfait pour un week-end,"Studio agréable et très propre. 
Localisation idéale. 
Personnel charmant",Lit mou,"7,0",Appart'hôtel,Marseille," 8,1 "
Mansourisimo,Maroc,0,2019-11-11 00:00:00,Exceptionnel,"Personnel accueillant et propreté irréprochable 
Le rapport qualité prix est plus que parfait !
Le vieux port est à quelques minutes...",La chambre est bien équipée mais manquait un fer à repasser !,"9,6",Appart'hôtel,Marseille," 8,1 "
Marie,France,0,2019-11-10 00:00:00,Bien ,None,Nous avons été obligés de partir pour raison familiale plus tôt que prévu et je crois que l établissement aurait pu faire un petit geste pour le box pour la voiture c'est la vie !!!!!!,"7,5",Appart'hôtel,Marseille," 8,1 "
Mohamed,Algérie,0,2019-11-08 00:00:00,Bien ,L’emplacement et le calme,Comportement de quelque personels,"7,9",Appart'hôtel,Marseille," 8,1 "
Linda,France,0,2019-11-06 00:00:00,Superbe,"Respect de la préférence lors du Booking pour situation studio en hauteur avec vue.
Check-in rapide. 
Proximité de la gare et équipement studio.",On ne peut plus laisser sa valise en attendant de venir la chercher si on ne part pas tout de suite après le check-out. Dommage.,"8,8",Appart'hôtel,Marseille," 8,1 "
Talbia,Belgique,0,2019-11-04 00:00:00,Séjour paisible et agréable !,"Le lit confortable, chambre calme, propre,...
Sentiment de sécurité !","Le fait de ne pas pouvoir laisser ma valise jusqu’à 14h30 le jour de mon départ... 
premier hôtel qui me le refuse !!!","8,0",Appart'hôtel,Marseille," 8,1 "
Tchay,France,0,2019-11-04 00:00:00,Bien ,Tout le reste a etait parfait,La directictrice a etait desagreable avec ma compagne pour 1 oubli de carte lorsque elle a voulu remonter avec l ascenseur !,"7,9",Appart'hôtel,Marseille," 8,1 "
Lydie,France,0,2019-11-04 00:00:00,Fabuleux ,J'ai apprecié l'emplacement et la propreté,"le mobilier de la cuisine est disloqué, 1 seul verre, coté cuisine, le service est minimum!","9,2",Appart'hôtel,Marseille," 8,1 "
Nadia,Algérie,0,2019-11-02 00:00:00,Superbe,Tout soit la propreté ou le service et aussi le personnel,Tellement que j etais ravie j ai prolongé encore mon sejour jusqu au 9 nov j ai essayer de reserver avec booking on m a refusé ma carte visa,"8,8",Appart'hôtel,Marseille," 8,1 "
Fatima,Maroc,0,2019-11-02 00:00:00,Fabuleux ,"La proximité a la gare sncf , la propreté et l aimabilite du personnel",Ils font pas le ménage chaque jour,"9,0",Appart'hôtel,Marseille," 8,1 "
Bernard,France,0,2019-11-02 00:00:00,Très bon séjour !,"Appartement agréable, calme, moderne, propre, bien équipe (TV, frigo, plaques, lave vaisselle et ustensils)
Lit confortable, luminaires design.
Très bien situé, proche de la Gare, à 2 pas de la cannebière et du vieux port.",None,"8,0",Appart'hôtel,Marseille," 8,1 "
Ismeralda,France,0,2019-11-01 00:00:00,Exceptionnel,"Très bon accueil, personnels au top, emplacement idéal, très bien pour les familles.",Les rideaux étaient sales,"9,6",Appart'hôtel,Marseille," 8,1 "
Abdelhalim,France,0,2019-10-31 00:00:00,Rien a dire sur le séjour plus que satisfait,"L’emplacement,la tranquillité, la sécurité ,la propreté.accueil ,","Certain personnels de l’établissement d ccueil marche pas sur terre , moins de gentillesse et de sympathie. A re convoque par p r le responsable de l’établissement pour les recardés.","8,8",Appart'hôtel,Marseille," 8,1 "
Pierre,France,0,2019-10-30 00:00:00,Très bien,La disponibilité et l'amabilité des personnes à l'accueil. La taille de l'appartement. La vue du 6ème étage. Proximité à pied du vieux port (15 min).,Les oreillers un peu gros et fermes à mon goût (mais c'est très subjectif).,"8,0",Appart'hôtel,Marseille," 8,1 "
Zoubir,France,1,2019-10-29 00:00:00,super,propreté - rapport qualité prix - balcon,manque une cafetière type nespresso par exemple,"9,0",Appart'hôtel,Marseille," 8,1 "
Chantal,France,0,2019-10-29 00:00:00,"Le studio était lumineux, confortable, il y a tout ce qu'il faut pour une cuisine rapide.",la résidence est bien située proche de la gare routière et de la gare SNCF.,"Seul bémol, l'éclairage de la chambre est insuffisant, on est dans le sombre pour manger.","8,0",Appart'hôtel,Marseille," 8,1 "
