nom,pays,favorite,date,titre,bons_points,mauvais_points,note,type_etablissement,lieu,note_etablissement
Sylvie,France,0,2019-01-02 00:00:00,Traverser la France pour un long week-end repos ensoleillé a faire plus souvent !,"l'accueil fort sympathique à mon arrivée, la gentillesse de toutes les personnes à qui j'ai eu affaire et ce quel que soit l'horaire ou la question posée (changements d'équipe à l'accueil en cours de journée), accueil en salle de petit déjeuner fort sympathique, J'avais laissé un petit mot de préférence lors de ma réservation (j'avais vraiment besoin de calme et de repos) et le nécessaire a été fait, vraiment un GRAND merci pour cette attention. La chambre ou plutôt devrais-je dire le studio est bien équipé, fonctionnel, et bien insonorisé (2 petits déj sur 4 et tous les repas du soir pris dans la chambre et là on apprécie le lave vaisselle et le réfrigérateur !). A proximité de la gare (pratique quand on traine son bagage) et a une dizaine de minutes à pied du vieux port, de la canebière, du panier, du quartier des antiquaires. Métro et bus à quelques pas. Largement de quoi passer les 4 jours ""mode touriste"" que j'attendais, Balcon pour le café du matin et/ou le verre retour de balades, baignoire (et oui j'apprécie un bon bain chaud au retour de plusieurs heures de marche rando) mais que les grincheux se rassurent le pare douche et le pommeau digne de ce nom permettent aussi de prendre une douche......Le plateau d'accueil classique mais que j’apprécie toujours, le choix et la variété de ce qui est proposé au petit déjeuner du sucré , du salé bien plus qu'il n'en faut pour faire un petit déjeuner de compétition.....La mini épicerie sur place pratique sans doute mais non testée.","Pas grand chose à vrai dire...le quartier reste un quartier de proximité gare, mais l’hôtelier n'y peut rien (et très franchement bien que voyageant seule et sortant mon petit chien tard le soir, je n'ai pas une seule fois eu la moindre crainte) , le quartier visiblement toujours en travaux, tout semblait à l'arrêt, je n'ai donc pas eu les inconvénients des-dits travaux, mais très clairement il y a un petit air de chantier laissé en plan, pas bien clean.....Si on parle du logement ouvre boite-décapsuleur mais pas de tire-bouchon (dommage j'ai du bricoler :-) ) et une petite éponge dans la cuisine aurait été bienvenue (je sais qu'une éponge c'est pas très hygiénique sauf à la changer a chaque client) ou un microfibre (passe en blanchisserie au même titre que les draps), il y avait bien un ramasse poussières mais pas de balayette ou balai..pas pratique hein? .On voit bien que les peintures sont récentes mais que certains clients doivent se comporter de manière fort peu respectueuse (coup et griffes sur les murs...)","8,8",Appart'hôtel,Marseille," 8,1 "
Sylvaine,France,0,2018-12-28 00:00:00,Exceptionnel,"Excellente situation à 5 minutes de la gare Saint Charles, de la gare routière, de la navette pour l'aéroport, d'un supermarché ouvert jusqu'à 22h, du vieux port et du Panier. Très calme et bien équipé. Une adresse idéale pour visiter Marseille. Je recommande.",None,"9,5",Appart'hôtel,Marseille," 8,1 "
Glodi,France,0,2018-12-27 00:00:00,Excellent,"L’accueil et le confort de l’établissement 
Le personnel très courtois et dynamique",Passage de nettoyage absent pendant un séjour de moins de 8jrs,"8,3",Appart'hôtel,Marseille," 8,1 "
Ivelina,France,0,2018-12-27 00:00:00,Agreable. Merci de votre accueil.,"Les lits tres confortables, les couettes tres chaudes, les draps tout neufs...",Juste 3 sachets de the et 3 de nescafe...pour 4 personnes...nous aimerions en avoir quelques uns davantage...,"8,3",Appart'hôtel,Marseille," 8,1 "
Elyes,France,0,2018-12-27 00:00:00,Superbe,Sur cette établissement rien a dire tout était parfait,Le seul point négatif il font la chambre une fois par semaine sinon le reste top,"8,8",Appart'hôtel,Marseille," 8,1 "
Pineau,France,0,2018-12-19 00:00:00,Très bon séjour,Très bien situé par rapport à la gare et aux transports en commun (tram et métro),Le petit déjeuner pourrait être amélioré,"9,2",Appart'hôtel,Marseille," 8,1 "
Siméone,France,0,2018-12-19 00:00:00,Bien ,"L'emplacement de l'hôtel est parfait, à 5 min de la gare et à 2 min du métro qui emmène au vieux port. La chambre est grande et comporte tout ce qu'il faut. Nous avons tout de même passé un bon séjour.","L'hôtel était correcte, mais on s'attendait à autres choses vue les photos que nous avions vue en réservant. La vue ne donnait pas du tout sur la bonne mère, mais sur un parc. En plus, la description de l'hôtel disait que nous pouvions ""déguster un petit-déjeuner le matin"" mais en arrivant sur place le petit déjeuner était payant.","7,5",Appart'hôtel,Marseille," 8,1 "
Jerome,France,0,2018-12-17 00:00:00,Fabuleux ,A 100 mètres de la gare. Parking sécurisé. Appartement Agréable et Bien équipé et terrasse. Propre. Petit déjeuner au top. A ce prix rien à redire.,Un ascenseur direct de l’hôtel au parking aurait été le top plutôt que faire le tour à pied mais très bien avec le bip fournit étc.,"9,2",Appart'hôtel,Marseille," 8,1 "
Antoine,France,0,2018-12-17 00:00:00,Très bien,C'était propre et le personnel était agréable,Il manquait une poêle pour faire à manger,"8,3",Appart'hôtel,Marseille," 8,1 "
Martine,Belgique,1,2018-12-14 00:00:00,Hôtel confortable et bien situé,L'hôtel est très bien placé lorsqu'on vient en train et il n'est pas très loin du Vieux Port,Rien,"8,3",Appart'hôtel,Marseille," 8,1 "
Nasreddine,Algérie,0,2018-12-13 00:00:00,Très appréciable,La chambre,None,"7,5",Appart'hôtel,Marseille," 8,1 "
Cyril,France,0,2018-12-12 00:00:00,Tres bon établissement,Le petit déjeuner copieux et varié. La chambre et ses équipements. Tres confortables,Ras,"9,6",Appart'hôtel,Marseille," 8,1 "
Allain,France,0,2018-12-10 00:00:00,Bien ,Le personnel est vraiment professionnel et très aimable. 👍,Ras,"7,5",Appart'hôtel,Marseille," 8,1 "
Bra,Maroc,0,2018-12-09 00:00:00,Fabuleux ,cuisine et balcon,"très bonne prestations.
appart. bien equipe","9,2",Appart'hôtel,Marseille," 8,1 "
Noge,France,0,2018-12-08 00:00:00,Hôtel très bien situé et bien équipé. Personnel accueillant.,Personnel très aimable et chambre grande et moderne.,"La salle de bains et toilettes pas assez propres.
Petit-déjeuner décevant.","7,5",Appart'hôtel,Marseille," 8,1 "
Philippe,France,0,2018-12-07 00:00:00,Agréable,Disposer de notre chambre plus tôt que prévu. Profiter de la bagagerie,None,"6,7",Appart'hôtel,Marseille," 8,1 "
Jeannie,France,0,2018-12-07 00:00:00,Bon séjour,"l'espace cuisine,la vue de la chambre",Le bruit des camions le matin,"9,2",Appart'hôtel,Marseille," 8,1 "
Rania,France,0,2018-12-03 00:00:00,Bien ,Emplacement idéal,Le ménage une fois par semaine,"7,5",Appart'hôtel,Marseille," 8,1 "
Gilles,France,0,2018-12-02 00:00:00,Exceptionnel,Ras,L accès assenceur avec les cartes !,"9,6",Appart'hôtel,Marseille," 8,1 "
Bouabdallah,Algérie,0,2018-11-29 00:00:00,Exellent,Le tout etait exellant personnel confort emplacement securite,Rien,"9,6",Appart'hôtel,Marseille," 8,1 "
Marie,France,1,2018-11-27 00:00:00,Exceptionnel,"Personnel très à l'écoute, qui n'hésite pas à se déplacer pour aider les résidents à utiliser les appareils. Petite cuisine très bien équipée qui permet de préparer quelques repas. Balcon donnant sur la porte d'Aix (et au loin la mer) équipé d'une table et de chaises pour profiter du soleil et prendre les repas. Excellente literie, propreté irréprochable et gare à moins de 5 minutes. Proche aussi des transports (métro, bus de nuit, tram).",Rien : tout m'a semblé très satisfaisant.,"9,6",Appart'hôtel,Marseille," 8,1 "
Annick,France,0,2018-11-21 00:00:00,"très bon séjour, l'emplacement de l'établissemnt parfait. Avons beaucoup apprécié le balcon","L'emplacement, l'amabilité du personnel, la praticité du studio",Le ménage pourrait être un peu plus méticuleux,"9,6",Appart'hôtel,Marseille," 8,1 "
Oiknine,France,0,2018-11-18 00:00:00,Bien ,"Proximité gare et université
Bon rapport qualité prix
Chambre spacieuse et propre","Très bruyant de part la faible isolation entre les chambres
Vaisselle dans la cuisine pas très propre 
Petit dej un peu cher pour la qualité et la quantité","7,5",Appart'hôtel,Marseille," 8,1 "
Jacky,France,0,2018-11-15 00:00:00,Agréable,emplacement idéal prêt de la gare et du métro. hôtel très calme avec chambre sur une cours intérieur.,"la moquette du couloir allant aux chambres sale, le canapé dans la chambre a besoin d’être changé,sale avec taches sur les accoudoirs et assises.","6,7",Appart'hôtel,Marseille," 8,1 "
Jaaifar,France,0,2018-11-14 00:00:00,Bien ,None,Suite à mon arrivée et départ tardif la direction était complètement désagréable à m’annonçant monsieur je vous facture une nuit supplémentaire je suis désoler dans le milieu de l’hôtellerie vos adapté parfois au client!! Et de plus en me disant ici on es à Marseille!! Vaudrait revoir le personnel de ce jolie appart hôtel 😡😡😡,"7,9",Appart'hôtel,Marseille," 8,1 "
Nathalie,France,0,2018-11-14 00:00:00,Fabuleux ,La chambre avec terrasse,Le lavabo de la salle de bain était bouché. J'aurai pu le signaler mais je commençais tôt mes journées et finissais tard,"9,2",Appart'hôtel,Marseille," 8,1 "
Zain,Algérie,0,2018-11-13 00:00:00,agreable séjour;,"ce qui est important à mes yeux,c'est l'abscence de mauvaises surprises qui pourrait desagrementer le séjour;et c'est le cas;tout est a sa place.","le ménage;il ne se fait qu'une fois par semaine;je pense que c'est nettement insuffisant,méme si c'est plutot un studio qu'une chambre;","7,9",Appart'hôtel,Marseille," 8,1 "
Omar,Algérie,0,2018-11-12 00:00:00,Superbe,Situation et confort.,Tout etait correct,"8,8",Appart'hôtel,Marseille," 8,1 "
Patrick,Belgique,0,2018-11-10 00:00:00,Marseille est une ville à voir,"Hôtel très calme.
Chambres modernes",None,"9,2",Appart'hôtel,Marseille," 8,1 "
Ali,Algérie,0,2018-11-10 00:00:00,Séjour magnifique.,"En gros le calme ( sauf le matin), le wifi, la cuisine +++, la vue depuis le balcon, la situation géographique.",Le bruit du bon matin de la rue juste en face ( très dérangeant +++).,"8,3",Appart'hôtel,Marseille," 8,1 "
Stéphanie,Guyane française,0,2018-11-09 00:00:00,Très bon hôtel bien équipé,Belle chambre bien équipée bonne situation géographique et le personnel très gentil à recommander,None,"9,2",Appart'hôtel,Marseille," 8,1 "
Ahmed,Maroc,0,2018-11-09 00:00:00,A part cet incident tout était parfait,None,"Le comportement du collaborateur assurant l accueil la nuit du 6 novembre
qui a été inacceptable et devant témoins
Il s'est même permis de crier qu'il était raciste 
Et tout ça pour un tire bouchons qui m'a été prêté par votre charmante et serviable collaboratrice le même soir","8,8",Appart'hôtel,Marseille," 8,1 "
Frédérique,France,0,2018-11-09 00:00:00,Bien ,"Croissants pas chauds....
Améliorer les produits du petit déjeuner",None,"7,0",Appart'hôtel,Marseille," 8,1 "
Liomar,France,0,2018-11-06 00:00:00,Nous avons apprécié notre séjour.,"L'hôtel est bien situé entre la gare et le vieux port.
La possibilité de garer la voiture dans un box fermé pour 10 euros la nuit, prix correct.
La nuit très calme .","Le studio est petit et convient pour une ou 2 nuits.
La salle de bains vieillotte a besoin d'être rafraîchie, traces d'humidité au plafond.
Le petit coin cuisine est pratique mais il manque une petite table pour manger.","7,0",Appart'hôtel,Marseille," 8,1 "
Jean-philippe,France,1,2018-06-26 00:00:00,Trois excellentes nuits pour assister au GP de France de Formule 1 pour pas cher !,"Nous avons seulement utilisé l'appartement pour y coucher, car notre fils réside à Marseille et nous avons pris les repas à son domicile où il ne pouvait pas nous loger. L'emplacement est très central, facile d'accès et l'accueil est chaleureux. L'appartement est très bien équipé, toutefois il ne dispose pas de la clim mais d'un ventilateur. Le rapport qualité-prix est toutefois excellent !","L'absence de clim' dans une ville aussi chaude, même si le ventilateur nous a bien soulagé.",10,Appart'hôtel,Marseille," 7,1 "
Nunzio,France,0,2020-05-18 00:00:00,Agréable,La placemo,Le service pas tres confortablme,"6,0",Appart'hôtel,Marseille," 7,1 "
Florence,France,0,2020-03-09 00:00:00,Très bien,"Chambre spacieuse.
Kitchenette.",Manquait éponge et produit pour nettoyer la kitchenette alors que mentionné dans le descriptif....,"8,0",Appart'hôtel,Marseille," 7,1 "
Aliyah,France,0,2020-03-08 00:00:00,Top,L’établissement était encore mieux en vrai qu’en photo!,L’emplacement,"8,3",Appart'hôtel,Marseille," 7,1 "
Lénica,France,0,2020-03-02 00:00:00,Très bien,"J’ai aimé l’emplacement tout proche du métro avec Escalator, la literie qui était confortable, l’équipement du studio qui a tout pour faire à manger (même si je ne m’en suis pas servi). 
L’emplacement est dans un quartier populaire, et l’établissement fait aussi office d’hôtel social. Je suis ravie de pouvoir participer financièrement à la vie de ce genre d’établissement, mettant à disposition de personnes des équipements dignes de ce nom.
J’ai beaucoup apprecié le personnel, toujours disponible et agréable (J’ai hésité à prendre une nuit de plus, mais avant de donner une réponse définitive, le personnel c’était arrangé pour que ce soit possible si je le prenait). Particulièrement le réceptionniste de nuit, avec qui j’ai pu parler un peu, et qui sans le savoir a vraiment changer une facette de mon séjour par ses mots.","Rien de grave, mais le bac de douche qui inonde la salle de bain, et l’absence de cendrier au rdc devant la porte.","8,3",Appart'hôtel,Marseille," 7,1 "
Sebastien,France,0,2020-03-01 00:00:00,Bien ,La chambre mériterait un coup de peinture et remplacement du rideau de douche.,None,"7,0",Appart'hôtel,Marseille," 7,1 "
Raphael,France,0,2020-02-26 00:00:00,Super sejour,Le personnel au top le petit dejeune tres correct et le parking super car les places se stationnement sont larges ce qui permet pour ce qui ont une voiture assez grosse de bien se garer on reviendra,Qu une personne fasse sonner l alarme a 4 h du matin car il fume dans sa chambre,"8,0",Appart'hôtel,Marseille," 7,1 "
Sylvie,France,0,2020-02-15 00:00:00,Très bien,L accueil et les conseils avisés du directeur adjoint christos.,None,"8,0",Appart'hôtel,Marseille," 7,1 "
Christine,France,0,2020-02-03 00:00:00,Très bien,L emplacement pret de la salle de spectacle le silo et des docks nous a permis de tt faire à pieds.,"La salle de bain a besoin d une rafraîchissement : moisissures, rideau de douche vieux.","8,0",Appart'hôtel,Marseille," 7,1 "
Antoine,France,0,2020-01-26 00:00:00,Agréable,None,hôtel en travaux bâches au sol odeur de peinture dans le couloir .,"6,0",Appart'hôtel,Marseille," 7,1 "
Stéphanie,France,0,2020-01-25 00:00:00,une nuit fort sympathique mais trop de cafard,tout était parfait sauf trop de cafard,traiter pour les cafard,"6,0",Appart'hôtel,Marseille," 7,1 "
Celine,France,0,2020-01-20 00:00:00,"Pour le prix, rien n'a dire !!","Rapport qualité prix, imbattable, pour 41 euros la nuit, on ne peut attendre mieux, personnel très agréable, l’hôtel bien que idéalement situé pour une visite touristique, nous avons été un peu troublé par la proximité directe d'une zup, avec tout ce que cela engendre, et heureusement que nous avions réservés une place de parking, car sinon, nous n'aurions jamais laissé notre voiture garée en extérieur et aurions du trouver un autre hôtel. Literie confortable, le + volet roulant, le - quand on prend une douche, la salle de bain se retrouve inondée...","- la bac a douche inexistant = inondation de la salle de bain!
- hôtel quasiment accolé à une zup","6,0",Appart'hôtel,Marseille," 7,1 "
Hodati,France,0,2020-01-16 00:00:00,Bien ,Dans l’ensemble sa aller.,les rideaux ainsi que les murs étaient dans un sale état de même que la plaque de cuisson,"7,0",Appart'hôtel,Marseille," 7,1 "
Marie,France,0,2020-01-01 00:00:00,Très bien,"le petit déjeuner très bien et à volonté 
literie confortable 
à proximité du centre ville",None,"8,0",Appart'hôtel,Marseille," 7,1 "
Brigitte,France,0,2019-10-12 00:00:00,Agréable,Le service (le personnel d'accueil est très aimable et professionnel) et le parking,Le quartier et la proximité des appartements quand on ouvre les volets. On se retrouve à côté du balcon des voisins...,"6,2",Appart'hôtel,Marseille," 7,1 "
Sofia,France,0,2019-10-07 00:00:00,Bon séjour dans l ensemble,"L'accueil, c etait assez confortable, le style de l hotel la télé","Les couvertures avaient des tâches. Manque de petit échantillons pour le prix de l'hôtel. Pas assez de serviette pour deux personnes, rideaux casser et trouer. Faudrait mettre plus de prises à coter du lit","7,1",Appart'hôtel,Marseille," 7,1 "
Zélie,France,0,2019-10-04 00:00:00,Prix attractif du à l’emplacement très peu agréable.,L’attention du personnel.,Le système de douche n’était pas pratique. La première douche a « inondé » la salle de bain.,"6,7",Appart'hôtel,Marseille," 7,1 "
Marius,Guadeloupe,0,2019-09-30 00:00:00,Bien,Situation géographique,RAS,"7,0",Appart'hôtel,Marseille," 7,1 "
Samed,France,0,2019-09-30 00:00:00,Passable,Proximité,Salle de bain,"6,7",Appart'hôtel,Marseille," 7,1 "
Corinne,France,0,2019-09-27 00:00:00,Bien ,"L appartement est très bien, calme",Quartier très populaire. Il est impératif de demander un parking pour dormir tranquille,"7,1",Appart'hôtel,Marseille," 7,1 "
Christele,France,0,2019-09-27 00:00:00,Bien ,"Malgré l'heure tardive, le personnel était à l'écoute et disponible.",La poussière sur le ventilateur. Le reste était très correct.,"7,5",Appart'hôtel,Marseille," 7,1 "
Gérard,France,0,2019-09-25 00:00:00,quartier un peu glauque mais pratique,parking ideal et tarif abordable,entretien et équipement studio,"6,2",Appart'hôtel,Marseille," 7,1 "
Meriem,France,0,2019-09-20 00:00:00,Bon rapport qualité prix,Proximité métro,Les mur de la chambre sont sale,"7,1",Appart'hôtel,Marseille," 7,1 "
Florian,France,0,2019-09-19 00:00:00,Moyen,Le concept pratique d un appart hotel,"- ustensiles cuisine ne correspondaient pas a la liste affichee dans le placard
-rideaux chambre sales et troues
-declenchement sans raison de l alarme incendie pendant la nuit
-hotel mal insonorise","7,5",Appart'hôtel,Marseille," 7,1 "
Emilie,France,0,2019-09-17 00:00:00,"Hôtel avec un bon rapport qualité - prix : bon marché, équipement basique. OK pour une nuit.","Chambre et salle d'eau spacieuses
Petit déjeuner copieux
Le ventilateur dans la chambre permet de choisir entre la chaleur et le bruit.","Bruit de vibration dans la chambre qui m'a contrainte à dormir avec des boules Quies
Décoration spartiate
Problème au moment de la sortie du parking : trop peu de temps après avoir bipé, avant la re-fermeture du portail. J'ai calé et je suis restée coincée dans le parking. J'ai dû remonter à la réception pour demander un nouveau badge, ce qui m'a fait arriver en retard à ma réunion du matin.","6,7",Appart'hôtel,Marseille," 7,1 "
Emilie,France,0,2019-09-17 00:00:00,Très bien,"Le personnel d’une gentillesse incroyable, a l’écoute et serviable ! 
Le parking ultra sécurisé et au tarif plus que donné !",- le quartier dans lequel se trouve cet hôtel,"8,3",Appart'hôtel,Marseille," 7,1 "
Vérakhay,France,0,2019-09-16 00:00:00,Bien ,L'accueil très agréable,L'environnement,"7,5",Appart'hôtel,Marseille," 7,1 "
Jean-marc,France,0,2019-09-16 00:00:00,Prestations bas de gamme pour résidence hôtel qui se la joue...,"Le personnel est vraiment serviable et ça fait plaisir. Ils ont tous été charmants et prevenants pendant mon séjour.
Le quartier est très populaire (pour combien de temps encore vu toutes les transformations en cours, même gênantes parfois pour se déplacer y compris à pied ?) et proche du vieux port (une vingtaine de minutes à pied). Vraiment sympa j'ai trouvé, même si pauvre et mal entretenu actuellement.","Quand les équipements fonctionnent correctement , ce qui est rare, on se rend bien compte qu'il s'agit, pour les opérateurs de cet établissement, d'avoir payé le moins cher possible pour des équipements qui ne valent donc rien. Bas de gamme, la chasse d'eau qui ne marchait pas ou l'éclairage de la salle de bain, tellement indigent qu'une femme ne pourrait même pas s'y maquiller. Pas de climatisation dans les chambres, en été, à Marseille, c'est évidement inutile. La rue très bruyante car des travaux partout. L'ascenseur, un seul pour tout l'établissement qui a quand même 8 étages et au moins une bonne dizaine de chambres par étage minimum est tellement lent que j'ai pris l'escalier à chaque fois. Les portes qui s'ouvrent avec des cartes magnétiques sauf que la carte marche quand elle veut...
Les chambres sont tristes et mal conçues. 
De plus, la notion de ""Park hôtel résidence"" permet de ne pas faire les chambres (changer les serviettes ni rien) pendant le séjour du client. Mais par contre, le prix n'est pas moins cher qu'un hôtel (de base) où le service existe lui.
Bref même à ce prix, ça frise l'insulte au client je trouve.","5,8",Appart'hôtel,Marseille," 7,1 "
Assouad,France,0,2019-09-15 00:00:00,calme spacieuse accessibilité pas loin du centre-ville,la tranquillitér,"r,à,s","7,1",Appart'hôtel,Marseille," 7,1 "
Yann,France,0,2019-09-12 00:00:00,Agréable,"Établissement très propre, contraste avec le quartier pas très attirant.
Le personnel était très agréable et serviable.","Il faisait trop chaud malgré une température extérieure de 20 degré.
Il y avait un ventilateur mais il fonctionnait très mal.","6,7",Appart'hôtel,Marseille," 7,1 "
Hinda,France,0,2019-09-10 00:00:00,Bien ,"Etablissement propre, calme, à proximité du transports en communs ,le personnel est sympa:-)","manque des tasses, et serviettes de douche, si non c'est bien dans l'ensemble ;;","7,9",Appart'hôtel,Marseille," 7,1 "
Mk,France,0,2019-09-01 00:00:00,Agréable,Rien de particulier,"Pas de clim dans la chambre. 
Pas bien insonorisé.
Douche à l'italienne mais mal conçu","6,7",Appart'hôtel,Marseille," 7,1 "
Aginegi,France,0,2019-08-26 00:00:00,Bien ,L'emplacement,"Le personnel, l'emplacement, la propreté RAS 
Revoir la façon de ventiler la chambre car il a fait très chaud et le brasseur d'air pas efficace.","7,1",Appart'hôtel,Marseille," 7,1 "
Aurélie,France,0,2019-08-26 00:00:00,Bien ,La situation la propreté et l accueil,Pas de clim ! Dur en pleine canicule,"7,5",Appart'hôtel,Marseille," 7,1 "
Virginie,France,0,2019-08-25 00:00:00,Correcte sans plus,"La situation géographique.
Les transports avec le métro National et arrêt de bus en bas de l'établissement.",L'établissement ne bénéficie pas de climatisation dans l'appartement. Il a été donc très difficile de dormir et la rue étant passante jour/nuit difficile d'ouvrir la fenêtre.,"7,9",Appart'hôtel,Marseille," 7,1 "
Helene,France,0,2019-08-25 00:00:00,Très bien,Bon accueil. Personnel très sympathique. Établissement bien situe proche du metro,None,"8,3",Appart'hôtel,Marseille," 7,1 "
Inès,France,0,2019-08-25 00:00:00,Décevant,La salle de bain et l’emplacement (près des terrasses),"Pas de climatisation, quartier médiocre, draps troués","6,2",Appart'hôtel,Marseille," 7,1 "
Fridoline,France,0,2019-08-23 00:00:00,C'est globalement bien. Les serviettes bain et les draps ne sont changés qu'une fois la semaine.,L'accueil du personnel,Fuite d'eau dans la salle de bain. Du plafond de la salle de bain il y a une fuite d'eau qui vous tombe dessus quand vous faites vos besoins.,"6,7",Appart'hôtel,Marseille," 7,1 "
Sebastien,France,0,2019-08-21 00:00:00,Bien ,"Le métro a côté, et le réceptionniste.","Les punaises dans la douche, et le frigo.","7,1",Appart'hôtel,Marseille," 7,1 "
Emmanuel,France,0,2019-08-19 00:00:00,Bien ,Chambre bien équipée et propre,Le quartier pas top,"7,5",Appart'hôtel,Marseille," 7,1 "
Wassim,France,0,2019-08-16 00:00:00,Moyen,"Résidence proche du centre ville
parking
Station de métro est juste en face 
personnel compétent",l'absence de la climatisation,"7,9",Appart'hôtel,Marseille," 7,1 "
Fa,France,0,2019-08-13 00:00:00,Trop chaud,None,La salle de bain,"6,2",Appart'hôtel,Marseille," 7,1 "
Valerie,France,0,2019-08-08 00:00:00,Agréable,RAS,pas de clim - l'enfer :(,"6,7",Appart'hôtel,Marseille," 7,1 "
Brigitte,France,0,2019-08-04 00:00:00,Bien ,"Accueil, disponibilité du personnel","Éclairage salle de bains défectueux, absence de climatisation","7,5",Appart'hôtel,Marseille," 7,1 "
Lulu,France,0,2019-08-01 00:00:00,Agréable,Personnelle très gentil et à l'écoute. La proximité du métro,"Les odeurs dans les couloirs et la chaleur dans la chambre, pas de clim et pas d'air...","6,7",Appart'hôtel,Marseille," 7,1 "
Yamina,France,0,2019-08-01 00:00:00,Une fois pas deux.,L'accueil et la situation géographique.,"Pas de climatisation. Chaleur insupportable de jour comme de nuit. Ventilateur qui tourne H24 le bruit vous empêche de dormir correctement.
Pas d'aération, rideaux encrassé par la poussière, vitres très sales.
Literie inconfortable.","5,8",Appart'hôtel,Marseille," 7,1 "
Eric,France,0,2019-07-24 00:00:00,C'est correct juste pour dormir,Le lit était bien,Manque de climatisation,"6,7",Appart'hôtel,Marseille," 7,1 "
Fitanete,Suisse,0,2019-07-24 00:00:00,Cool,"L’emplacement de l’hotel 
Le parking sous terrain",L’ecoulement De l’eau du plafond de la douche,"7,5",Appart'hôtel,Marseille," 7,1 "
