nom,pays,favorite,date,titre,bons_points,mauvais_points,note,type_etablissement,lieu,note_etablissement
Léa,France,0,2020-05-28,Médiocre ,Plein de cafard,None,"2,0",Appart'hôtel,Marseille," 7,1 "
Tony,France,0,2020-05-18,Exceptionnel,L’accueil et le calme de appartement,Le calme,10,Appart'hôtel,Marseille," 7,1 "
Philippe,France,0,2020-04-27,Surpris de votre comportement,None,Qu'on me facture la chambre alors que j'avais prévenu que l'on pouvais pas se déplacer pour cause de Covid 19 bravo pour votre honnêteté ....,"1,0",Appart'hôtel,Marseille," 7,1 "
Patrick,France,0,2020-04-01,"Au mauvais endroit, au mauvais moment...",None,Pas trop d'effort à l'égard des clients ayant réservé pour huit jours et obligés de partir à mi-parcours.,"5,0",Appart'hôtel,Marseille," 7,1 "
Jean-yves,France,0,2020-03-19,Mauvais,None,"L'intégralité de la réservation encaissée alors que je n'ai pu me rendre à Marseille et que j'ai prévenu. 
Inadmissible compte tenu des circonstances actuelles.","1,0",Appart'hôtel,Marseille," 7,1 "
Hafida,France,0,2020-03-13,Bof,La chambre propre a cote un carrefour market et des places ou se garer,Pas équipements bebe alors que cest écrit quil ya et une seule personne a la réception pas dispo et dépassée et une taxe a payer alors que pas écrit sur le site,"5,0",Appart'hôtel,Marseille," 7,1 "
Mohamed,France,0,2020-03-04,Très déçu,None,La propreté est à revoir canapé avec plein de taches on a trouvé un poil sur le lit fait et nous avons étais très très déçus par le lit parapluie que l’on nous a apporté il etaittt simplement degueulasse avec des taches de crasses partout et une épluchure d’orange trouvé à l’intérieur en l’ouvrant c’est vs dire!!,"3,3",Appart'hôtel,Marseille," 7,1 "
Lijie-,France,0,2020-03-02,Médiocre ,Accueil pas agréable,None,"2,0",Appart'hôtel,Marseille," 7,1 "
Sophie,France,0,2020-02-29,Catastrophiques,Rien malheureusement,"Nous sommes arrivés dans un hôtel en travaux sans être averti au moment de notre réservation, le logement été plus que vétuste des câbles électriques apparant, moisissures pas d'isolation des fenêtres, sans parler de la propreté du logement .
L'ensemble du logement été humide avec de mauvaises odeur , des poils et des taches dans la draps. Nous espérions passé un agréable moment en famille, au final nous ne sommes resté qu'une seule nuit et avons changer d’hôtel. J'ai fait part de mon mécontentement à la responsable de l'établissement et je n'étais pas le seul mais bien évidement il faut faire parvenir un courrier au site pour faire par de cette situation depuis j'exige un remboursement car j'ai séjourné une nuit et payé pour 3 nuits sans parler de la note qui s'est allongée pour me reloger , J ATTENDS TOUJOURS UN RETOUR!!!!!","1,0",Appart'hôtel,Marseille," 7,1 "
Sylvaine,France,0,2020-02-25,Passable,None,Le bruit extérieur,"5,0",Appart'hôtel,Marseille," 7,1 "
Naourese,France,0,2020-02-23,Passable,"L’appartement était propres, on a eu le balcon qu’on voulait","Les travaux qui n’ont pas était signalée lors de la réservation, le parking souterrain payant, et les mauvaises odeurs dans les couloirs.","5,4",Appart'hôtel,Marseille," 7,1 "
Isabelle,Belgique,1,2018-08-23 00:00:00,"Vivre des bonheurs simples, il n'y a que ça de vrai!",Très bon petit-déjeuner. Confort et bien insonorisé. Accueil très chaleureux du personnel. Je ne manquerai pas de le recommandé à mes proches!,"Quelques difficultés avec les pass électroniques, mais sans gravité car le personnel était toujours disposé à nous aider!",10,Hôtel,Marseille," 7,0 "
Julie,France,0,2020-03-14 00:00:00,Bien ,L’emplacement et l’équipement,"L’accueil d’une des jeunes femmes de l’après-midi : pas souriante, fait mine de se contenir par l’agacement que lui procure ma demande et lorsque je lui indique que ma carte n’ouvre plus la chambre...
Isolement des chambres : voisins et voiture","7,1",Hôtel,Marseille," 7,0 "
Christine,France,0,2020-03-09 00:00:00,Agréable,L'amabilité du personnel,L'État de la salle d'eau laisse à désirer et le vitrage vraiment très sale,"6,0",Hôtel,Marseille," 7,0 "
Richard,France,0,2020-03-03 00:00:00,l'offre a répondu à mon attente dans un cadre magnifique.,"l'efficacité, la disponibilité et le professionnalisme de l’équipe.",None,"8,0",Hôtel,Marseille," 7,0 "
Kevin,France,0,2020-02-24 00:00:00,Agréable,None,Certain équipement fonctionnais pas,"6,7",Hôtel,Marseille," 7,0 "
Baouchi,France,0,2020-01-30 00:00:00,Très bien,L accueil le confort,None,"8,0",Hôtel,Marseille," 7,0 "
Isabelle,France,0,2020-01-10 00:00:00,Bien,Changer de chambre facilement,Rien,"7,0",Hôtel,Marseille," 7,0 "
Anne-marie,France,0,2020-01-08 00:00:00,Très agréable,"Le lit très confortable...
Le petit déjeuner copieux",Refaire les peintures des chambres,"8,0",Hôtel,Marseille," 7,0 "
Andre,France,0,2020-01-02 00:00:00,Bien ,sa situation à côté de l'hôpital nord et à la sortie de l'autoroute,None,"7,0",Hôtel,Marseille," 7,0 "
Eric,France,0,2019-12-30 00:00:00,Très bien,"Hotel bien placé, facile d'accès ,bien signalé.Personnel aimable.Conforme aux standards ""Campanile"".","Chambre froide à notre arrivée. Il a fallu beaucoup de temps pour réchauffer la pièce.
T.V. qui revient à l'écran d'accueil toutes les 30 minutes.","8,0",Hôtel,Marseille," 7,0 "
Bebeheureux,France,0,2019-12-29 00:00:00,Agréable,"L'emplacement était idéal par rapport à l'objectif de notre séjour.
Literie très confortable.","Les sanitaires étaient un peu vétustes 
Le personnel d'entretien passe bcp trop tôt( 9h30)!!","6,2",Hôtel,Marseille," 7,0 "
Natacha,France,0,2019-12-11 00:00:00,Voyage de nécessité et non de confort !,Le petit déjeuner très copieux et la proximité géographique de l'hôtel par rapport à mon travail,L'insonorisattion très mauvaise avec lexterieure et entre les chambres ( sachant que j'avais précisé vouloir une chambre au calme lors de ma réservation). Le personnel du soir au restaurant peu agréable. La literie trop dur. Le ménage de SDB ( wc ) laisse à désirer. Un sèche cheveux aurait été un plus.,"6,0",Hôtel,Marseille," 7,0 "
Barbara,France,0,2019-12-06 00:00:00,Bien ,Propre et bien insonorisé,Un peu cher pour un établissement de passage dans un quartier plus que populaire,"7,1",Hôtel,Marseille," 7,0 "
Bruno974,La Réunion,0,2019-11-23 00:00:00,Marseille,Les repas.,Propreté moquette. salle de bain vieillot. Chambre en face des chariots de femme de menage,"5,8",Hôtel,Marseille," 7,0 "
Anne,France,0,2019-11-17 00:00:00,Agréable,None,"chambre insonorise 
petit déjeune un peu cher pour 1 café et une viennoiserie 9.90€","6,0",Hôtel,Marseille," 7,0 "
Sandrine,France,0,2019-11-12 00:00:00,Bien situé,"Sinon le déjeuner bien. 
Chambre : il confortable","Pas de chauffage dans la chambre,nous avons prévenu aussi top .
Le lendemain il nous ont changé de chambre. 
Parking surveillé 
Pas de grille pain.","7,0",Hôtel,Marseille," 7,0 "
Francis,Belgique,0,2019-10-30 00:00:00,on reviendrat pour nos prochaine croisiere a cet hotel,emplacement extra a 100m de la sortie de l autoroute a 5 du port d embarquements croisières on a eu la chance d avoir 1 chambre a l arrière d un blocs qui donnait sur le terrain de pétanque donc chambres au calme suis pas sur que cela soit le cas quand on est situé a l avant,pour nous rien,"8,0",Hôtel,Marseille," 7,0 "
Marie-claude,France,0,2019-10-21 00:00:00,Séjour correct sans plus.,Abords de l'hôtel bien aménagés. Beaucoup de verdure. Places pour stationner près des logements.,Qualité du petit déjeuner très moyenne. Personnel du matin peu accueillant.,"5,8",Hôtel,Marseille," 7,0 "
Gilles,France,0,2019-10-19 00:00:00,Bon ,Personnel sympathique,"Propre, mais pas dans les coins, emplacement bruyant.","5,8",Hôtel,Marseille," 7,0 "
Eric,France,0,2019-10-17 00:00:00,Agréable,None,La chaleur dans la chambre avec la clim qui n est la que pour faire du bruit du coup si tu ouvre la fenêtre tu a les joies sonore de l autoroutes,"6,2",Hôtel,Marseille," 7,0 "
Derumaux,France,0,2019-09-26 00:00:00,Idéal pour acceder à l'hôpital Nord,"Petit déjeuner très bien, restaurant conforme à tous les Campaniles, personnel très à l'écoute.
Proximité de l’hôpital Nord",Les chambres sont un peu défraichies mais propres.,"8,3",Hôtel,Marseille," 7,0 "
Nassera,France,0,2019-09-25 00:00:00,Agréable,None,L’odeur du tabac froid...nous somme non fumeur donc désagréable,"6,2",Hôtel,Marseille," 7,0 "
Monique,Maroc,0,2019-09-23 00:00:00,regrette que la direction n'est pas tenu compte de nos remarques sur la saleté entre nos 2 séjours,la situation géographique par rapport à ce que nous avions à faire sur Marseille,"la saleté des chambres aussi bien le 9 septembre que les 21 et 22 septembre, photos ci après des rebords de fenêtres , du bord de la table où sont posé les tasses et nécessaire pour faire du thé ou café, et sur la feuille blanche ce que j'ai ramassé sur quelques cm2 du sol de la salle de bain le 21 septembre","5,8",Hôtel,Marseille," 7,0 "
Delphine,France,0,2019-09-22 00:00:00,Agréable,L’accueil des 2 jeunes femmes au restaurant hier soir,La vétusté des chb et sdb.,"6,2",Hôtel,Marseille," 7,0 "
Guy,France,0,2019-09-14 00:00:00,Bien ,le petit déjeuner était parfait,"il n'y avait pas de brosse pour nettoyer la cuvette des toilettes
le son de la télévision était défectueux","7,1",Hôtel,Marseille," 7,0 "
Bina,France,0,2019-09-13 00:00:00,Bien ,Le personnel et l'emplacement de l'hôtel.,Le petit-déjeuner et boisson hors de prix,"7,9",Hôtel,Marseille," 7,0 "
Valérie,France,0,2019-09-11 00:00:00,"Comme tous les Campanile, ces hotels sont accueillants mais vieillissants et très mal isolés",Amabilité du personnel,Tous les Campanile ont le même problème : L'isolation très insuffisante des chambres!!!! L'impression d'être avec les voisins !,"7,1",Hôtel,Marseille," 7,0 "
Christophe,Belgique,0,2019-09-10 00:00:00,comme è l'habitude: reposant...,le service et le cadre .,hotel qui veillit un peu ( ca fait des années que je le fréquente....),"7,9",Hôtel,Marseille," 7,0 "
Jonathan,France,0,2019-09-05 00:00:00,None,Ce commentaire n'apparaît pas car il ne respecte pas notre charte.,None,"5,8",Hôtel,Marseille," 7,0 "
Gasycar,France,0,2019-09-04 00:00:00,Reposant,Rien à redire,Repos,"6,2",Hôtel,Marseille," 7,0 "
Magalie,France,0,2019-08-29 00:00:00,Trois nuits au Campanile,La gratuité du parking. Hôtel situé à proximité d'arrêt de bus et commerces de proximité.,Hôtel bruyant. Manque de confort dans les chambres. Porte difficile à fermer. Prix de la formule repas le soir.,"5,8",Hôtel,Marseille," 7,0 "
Jean,France,0,2019-08-28 00:00:00,Bon ,moyen,None,"5,8",Hôtel,Marseille," 7,0 "
Kouibi,France,0,2019-08-26 00:00:00,passable,"Le personnel, le petit déjeuner",La saleté de la chambre et de la salle de bain,"6,7",Hôtel,Marseille," 7,0 "
Christine,France,0,2019-08-26 00:00:00,Bien ,Petit déjeuner buffet sympa,None,"7,9",Hôtel,Marseille," 7,0 "
Sabrina,France,0,2019-08-25 00:00:00,Bon ,Le calme,Pas de frigo ou de sèche cheveux dans la chambre. Et la chambre un peu petite pour 2 personnes. Idéale pour juste dormir et passer ses journées en visites.,"5,8",Hôtel,Marseille," 7,0 "
Isidore,France,0,2019-08-23 00:00:00,Bien ,Accès facile pour le parking coin assez tranquille,Pas de balayette dans les toilettes le lit qui grince,"7,1",Hôtel,Marseille," 7,0 "
Max,France,0,2019-08-22 00:00:00,Agréable,None,Difficultés pour sortir le matin a 4h30 attente et appel a plusieurs reprises,"6,7",Hôtel,Marseille," 7,0 "
Benoît,France,0,2019-08-19 00:00:00,Le séjour était agréable l'hôtel est bien situé.,Nous n'avons pas déjeuner à l'hôtel.,La literie mauvaise qualité. Il faut qu'il pense à rafraichir la salle de bain les joints sont sale.,"6,2",Hôtel,Marseille," 7,0 "
François,France,0,2019-08-19 00:00:00,Bon ,petit déjeuner minimaliste. le personnel juste poli ne devrait pas travailler en hôtellerie.,"l'établissement dit accepter les animaux ,mais nous nous sommes vus expulsés gentiment à l'extérieur, pas de problèmes le temps s'y prêtait , mais quand même","5,8",Hôtel,Marseille," 7,0 "
Olympique,France,0,2019-08-18 00:00:00,Agréable,Parking gratuit avec beaucoup de places,"Télécommande télé HS. 
Accueil loin avec monté et beaucoup de marche","6,7",Hôtel,Marseille," 7,0 "
Gyslaine,France,0,2019-08-18 00:00:00,Bien ,"le personnel est super 
le petit déjeuner y'a du choix et c'est bon",None,"7,5",Hôtel,Marseille," 7,0 "
Catherine,France,0,2019-08-18 00:00:00,Bien ,"L’emplacement était super (toute fois il vaut mieux être véhiculé), l’accueil et l’établissement plutôt bien. Très bon rapport qualité prix",None,"7,1",Hôtel,Marseille," 7,0 "
Medina,France,0,2019-08-16 00:00:00,Bien ,T’es bien placé avec parking gratuit,Vous nous avons eu qu’une seule serviette de douche dans la chambre,"7,1",Hôtel,Marseille," 7,0 "
Miloud,Belgique,0,2019-08-15 00:00:00,Bien ,L'emplacement,J'attends toujours ma facture,"7,1",Hôtel,Marseille," 7,0 "
Samir,France,0,2019-08-15 00:00:00,Agréable,None,Bien sans plus,"6,7",Hôtel,Marseille," 7,0 "
Eric,France,0,2019-08-15 00:00:00,Très bon hotel proche de l'aéroport,Très bien situé à quelques minutes de l'aéroport de Marseille Au calme malgré la proximité de l'autoroute,None,"7,9",Hôtel,Marseille," 7,0 "
Erwin,France,0,2019-08-15 00:00:00,Un bon séjour,Le coins jardin très agréable le soir,Horaires du bar aléatoire,"7,5",Hôtel,Marseille," 7,0 "
Norbert,France,0,2019-08-14 00:00:00,Agréable,None,bruyant (autoroute),"6,2",Hôtel,Marseille," 7,0 "
Nassim,France,0,2019-08-13 00:00:00,Bien,Le petits déjeuner était copieux,Les alentours de l’hôtel,"6,2",Hôtel,Marseille," 7,0 "
Laura,France,0,2019-08-12 00:00:00,Bien ,L’intérieur de la chambre était propre et l’hotel est très calme,"Nous avions réserver une chambre avec vu sur la ville et un lit double, nous avons eu 2 lits simple et nous avions la vu sur des escaliers qui menaient au linge sal, pas top","7,5",Hôtel,Marseille," 7,0 "
Stéphanie,Martinique,0,2019-08-11 00:00:00,Bon séjour,Bien placé. Personnel agréable,None,"7,1",Hôtel,Marseille," 7,0 "
Olivia,France,0,2019-08-11 00:00:00,Bon ,"Lit confortable
Juste à côté de l'entrée de l'autoroute
Bien desservi par les moyens de transport","Accueil long et pas très agréable.
Présence d'araignées
Serviettes de bain rêches
Pas canal, ni Bein
Pas d'ascenseur pour les valises pas top
Un peu bruyant
Déco très sommaire","5,8",Hôtel,Marseille," 7,0 "
Sophie,France,0,2019-08-07 00:00:00,Agréable,"La surface de la chambre, le confort dea literie et la proximité du parking pour surveiller la voiture","L'hôtel commence à sérieusement vieillir.
Remplacer la moquette m, refaire les peintures et changer les fenêtres pour un double vitrage plus performant semble indispensable.","6,2",Hôtel,Marseille," 7,0 "
Jean-marc,France,0,2019-08-06 00:00:00,Bien ,None,"Chambre pas assez insonorisée. 
Les conversations environnantes m ont empêché de dormir une bonne partie de la nuit.","7,9",Hôtel,Marseille," 7,0 "
Martine,France,0,2019-08-05 00:00:00,Rien à signaler conforme à mes attentes sans plus.,Possibilité de garer la voiture.,"J'ai réservé une chambre pour 1 adulte et 2 enfants, lorsque je suis arrivée la chambre était pour 2.
Une erreur de BOOKING.com m'a t'on dit.","6,7",Hôtel,Marseille," 7,0 "
Erwan,France,0,2019-08-03 00:00:00,Bien ,None,Chambre mal insonorise entre elles ...,"7,1",Hôtel,Marseille," 7,0 "
Aurélie,France,0,2019-08-02 00:00:00,Bon ,"Personnels de l’accueil agréable . 
Lit confortable","Propreté de la chambre médiocre ( poils dans le lavabo, ainsi que dans la douche). 
Pas de brosse à wc. 
Bouilloire rempli d’eau. 
Moquette sale.","5,8",Hôtel,Marseille," 7,0 "
Jean,France,0,2019-07-30 00:00:00,Bien ,Le buffet chaud était excellent . La chambre confortable.,Cde de la tele à mettre à côté de ma télé.,"7,9",Hôtel,Marseille," 7,0 "
Ghizen,France,0,2019-07-29 00:00:00,acceptable,None,le serveur au restaurant,"6,2",Hôtel,Marseille," 7,0 "
Jean,France,0,2019-07-23 00:00:00,Bon ,Petit déjeuner clim,Sdb archaïque tv passable,"5,8",Hôtel,Marseille," 7,0 "
Patricia,France,0,2019-07-22 00:00:00,Très bien,None,"Le bruit de l'autoroute proche, malgré notre demande de chambre plutôt au calme.","8,3",Hôtel,Marseille," 7,0 "
Perraud,France,0,2019-07-14 00:00:00,Agréable mais pas très exigeant sur le menage,Literie au top,Chambre pas faites à notre arrivees,"7,1",Hôtel,Marseille," 7,0 "
Raphaële,France,0,2019-07-14 00:00:00,Bien ,"Personnel agréable et compréhensif. 
Rapport qualité prix honnête","L’odeur de tabac dans la chambre , la climatisation qui fait beaucoup de bruit.","7,5",Hôtel,Marseille," 7,0 "
Annaëlle,France,0,2019-07-09 00:00:00,Agréable,"Le reste du personnel qui était très gentil et très agréable. 
Le petit-déjeuner était très bon beaucoup de choix.","Le personnel du samedi soir. Elle est antipathique, parle mal vraiment très désagréable.
Sur le linge de lit il y avait des taches marrons et dans la chambre on avait plein de fourmi.","6,2",Hôtel,Marseille," 7,0 "
Fabrice,France,0,2019-07-07 00:00:00,Bien ,Correct et bon petit déjeuner,Peu de choix au restaurant,"7,5",Hôtel,Marseille," 7,0 "
Gadhoum,France,0,2019-07-03 00:00:00,peu mieux faire,None,propreté et matelas affaissé,"5,8",Hôtel,Marseille," 7,0 "
Alain,France,0,2019-07-02 00:00:00,Séjour convenable mais qui devrait être amélioré !,"Le calme, malgré la proximité de l'A7,
La propreté de la chambre,
Le personnel assez disponible,
La situation pour rejoindre Marseille.","Chambre et sanitaires vétustes (ou fatigué !)
Abord du bâtiment (Ch 15) avec présence jour et nuit ce chariots de linge sale (désagréable et même potentiellement dangereux). 
Petit déjeuner moyen (rapport qualité/prix médiocre).","5,8",Hôtel,Marseille," 7,0 "
Armand,France,0,2019-07-01 00:00:00,Pratique de par la proximité de l'hopital,None,"Literie mauvaise
Des fourmies","6,2",Hôtel,Marseille," 7,0 "
Laura-c,France,0,2019-06-29 00:00:00,Bien ,Le personnel très aimable. La localisation hors du centre-ville et le parking,La chasse d'eau était a moitié cassée et le fait qu'on ne puisse pas verrouiller la porte de la chambre.,"7,1",Hôtel,Marseille," 7,0 "
Muriele,France,0,2019-06-28 00:00:00,Très bien comme d'habitude !,"La situation géographique, la terrasse, la gentillesse du personnel, l'accueil de Fabienne avec le sourire malgré l'arrivée d'un bus de touristes !",Mes voisines de chambre trop bruyantes ...,"8,0",Hôtel,Marseille," 7,0 "
Monique,Maroc,0,2019-06-23 00:00:00,"cadre agréable et calme , personnel agréable",la situation et le calme,"l'agencement de la salle des petits déjeuners, la machine à café et le distributeur de jus de fruits côte à côte et situé juste à côté de l'accès aux cuisines pour le personnel ce qui occasionnait un encombrement important","7,5",Hôtel,Marseille," 7,0 "
Lau,France,0,2019-06-21 00:00:00,Bien ,"L'emplacement, le restaurant, le parking",Une insonorisation des chambres pas terrible,"7,1",Hôtel,Marseille," 7,0 "
Sabrina,France,0,2019-06-21 00:00:00,AGREABLE,None,UNE DEUXIÈME MACHINE A CAFÉ,"5,8",Hôtel,Marseille," 7,0 "
Pascal,France,0,2019-06-16 00:00:00,Bon ,Le personnel,Les chambres pas très propres vétustes manque d’entretien petite déjeuner tables dehors pas propres buffet laissant à désirer le personnel n’alimentent pas lorsque qu’il manque des produits car pas assez vigilant le matin sur ce point dommage,"5,8",Hôtel,Marseille," 7,0 "
Mehida,France,0,2019-06-14 00:00:00,Agréable,A proximité du centre en voiture ..,Lit pas confortable dommage,"6,7",Hôtel,Marseille," 7,0 "
Bruno,France,0,2019-06-13 00:00:00,Correct pour 1 nuit,Literie confortable et pas de bruit malgré le nombre d occupants dans l hôtel.,Ce qui pourrait être amélioré est la diversité du buffet.un petit coup de jeune dans les peintures des chambres par exemple,"7,5",Hôtel,Marseille," 7,0 "
Muriele,France,0,2019-06-12 00:00:00,Bien ,La sympathie et le sourire du personnel ! Merci à Fabienne pour son accueil !,None,"7,9",Hôtel,Marseille," 7,0 "
Didier,France,0,2019-06-05 00:00:00,"sinon, bel emplacement et acceuil top","Bien, manque des fruits secs et fruits",Bruit des cars le soir qui laisse tourner le moteur pendant 1/2 h. Bruit autoroute à proximité. klaxon des bus le soir à 21H30,"7,5",Hôtel,Marseille," 7,0 "
Laetitia,France,0,2019-06-03 00:00:00,Très bien,"Accueil impeccable, chambre très propre et lit super confortable",None,"8,3",Hôtel,Marseille," 7,0 "
Florence,France,0,2019-06-02 00:00:00,bon hôtel pour court séjour,Emplacement idéal avec arrêt du bus à proximité pour aller en centre-ville,Pas de terrasse au bâtiment près des arbres.,"7,1",Hôtel,Marseille," 7,0 "
Roland,France,0,2019-05-23 00:00:00,Très bien pour ce que nous avions à y faire. Chambre correcte,l'accueil,"buffet de dîner triste et sans intérêt nous avons connus d'autres Campanile nettement meilleur.
Petit déjeuner sans véritable choix","8,3",Hôtel,Marseille," 7,0 "
Kristy,France,0,2019-05-20 00:00:00,correct mais je ne pense pas y retourner,"télé, volets électriques qui permet de bien s'isoler de la lumière, bouilloire et sachets de thé/café, grand lit, taille des chambres correcte, propre","- chambres très mal insonorisées! les clients du dessus ont parlé toute la nuit (jusqu'à 4h du matin) et j'avais l'impression qu'ils étaient devant ma porte, je n'ai pas fermé l’œil. en + les chambres donnent ur le parking... entre le sons et les odeurs de pot échappement...
- douche et wc dans la même pièce, ok mais la douche est juste a coté du wc, sans rideau et sans bac de douche, au même niveau du sol, on en met partout, pas pratique. pas de grande serviette de bain, juste serviettes de douches moyennes.
- le petit dej est trop cher pour la qualité et la diversité des produits, il devrait être proposé a 6,90€/pers.","6,7",Hôtel,Marseille," 7,0 "
Robert,France,0,2019-05-12 00:00:00,Agréable,"Emplacement pratique pour moi (concert au dome), petit dej' normal sans plus","Bruit de l'autoroute car pas de double vitrage.
Parking PMR réservé mais pas disponible
Pas de réponse à mes mails.
Bouilloire manquante dans la chambre (mais expresso offert à la place.","6,2",Hôtel,Marseille," 7,0 "
Sylvie,France,0,2019-05-12 00:00:00,Bien ,"Parking gratuit devant la chambre, bonne literie, petit dej simple mais complet, bouilloire dans la chambre, le wifi fonctionne bien.",Pas de sèche cheveux dans la salle de bains.,"7,1",Hôtel,Marseille," 7,0 "
Daniel,France,0,2019-05-11 00:00:00,Juste une nuit sans petit déjeuner carembarquement tôt pour une croisiere au départ du portdemarseil,"La position géographique par rapport au port.
L accueil des hotesses.
Le parking.","Etablissement qui commence a ""vieillir"" peinture, fenêtres, salle de bains (baignoire) moquette ....","7,1",Hôtel,Marseille," 7,0 "
Herve,France,0,2019-05-11 00:00:00,Hélas,L’emplacement,Petit déjeuner. Le matelas complètement usé j’ai dormi 3 heure car les ressorts et la ferraille vous rentrée dans le dos. Mal de dos la journée. Aucun geste de l’hôtel après leur avoir montrer. Juste. «  ah oui. En effet. L’équipe du campanile s’excuse ».,"5,8",Hôtel,Marseille," 7,0 "
Isidore,France,0,2019-05-10 00:00:00,Bien ,Personnel très sympathique et chambre propre,Plein de petites choses,"7,1",Hôtel,Marseille," 7,0 "
Nathalie,France,0,2019-05-07 00:00:00,Hôtel calme,Emplacement. Calme. Restaurant.,Odeur de tabac intense dans la chambre,"8,3",Hôtel,Marseille," 7,0 "
Molinie,France,0,2019-05-04 00:00:00,Bien ,None,"Le bruit - demandé sur booking une chambre au calme mais apparemment cela n'a pas été communiqué à l'établissement.
Dommage pour booking !","7,1",Hôtel,Marseille," 7,0 "
Julia,France,0,2019-04-30 00:00:00,Pratique et confortable pour une nuit.,"L'appartement était propre et fonctionnel, le lit confortable et le coin bouilloire avec sachets de thé apprécié!","Pour des appartements insonorisés, on entendait un peu trop les voisins. Puis il y avait une musique forte qui venait de je ne sais où à l'extérieur. Mais heureusement, tout était calme à partir de 22h.","7,9",Hôtel,Marseille," 7,0 "
Super,France,0,2019-04-30 00:00:00,Agréable,"Personnel d'accueil parfait, chambre correcte","Personnel d'entretien qui ne parlait que très peu le français. Cuisine""cantine""","6,7",Hôtel,Marseille," 7,0 "
Fleur,France,0,2019-04-24 00:00:00,Agréable,None,"La chambre était loin de l'accueil, beaucoup de marches entre les deux, le petit déjeuner pas terrible pour 10 euros, et surtout beaucoup, beaucoup de bruit","6,7",Hôtel,Marseille," 7,0 "
Chelly,France,0,2019-04-22 00:00:00,Hôtel convenable,"Personnel très agréable, hôtel facile à trouver avec de nombreuses places de parking disponibles, bon petit déjeuner","Joints de la douche et du lavabo en mauvais état, pas de brosse pour les wc, seulement 1 grande serviette par personne (pas de petite serviette..), chambre très bruyante avec la route à proximité","7,1",Hôtel,Marseille," 7,0 "
Marie,France,0,2019-04-16 00:00:00,Belle nuit de repos après s être couché tard en famille !!,La chambre très calme et agréable ainsi que le lit.,Rien,"7,5",Hôtel,Marseille," 7,0 "
Elisabeth,France,0,2019-04-16 00:00:00,agréable,Le petit déjeuner varié ainsi que dîner buffet a volonté pour un prix très correct.,None,"7,1",Hôtel,Marseille," 7,0 "
Laetitia,France,0,2019-04-10 00:00:00,Bien ,None,L environnement bruyant,"7,5",Hôtel,Marseille," 7,0 "
