nom,pays,favorite,date,titre,bons_points,mauvais_points,note,type_etablissement,lieu,note_etablissement
Gaelle,Chine,0,2019-08-16 00:00:00,Superbe,"L’emplacement est idéal. Les chambres sont joliment aménagées, la literie est très confortable.","Les équipements sont peu nombreux. Résidant en Asie et étant habituée à voyager je pense que les visiteurs étrangers doivent être étonnés de ne pas trouver un certain nombre de choses dans la salle de bains et la chambre (sèche-cheveux, lime à ongles, coffre...).","8,8",Hôtel,Nantes," 8,6 "
Jacqueline,France,0,2019-08-15 00:00:00,Parfait,L’hôte est idéalement situé. Propre et agréablement rénové. Le personnel est à l’écoute,Le parking est à proximité mais en rue piétonne pas facile avec les valises,10,Hôtel,Nantes," 8,6 "
Maïssa,France,0,2019-08-14 00:00:00,Joli découverte,"L'hôtel est bien situé, en plein centre ville, c'est idéal pour visiter Nantes ! L'accueil est chaleureux, la chambre est correcte en terme d'équipement. Propriété RAS, la salle d'eau est fonctionnelle et propre. Il y a un jolie écran TV dans la chambre. Nous avons également pu profiter d'une jolie vue sur Nantes. 
C'est une adresse que nous réutiliserons lorsque l'on reviendra à Nantes",L'ascenseur et les escaliers sont un peu aigu. Sinon RAS,"8,8",Hôtel,Nantes," 8,6 "
Regis,France,0,2019-08-13 00:00:00,Bien,Le confort de la literie la déco,Le petit déjeuner aurait pu être avec de meilleurs produits bio et locaux,"7,5",Hôtel,Nantes," 8,6 "
Karyne,France,0,2019-08-12 00:00:00,Exceptionnel,La gentillesse du personnel. Cet hôtel est très bien placé.,"La salle de bain : manque les supports pour accrocher les serviettes.
Le lavabo est petit.","9,6",Hôtel,Nantes," 8,6 "
Margaux,France,0,2019-08-12 00:00:00,Exceptionnel,"Le quartier, la décoration la propreté",None,10,Hôtel,Nantes," 8,6 "
Gilles,France,0,2019-08-12 00:00:00,Un must,"Le style, la déco,la situation, mais surtout l'accueil","Très bel hôtel, notre chambre était juste parfaite, un vrai sentiment d'être chez soi. Le personnel est très professionnel et vraiment à votre écoute, que ce soit la jeune femme qui nous a accueilli que le jeune homme à notre retour de dîner. Un grand merci à tous. Votre ville est très agréable et votre situation en plein centre est un plus, mais c'est bien vôtre accueil qui fait la différence.",10,Hôtel,Nantes," 8,6 "
Nolwenn,Royaume-Uni,0,2019-08-04 00:00:00,Exceptionnel,L’emplacement et le confort,Rien,10,Hôtel,Nantes," 8,6 "
Demarque,France,0,2019-07-30 00:00:00,Bon sejour,"Personnel accueillant, chambre joliment décorée et confortable, situation géographique très appréciable",Sur booking il y avait indiqué que la chambre disposait d’une baignoire et elle n’en n’avait pas,"7,9",Hôtel,Nantes," 8,6 "
Maelys,France,0,2019-07-30 00:00:00,Exceptionnel,"Le style de la chambre, très belle décoration et bel emplacement proche des commerces",None,10,Hôtel,Nantes," 8,6 "
Alain,France,0,2019-07-29 00:00:00,"Excellent. Très agréable. L'accueil, en particulier, était parfait.",Un seul regret : il n'y avait pas de confiture sur le plateau du petit-déjeuner en chambre,Il manque un bout de joint d'étanchéité à la porte de la douche de la chambre 206 ––> du coup l'eau s'écoule en partie dans la salle de bains !,10,Hôtel,Nantes," 8,6 "
Silvia,Suisse,0,2019-07-29 00:00:00,Exceptionnel,Personnel très sympathique et accueillant,None,10,Hôtel,Nantes," 8,6 "
Gerard,France,0,2019-07-20 00:00:00,Hôtel bien situé et cosy.,"L'accueil,le petit déjeuner,le calme et la situation géographique.",None,10,Hôtel,Nantes," 8,6 "
Winfried,Allemagne,0,2019-07-19 00:00:00,Exceptionnel,"Personnel très sympa, check in et out très simple, l'emplacement idéal pour la visite de Nantes.",None,"9,6",Hôtel,Nantes," 8,6 "
Isabelle,Suisse,0,2019-07-10 00:00:00,Exceptionnel,"La taille de la chambre. 
La localisation, le buffet du petit déjeuner et le service.",Dommage qu'il n'y ait pas de tablettes pour poser les trousses de toilette dans la salle de bain.,"9,6",Hôtel,Nantes," 8,6 "
François,France,0,2019-07-08 00:00:00,Exceptionnel,Calme et en centre ville,Néant,10,Hôtel,Nantes," 8,6 "
Nathalie,France,0,2019-07-08 00:00:00,Excelllent,"Localisation en plein centre-ville; personnel et accueil très professionnels; chambres très confortables.
Very central location downtown; highly professionnal staff and great welcoming; high quality rooms",Rien/ nothing,10,Hôtel,Nantes," 8,6 "
Emmanuelle,France,0,2019-07-07 00:00:00,Bien ,L'emplacement et le design comme lors du temps de l'hôtel Pommeraye.,"Quel dommage que l'ex hôtel Pommeraye fasse maintenant parti de cette grande chaîne...les prix ont considérablement augmenté alors que le confort est le même. D'accord, la salle du petit déjeuner est plus agréable mais la qualité du petit déjeuner est semblable...ceci justifie-t-il une hausse de 4,50 euros par petit-déjeuner??? C'est le dernier séjour pour moi à cet endroit car j'ai eu la chance de réserver avant le changement et de bénéficier des anciens prix. Quelle tristesse, c'était ma halte lors de mes passages à Nantes...","7,9",Hôtel,Nantes," 8,6 "
Patrick,France,0,2019-07-07 00:00:00,Exceptionnel,"Son emplacement dans le centre-ville, ses travaux d'embellissement, son personnel accueillant et empathique, très attaché à la satisfaction des clients.","La réservation de taxis, un fléau dans cette ville.",10,Hôtel,Nantes," 8,6 "
Véronique,France,0,2019-06-30 00:00:00,Fabuleux ,None,Petit-déjeuner bien mais moins bien qu'espéré compte tenu des attentes pour un Mercure,"9,2",Hôtel,Nantes," 8,6 "
Eric,France,0,2019-06-13 00:00:00,Fabuleux ,"Situation
Le silence (chambre à l’arriere)
Le confort et la deco des chambres",Salle de petit dejeuner trop petite,"9,2",Hôtel,Nantes," 8,6 "
Severine,France,0,2019-06-10 00:00:00,Une nuit à l'hotel mercure,Le pain très bon. Le gel douche qui sent très bon. La bouilloire avec du café près sur le bureau. La salle du petit dej très cosy.,"Le petit déjeuner un peu basique.
Les murs noirs dans la chambre.
La vue des chambres sur les toits très sales et avec des bâches dessus, très moches.","7,5",Hôtel,Nantes," 8,6 "
Régine,France,0,2019-06-10 00:00:00,Parfait !,"La literie est excellente et le petit déjeuner très bon.
Mais c'est sans compter la gentillesse du personnel de l'établissement qui est aux petits soins.
Un merci tout particulier à Romy et Sébastien !",Rien à dire,10,Hôtel,Nantes," 8,6 "
Thomas,France,0,2019-06-09 00:00:00,Emplacement Idéal pour du shopping en amoureux,"Pt déjeuner sous la verrière en pleine tempête bon souvenir.
Personnel très accueillant",None,"9,2",Hôtel,Nantes," 8,6 "
Valerie,France,0,2019-06-09 00:00:00,Exceptionnel,très bon lit très bon emplacement. personnel très attentionné,None,"9,6",Hôtel,Nantes," 8,6 "
Richard,États-Unis,0,2019-06-06 00:00:00,Très agréable et nous espérons y retourner.,"La chambre était très confortable, le petit déjeuner était délicieux et le personnel était poli et très sympathique.",None,10,Hôtel,Nantes," 8,6 "
Marcel,France,0,2019-05-30 00:00:00,Exceptionnel,L'accueil,Très content rien à reprocher,10,Hôtel,Nantes," 8,6 "
Véronique,France,0,2019-05-27 00:00:00,"Hotel de charme chaleureux, calme et confortable,","L' accueil chaleureux et personnalisé.
Le charme de l'hôtel, la décoration, le calme, le confort de la chambre,
son emplacement dans la vieille ville, la proximité des boutiques.",None,10,Hôtel,Nantes," 8,6 "
Yann,France,0,2019-05-26 00:00:00,Séjour agréable dans une chambre confortable,"Chambre confortable
Hotel calme
Bonne situation en plein centre","difficile d'accès
pas de parking
accueil dans le couloir, sur une table !!! (très bizarre et pas du tout en rapport avec le standing supposé d'un Mercure)
salle de petit déjeuner un peu triste, c'est pour cette raison que nous avons pris le petit déjeuner à l'extérieur","7,5",Hôtel,Nantes," 8,6 "
Fabrice,France,0,2019-05-20 00:00:00,Très bien,L'hôtel est parfaitement situé. Le personnel est très accueillant et professionnel.,"Les chambres sont petites. Parfait pour un cours séjour. L'espace ""Petit déjeuner"" est très (trop) proche du lobby.","8,3",Hôtel,Nantes," 8,6 "
Isabelle,France,0,2019-05-15 00:00:00,Excellet séjour dans un hôtel agréable très bien situé,"P'tit déj salé varié (œuf coque, œufs brouillés, saucisses, jambon, bacon, fromages, plusieurs pains ...) , chambre confortable, grande salle de bains, conseils avisés pour trouver de petits restaus sympas à proximité et pour visiter le centre ville, grande amabilité du personnel, situation au cœur des rues piétonnes mais aussi à proximité du tramway station ""médiathèque"". Bon rapport qualité/prix. Et en plus d'être chouchoutés, nous avons été surclassés.",Rien à dire de négatif,10,Hôtel,Nantes," 8,6 "
Milou56,France,0,2019-05-14 00:00:00,Exceptionnel,"Situation de l’hôtel au top, particulièrement appréciée ! 
Chambre confortable et joliment arrangée. Accueil impeccable.",None,10,Hôtel,Nantes," 8,6 "
Patricia,France,0,2019-05-12 00:00:00,Exceptionnel,Hotel idéalement placé très propre..et on remercie l l'équipe de nous avoir surclassé..chambre supérieure..avec équipements de haute qualité.. literie excellente..et le personnel très gentil très bonne équipe..et à l écoute des demandes du client..nous reviendrons sans hésitation..,None,10,Hôtel,Nantes," 8,6 "
Dredhwen,France,0,2019-05-11 00:00:00,Très bon petit hôtel,"Surclassement, le personnel très aimable et surtout +++ pour la nouvelle literie !",None,10,Hôtel,Nantes," 8,6 "
Nicolas,France,0,2019-05-07 00:00:00,Exceptionnel,None,carte accès à la chambre reprogrammé 3 fois.,"9,6",Hôtel,Nantes," 8,6 "
Frederic,France,0,2019-05-07 00:00:00,Exceptionnel,Situation de l'hôtel,Chambre petite,10,Hôtel,Nantes," 8,6 "
Magali,France,0,2019-05-05 00:00:00,Exceptionnel,"Accueil souriant et chaleureux. 
L hôtel est très bien situé pour découvrir le centre ville, parfait pour un couple.",None,10,Hôtel,Nantes," 8,6 "
Davigne,France,0,2019-05-05 00:00:00,Bien ,lieu chaleureux et calme,None,"7,9",Hôtel,Nantes," 8,6 "
Joel,France,0,2019-05-05 00:00:00,Bien ,"Chambre spacieuse,","Le prix du petit déjeuner, 15€/ personne.","7,9",Hôtel,Nantes," 8,6 "
Emeline,Andorre,1,2018-07-31 00:00:00,Exceptionnel,"la proximité de la gare (très pratique), en plein centre. 
L'amabilité du personnel à l'accueil.
La propreté. 
La bouilloire et la possibilité de se faire un petit café dans la chambre.",C'était parfait!,10,Hôtel,Nantes," 8,0 "
Elodie,France,0,2020-03-14 00:00:00,Bon hôtel,"L’arrivée tardive est bien aménagée, l’hôtel est calme. Le personnel est très sympathique et avenant.
Il y a un bon rapport qualité prix notamment lorsqu’on veut être près de la gare","En revanche un peu déçue sur la chambre qui est à peine éclairée (ce qui n’est vraiment pas pratique dès qu’il fait nuit). Les toilettes sont fixées bien trop haut, le lavabo était bouché et la douche fuit. Quelques petits défauts du genre qui font que les équipements de la chambre ne sont pas très soignés.","8,3",Hôtel,Nantes," 8,0 "
Benedicte,France,0,2020-03-13 00:00:00,Très bien,None,"Manque une savonnette pour le lavabo
Merci","8,0",Hôtel,Nantes," 8,0 "
Samia,France,0,2020-03-07 00:00:00,Un bon séjour,"L'emplacement de l'hôtel est pratique. Il est juste à côté de la gare, tram et château des ducs de Bretagne. 
Le personnel est souriant et accueillant.",Le petit déjeuner est délicieux mais il n'est pas varié.,"7,0",Hôtel,Nantes," 8,0 "
Gilbert,France,0,2020-03-05 00:00:00,Bien ,None,"C'est certes temporaire, mais l'étage était en travaux et des odeurs de produits m'ont incommodé.","7,0",Hôtel,Nantes," 8,0 "
Nathalie,France,0,2020-03-05 00:00:00,Très bien,"L'accueil
L'emplacement
Le petit dèj",Rien,"8,0",Hôtel,Nantes," 8,0 "
Marion,France,0,2020-03-04 00:00:00,Bien ,Très proche de la gare et accueil agréable.,La porte de la salle de bain qui ne se fermait pas.,"7,5",Hôtel,Nantes," 8,0 "
Florence,France,0,2020-03-02 00:00:00,Fabuleux ,l'accueil!!,None,"9,0",Hôtel,Nantes," 8,0 "
Anne,France,0,2020-02-29 00:00:00,Fabuleux ,tout le reste,petit problème avec la fermeture de la porte,"9,0",Hôtel,Nantes," 8,0 "
Catherine,France,0,2020-02-26 00:00:00,Fabuleux ,La chambre au 3 eme étage était spacieuse et la douche de bonne dimensions,None,"9,0",Hôtel,Nantes," 8,0 "
Catherine,France,0,2020-02-21 00:00:00,bon rapport qualité prix,"L accueil était attentionné
Le petit déjeuner excellent",La douche un peu petite,"8,0",Hôtel,Nantes," 8,0 "
Wersand,France,0,2020-02-21 00:00:00,"Séjour agréable,","Nous avons beaucoup aimé le design, décoration de la chambre qui nous faisait sentir à l'aise.
Également la réceptionniste présente le vendredi soir était sympathique et joviale.
Au niveau de la literie, celle-ci était confortable.","Nous n'avons pas apprécié le fait de ne pas pouvoir éteindre les lumières en gardant les petites lumières pour la lecture, soit c'était trop lumineux soit nous étions dans le noir. Il aurait été plus pratique, selon nous, de pouvoir éteindre les lampes de chevet sans éteindre les petites lumières, mais nous avons trouvé une solution à ce problème.
De plus il se trouve que la veilleuse de la télévision est très lumineuse, celle-ci nous a beaucoup dérangé pendant la nuit.","8,0",Hôtel,Nantes," 8,0 "
Marie,France,0,2020-02-19 00:00:00,Petit hôtel sympathique et bien situe juste un bloc pas de chauffage ds la sdb,La gentillesse du personnel,J ai retrouve 2fois chambre mal fermee,"8,0",Hôtel,Nantes," 8,0 "
Eric,France,0,2020-02-17 00:00:00,Fabuleux ,"L'emplacement est parfait, le petit déjeuner était très bien et la chambre correspondait à ce que j'espérais par rapport au prix. L'accueil fut très agréable.",None,"9,0",Hôtel,Nantes," 8,0 "
Xavier,France,0,2020-02-07 00:00:00,correct,"L'emplacement est bien, a côté de la gare, dans un quartier calme, l'accueil est important quand on fréquente régulièrement les hôtels, et je n'ai pas été déçu par celui-ci.","La salle de bain est petite, mais il est difficile de pousser les murs","7,0",Hôtel,Nantes," 8,0 "
Catherine,France,0,2020-02-06 00:00:00,Très bien,"Idéalement situé proche de la gare et du centre ville, 
Entrée rénovée - literie confortable - personnel accueillant",La moquette dans les chambres mériterait à être remplacée par du faux plancher,"8,0",Hôtel,Nantes," 8,0 "
Sonia,France,0,2020-01-31 00:00:00,Hôtel pour une petite escale à Nantes,"Hôtel très bien situé par rapport à la gare, dans une rue calme, sans charme particulier mais très propre (chambres récemment rénovées). Petit déjeuner à volonté. La vraie valeur ajoutée c’est le personnel d’accueil : agréable et professionnel.",Manque de déco dans la chambre. C’est un peu froid.,"8,3",Hôtel,Nantes," 8,0 "
Jean-marc,France,0,2020-01-28 00:00:00,Bien sans plus,None,"Salle de bain, ridicule presque impossible à entrer dans la douche ouverture trop petite avec le lavabo qui obstrue le passage, pas de bouteilles d'eau.","7,0",Hôtel,Nantes," 8,0 "
Auguste,France,0,2020-01-21 00:00:00,très bien,"propre,calme,",il faudrait dissocier les éclairages des têtes de lit,"8,0",Hôtel,Nantes," 8,0 "
Isabelle,France,0,2020-01-21 00:00:00,Très bien,L'accueil du personnel et la qualité du petit déjeuner.,"Pas beaucoup de vie dans la rue, c'est calme mais un environnement triste
Pour l'équipement le lavabo est un peu gênant pour accéder à la douche.
Un problème bruit avec le survol de la ville par les avions qui atterrissent","8,0",Hôtel,Nantes," 8,0 "
Dominique,France,0,2020-01-20 00:00:00,merci,"l'emplacement, disponibilité du personnel",le standing,"9,0",Hôtel,Nantes," 8,0 "
Sanâa,France,0,2020-01-20 00:00:00,Bien ,None,la propreté de la salle de bain,"7,0",Hôtel,Nantes," 8,0 "
Dominique,France,0,2020-01-19 00:00:00,Bien ,"Belle déco, belle chambre, à deux pas du centre ville. A 2 min à pied de la gare et du jardin des plantes. Personnel aimable. Bonne literie et grande propreté de la chambre. Gestion des serviettes ""écologique"" (un présentoir spécial permet de prendre uniquement les serviettes dont vous avez besoin. Celles que vous n'utilisez pas vont au suivant, ainsi moins de lessive, moins d'eau...).","L'eau de la douche vraiment pas très chaude, voire froide. C'est pas super agréable surtout un matin d'hiver!","7,0",Hôtel,Nantes," 8,0 "
Soniapls,France,0,2020-01-19 00:00:00,Parfait,"Situation parfaite : dans une petite rue au calme, à quelques minutes à pied de la gare et du centre ville. Personnel très agréable. Petit-déjeuner copieux.",None,"8,0",Hôtel,Nantes," 8,0 "
Cécile,France,0,2020-01-19 00:00:00,Bien ,"Endroit propre, personnels agréables et comprehensif sur les contraintes horaires",Les toilettes sont surélevés ce qui n'est pas pratique quand on est petit,"7,0",Hôtel,Nantes," 8,0 "
Alicia,France,0,2020-01-18 00:00:00,retour prevu,emplacement bien le petit dej satisfaisant,bruits des autres chambres pas assez isolé,"8,0",Hôtel,Nantes," 8,0 "
Martin,France,0,2020-01-16 00:00:00,Très bien,None,Chambre correct personnel accueillant et souriant,"8,0",Hôtel,Nantes," 8,0 "
David,France,0,2020-01-15 00:00:00,t bien,tout était bien,l'heure du début du petit dejeuner à 7 h ne permet pas pour un départ avant de pouvoir prendre un café. Au moins der pouvoir avoir un café sans rien d'autre serait une bonne idée,"7,0",Hôtel,Nantes," 8,0 "
Sonia,France,0,2020-01-14 00:00:00,Fabuleux ,"Accueil, aide à l'orientation, chambre propre, service très satisfaisant, bon emplacement.",Une mauvaise connexion TV. Un peu de bruit.,"9,0",Hôtel,Nantes," 8,0 "
Thierry,France,0,2020-01-10 00:00:00,Idéal pour découvrir le centre ville de Nantes.,"Le petit dèjeûner est vraiement top !
Le personnel de l'accueil est très aimable et donne les conseils pour sortir (pub, resto).
La situation est idéale.",Rien,"8,0",Hôtel,Nantes," 8,0 "
Oumi,France,0,2020-01-10 00:00:00,Fabuleux ,Tout,"Malheureusement pas de chauffage ? Mais une couverture de plus à disposition , heureusement","9,2",Hôtel,Nantes," 8,0 "
David,France,0,2020-01-09 00:00:00,Très bien,Propreté - hôtel en général.,Juste un pb de lumière principale qui ne fonctionnait pas. Eclairage avec salle de bain et lampe de bureau. 1paterne au Porte manteau cassé dans salle de bain. Ch 304.,"8,0",Hôtel,Nantes," 8,0 "
Pauline,France,0,2020-01-09 00:00:00,séjour professionel agréable dans l'ensemble,"Séjour dans le cadre d'un déplacement professionnel, la localisation proche de la gare est donc très bien. 
De plus le rapport qualité/prix est bien également. 
Le personnel de l'hôtel est très accueillant, gentil et prompt à aider.",None,"7,0",Hôtel,Nantes," 8,0 "
Eric,France,0,2020-01-07 00:00:00,Fabuleux ,"L'accueil la jeune femme très sympa.la chambre confortable,superbe salle de bain . Literie confortable et spacieuse.Prix très correct",Il manquait une grande serviette de toilette,"9,0",Hôtel,Nantes," 8,0 "
Mohammed,France,0,2020-01-05 00:00:00,Bon accueil et bon séjour .,Confortable et propre.,None,"7,0",Hôtel,Nantes," 8,0 "
Laurent,France,0,2020-01-05 00:00:00,"Bon hôtel, agréable à 2 pas du centre ville, personnel très compétent.","Personnel très compétent, accueillant.
Bonnes prestations rapport qualité prix.",La décoration de la chambre. Propre mais des couleurs chatoyantes et plus de décoration seraient une valeur ajoutée.,"8,0",Hôtel,Nantes," 8,0 "
Anne,France,0,2019-12-30 00:00:00,visite a des amis Nantais qui ne pouvaient m heberger,"surclassee dans tres grande chambre
familiale. confort lit et grande couette","temperature de la salle de bain Decembre
joint bac a douche a reparer eau s ecoulait par le bas du panneau vitre","8,0",Hôtel,Nantes," 8,0 "
Madininaexodus,France,0,2019-12-28 00:00:00,Les plus,"Petit gâteau, Thé et café offerts 
Douche très sympa. Lit confortable",La chambre paraît plus grande sur les photos,"8,3",Hôtel,Nantes," 8,0 "
Wailbenmalek,Maroc,0,2019-12-19 00:00:00,Bien ,None,"La chambre est très propre, très bien équipée, mais reste comme même trop petite (celle de 40 euros la nuit), sinon le chauffage, la TV, l'eau chaude tout est parfait, cet hotel peut être idéal que si vous êtes de passage pour 2 nuit maximum, ou si vous trouvez une chambre plus grande dans l'établissement, le seul bémol reste finalement le métrage.","7,0",Hôtel,Nantes," 8,0 "
Francesco,France,0,2019-12-18 00:00:00,Bien ,"Petit déjeuner, chambre, douche","Dans la chambre 201 : cuvette de WC ridiculement haute (plus que la norme handicapé), une fois assis les pieds sont à 10 cm du sol (je mesure 1,73 m). Pas de place pour poser ses affaires dans la salle de bains, vasque pas pratique 
Bref salle de bain conçue par quelqu’un qui ne s’est pas mis à la place de l’utilisateur","7,9",Hôtel,Nantes," 8,0 "
François,France,0,2019-12-18 00:00:00,Excellent rapport qualité/prix,"Excellent accueil. Personnel disponible, souriant et à disposition. Chambre calme et confortable. Bon petit-déjeuner.",None,"9,0",Hôtel,Nantes," 8,0 "
Sophie,France,0,2019-12-17 00:00:00,dans l'ensemble je recommanderai cet hotel car je m'y suis sentie bien.,"L'emplacement geographique de l'hotel est bien.
mais pas la rue de nuit : la facade de l'hotel, son entree ne paye pas de mine et etant arrivée de nuit mon impression premiere etait plutot du genre (bof c'est ça mon hotel?)
En revanche rien a redire l'hygiene y est presente de partout, des que la porte principale de l'hotel est passée, tout est nickel chrome, vraiment, c'est une maniaque qui le dit!
La décoration générale de l'hotel est plaisante aussi, d'ou mon choix.
petit dejeuner bien, le jambon etait plus de l'epaule que du jambon blanc, et etait tout mouillée (nitrates et autres sels), petite attention le journal du jour a ma table choisi, j'adore...
une tv allumée pour les actualités un peu fort de bon matin (7h) personnellement
petit dejeuner sympa pour le prix demander.
le personnel est vraiment super sympa, et bienveillant...
Je garde bon souvenir dans l'ensemble.
Merci à vous","- J'avais laisser mon gros bagage coller a la porte de ma chambre lorsque j'ai réalisé l'impossibilité de verrouillée celle-ci! 
- Lorsque j’avais voulu ouvrir mon lit tout le linge de lit est venu dans le geste, , j'ai donc refait le lit.... car tout s’était défait jusqu'au matelas, lorsque j'avais voulu préparée mon lit a mon couché... (revoir la technique de finition/pliage du drap matelas et du reste du linge de lit pour en rendre l'ouverture plus aisée au client, afin d’éviter a celui-ci d’être amener a refaire en partie son lit avant de se coucher!)
- Je n'ai pas apprécier du tout le fait d'avoir a me lever de mon lit a mon couchée et a mon réveille aussi, pour me rendre à l'interrupteur à l’entrée de la chambre, afin d' éteindre les lumières!
les lumières de la tête de lit ne pouvant ni être allumées ni être éteintes depuis le lit, uniquement depuis l'interrupteur à l’entrée de la chambre!","7,0",Hôtel,Nantes," 8,0 "
Caroline,France,0,2019-12-14 00:00:00,100% satisfaite !,"Hôtel très bien situé (entre la gare et le centre ville), accueil chaleureux, personnel disponible, chambre jolie et très propre.",None,"9,0",Hôtel,Nantes," 8,0 "
Christian,France,0,2019-12-11 00:00:00,Très bien,"Le confort de la chambre, le mpetit-déjeuner correct, l'amabilité du personnel",Rien,"8,0",Hôtel,Nantes," 8,0 "
Murielle,France,0,2019-12-03 00:00:00,"Pour un séjour de quelques heures, ravie de l’hébergement, à un tarif défiant toute concurrence !","L'hôtel est situé à 5 min à pied de la gare, dans un quartier très calme. Le personnel est serviable, et à l'écoute (arrivée tardive dans la nuit , aucun souci pour accéder à la chambre). 
Bonne surprise, surtout par rapport au tarif de la chambre !","Une couette serait optimum !
La robinetterie de la douche (ch 106) doit être modifiée (bouton cassé), cela n'empêche en rien le bon fonctionnement de la douche.","8,0",Hôtel,Nantes," 8,0 "
Joel,France,0,2019-11-27 00:00:00,Très bien,l'emplacement et la tranquillité de l'hôtel,La porte de la salle de bain ne fermait pas bien.,"8,0",Hôtel,Nantes," 8,0 "
Jean-luc,France,0,2019-11-27 00:00:00,Bien ,None,"Murs de la chambre pas propre
Petit déjeuner cher au regard de ce qui est proposé","7,1",Hôtel,Nantes," 8,0 "
Chantal,France,0,2019-11-24 00:00:00,"confort , heureuse de revenir pour les visites et revoir le personnel","super emplacement , proche gare , rue calme , proche centre et tram , chambre confortable et propre , personnel très agréable","le petit déjeuner , je dois faire attention et limiter le sucre et les viennoiseries , pas assez de choix au niveau du salé , dommage","8,0",Hôtel,Nantes," 8,0 "
Fabienne,France,0,2019-11-24 00:00:00,Très bien,Calme et propreté,None,"8,0",Hôtel,Nantes," 8,0 "
Camille,France,0,2019-11-24 00:00:00,Fabuleux ,"Personnel très sympa, bon petit déjeuner et bien placé à côté de la gare. Nous avons passé un très bon séjour.",None,"9,2",Hôtel,Nantes," 8,0 "
Veronique,France,0,2019-11-23 00:00:00,bien pour un déplacement professionnel,"proximité de la gare et du centre ville.amabilité du personnel.rapport qualité prix, propreté","chambre mansardée un peu petite . Petit déjeuner très cher à 9,50€","7,0",Hôtel,Nantes," 8,0 "
Dominique,France,0,2019-11-18 00:00:00,Bien ,Personnel sympathique.L’accueil et la salle de déjeuner sont agréables Les chambres sont sobres mais propres et surtout situées au calme. Il y ce qu'il faut très bon rapport qualité/prix,ras,"7,0",Hôtel,Nantes," 8,0 "
